,Press,Title,Text
0,한국경제TV,"'코로나 대유행' 현실화…방역당국 ""모임 취소해달라"" 호소[종합]","사진=연합뉴스                        국내 신종 코로나바이러스 감염증(코로나19)이 전국 각지에서 빠르게 퍼져나가고 있다. 기존 집단발병 사례에서 확진자가 추가로 발생하고 있고, 크고 작은 새로운 감염도 터져나오고 있다. 방역당국은 일상을 멈추고 방역에 집중할 때라면서 가급적 모든 모임을 취소해달라고 당부했다. 전국 곳곳서 코로나19 확진자 속출28일 중앙방역대책본부(방대본)에 따르면 이날 낮 12시 기준 서울 어플소모임 관련 누적 확진자는 22명으로 집계됐다. 이 중 모임 참석자가 17명이고 이들의 가족과 지인이 5명이다. 강서구의 댄스·에어로빅학원 사례에서는 접촉자 조사 과정에서 26명이 추가로 확진됐다. 누적 확진자는 155명이다. 수강생이 72명, 종사자가 3명, 추가 전파 사례가 80명이다.중구 상조회사와 관련해선 2명이 추가로 양성 판정을 받아 지금까지 총 17명이 감염됐다. 동료간 회식모임을 통해 가족·지인으로 추가 전파가 일어난 것으로 추정된다. 중랑구 체육시설 2번 사례에선 5명이 추가돼 누적 확진자가 18명으로 늘었고, 송파구 사우나와 관련해선 5명의 추가 감염이 확인돼 누적 확진자는 14명으로 집계됐다.서초구 사우나 2번 사례에서도 5명이 추가 확진돼 현재까지 총 63명이 양성 판정을 받았고, 마포구 홍대새교회와 관련해선 11명이 더 확진돼 총 135명의 감염자가 나왔다.  관련기사 ""코로나 첫 발생 인도·방글라데시일지도""…또 남 탓하는 중국일상 곳곳에서 코로나19 확진…걷잡을 수 없는 '3차 유행'[속보] ""무증상·경증·소아 확진자 재택치료 방안 의료계와 협의중"" [속보] ""코로나19 중대기로…연말까지 가급적 모든 모임-약속 취소해야""[속보] 전북 익산시 원광대병원 관련 7명 추가 확진…누적 46명[속보] 충북 청주시 당구장 선후배모임 관련 누적 확진자 22명으로 늘어[속보] 충북 제천시 김장모임 관련 누적 확진자 25명으로 늘어[속보] ""요양병원 등 감염취약시설 일제검사서 현재까지 총 100명 확진""[속보] 인천 남동구 동창모임 관련 누적 확진자 11명으로 늘어[속보] 경기도 연천 신병교육대 관련 누적 확진자 71명으로 늘어  경기 화성시 지인모임과 관련 지난 21일 첫 확진자가 나온 뒤 총 15명이 감염됐다. 지인모임에서 처음 시작된 감염이 학원·직장으로 퍼졌고, 이후 가족·지인 등으로 번진 것으로 보인다.경기 연천군 육군 5사단 신병교육대 사례에선 1명이 추가돼 누적 확진자가 71명으로 늘어났다. 인천 남동구 동창모임과 관련해선 지난 18일 첫 확진자가 발생한 뒤 모두 11명이 감염됐다. 비수도권에서도 확산은 지속하고 있다. 강원 홍천군 공공근로와 관련해서도 지난 26일 첫 환자 발생 후 11명이 연이어 양성 판정을 받아 지금까지 총 12명의 확진자가 나왔다.충북 제천시 김장모임 사례에선 11명이 추가돼 총 25명이 확진됐다. 방대본은 지난 14일과 15일 2가구의 일가족이 김장모임을 했고, 이어 17일에도 지인과의 김장모임이 있었다면서 일가족이 방문한 식당으로까지 감염이 전파됐다고 추정했다.청주시 당구장 선후배 모임 사례에선 4명이 추가로 양성 판정을 받아 총 22명이 감염됐다. 전북 익산시 원광대병원과 관련해선 7명의 추가 감염이 확인돼 누적 확진자가 46명으로 불어났다.부산·울산 장구강습 사례에서도 2명이 추가돼 지금까지 총 91명이 확진됐고, 경남 창원시 마산회원구 단란주점 사례에선 2명이 추가 양성 판정을 받아 누적 확진자가 24명으로 늘었다.                            사진=뉴스1 방역당국 ""가급적 모든 모임 취소"" 당부방역당국은 이번 사태를 진정시키기 위해 연말까지 가급적 모든 모임과 약속을 취소할 필요가 있다고 강조했다.임숙영 중앙방역대책본부 상황총괄단장은 이날 코로나19 현황 정례브리핑에서 ""지금은 잠시 일상을 멈추고 가족과 이웃의 안전, 그리고 수능 수험생들의 안심을 위해 방역에 집중해야 하는 중대한 기로""라고 강조했다.이어 ""'사회적 거리두기'의 효과가 나타나기 전까지는 당분간 지금 수준의 발생 규모가 이어질 것""이라며 ""국민 여러분이 자발적으로 위험 행동을 하나하나 줄여주셔야만 반전이 가능한 상황""이라고 말했다.그러면서 ""연말까지 가급적 모든 모임과 약속을 취소해 주시기 바란다""며 ""특히 식사와 회식은 감염전파 위험이 높아 자제하는 것이 바람직하고, 이번 주말 종교행사와 약속, 모임 등도 비대면으로 전환하거나 취소해달라""고 당부했다.당국은 환자가 급격히 증가해 병상이 부족해질 것을 대비, 무증상·경증 환자가 자택에 머물며 증상을 관리하게 하는 '자가치료'도 구체적으로 검토하고 있다.자가치료는 병원이나 시설에 가지 않고 자택에서 격리된 상태로 증상을 관리하는 방법으로 해외에서는 광범위하게 활용되고 있으며, 국내에서도 시행 근거는 마련된 상태다.임 총괄단장은 ""자가치료는 확진자가 폭증하는 상태에서 병상 부족이 우려될 때 도입할 수 있을 것으로 생각한다""면서 ""젊은 무증상 또는 경증 환자를 대상으로 시·군·구 보건소가 모니터링하고 증상이 악화하면 병원 이송을 담당하는 체계를 검토 중""이라고 설명했다.그는 ""주거 형태에 대해서는 세밀한 검토가 필요하고, 가정 내 전파를 어떻게 차단할 것이냐가 중요하다""면서 ""예외적으로 소아에 대해서는 보호자와 함께 자가치료를 할 수 있도록 하는 방안도 검토 중""이라고 밝혔다.이송렬 기자 yisr0203@hankyung.com"
1,한국경제TV,"방역당국 ""코로나 역학조사 한계…감염경로 미상 약 20%""","5일 오전 서울 광진구 건국대학교에서 2021학년도 수시모집 논술고사를 마친 수험생과 가족들이 학교를 나서고 있다. 사진=연합뉴스                        방역당국이 앞으로 신종 코로나바이러스 감염증(코로나19) 확산세가 더 커질 수 있다고 우려했다.임숙영 중앙방역대책본부 상황총괄단장은 5일 온라인 정례 브리핑에서 ""코로나19 확산세가 좀처럼 꺾이지 않고 있다""면서 ""최근 1주간 일평균 국내발생 확진자 수는 487.9명으로, 전주 대비 80여 명이 늘어난 상태""라고 했다.임 단장은 ""그간 지역사회에 잠재된 감염이 누적돼 있어 아직까지는 (거리두기 격상의) 효과가 충분히 나타나고 있지 않은 것으로 보인다""면서 ""지난주 감염 재생산 지수는 1.4 수준으로, 이는 환자 1명이 1.4명 정도를 감염시키고 있다는 의미다. 이 지수를 1 이하로 낮추지 못하면 유행의 크기는 계속 커질 것으로 예상한다""고 했다.  관련기사 [속보] ""지난주 코로나 재생산지수 1.4…유행규모 점차 커질 듯""[속보] 부산·울산 장구강습 관련 7명 추가…누적 177명 확진[속보] 순천향대 부속 부천병원 관련 누적 확진자 25명으로 늘어 [속보] 서울 송파구 탁구장 관련 누적 확진자 22명으로 늘어[속보] 서울 강남구 콜센터 관련 14명 추가 확진…누적 28명[속보] 서울 강서구 댄스교습 관련 9명 추가 확진…누적 249명[속보] 서울 중구 콜센터 관련 누적 확진자 9명으로 늘어[속보] 서울 영등포구 부동산업체 관련 누적 확진자 28명[속보] 서울 구로구 보험사 관련 누적 확진자 20명으로 늘어서울 코로나 확진자 '1000명당 1명' 넘었다  임 단장은 방역당국의 역학조사가 사실상 코로나19 확산 속도를 따라가지 못하고 설명했다. 임 단장은 ""중앙과 지방자치단체에서 모든 역량을 총동원해 접촉자 추적에 나서고 있지만, 감염 확산의 규모가 크고 사례가 너무 많은 것이 사실""이라며 ""감염경로를 조사 중인 사례(불분명 사례)도 약 20% 정도로, 이는 전주와 비교하면 증가하는 추세""라고 전했다.                            코로나 검사.  [사진=연합뉴스]                        임 단장은 이번 3차 유행은 1·2차 유행 때와 달리 '중심 집단'이 없이 곳곳에서 확산하는 새로운 양상을 보이고 있다고 설명했다.임 단장은 이번 3차 유행의 확산세가 완전히 꺾일 때까지 모임을 취소하고 이동을 자제해 달라고 당부했다.임 단장은 특히 대학수학능력시험(수능) 이후 실시되는 대학별 면접·논술 시험과 관련해 ""이달 첫째 주와 둘째 주에는 수도권 대학에 전국의 수험생이 집중됨에 따라 이를 통한 감염의 위험이 있는 것으로 보인다""면서 ""수능이 끝난 뒤에도 친구나 지인 간 모임은 잠시 미루고 안전하게 수능 이후의 일정을 준비해달라""고 했다.김명일 한경닷컴 기자 mi737@hankyung.com"
2,한국경제TV,"KBS 긴급방역, 사내 코로나 확진자 발생","                        KBS가 확진자 발생에 따라 긴급방역을 실시했다고 밝혔다. 1일 KBS는 ""누리동(신관부속건물)에 근무하는 직원 1명이 오늘 코로나19 양성 확진 판정을 받았다""고 밝혔다. 이어 ""이같은 사실을 보고 받은 즉시 긴급 대응 회의를 열어 누리동에서 근무하는 직원들에 대해 내일 오전까지 재택근무를 실시하도록 했다""고 전했다.   관련기사 정부 ""수능일 새벽 코로나 확진돼도 병원 입소해 응시 가능"" [종합]中 '코로나 거짓말' 꼬리 잡혔다…CNN, 내부 기밀문건 폭로일본, 모더나 백신 2500만명분 확보…한국은 계약 전무 여야, 558조 예산안 합의…3차 지원금 3조·백신 9000억 [종합]유니레버, 뉴질랜드서 '주4일 근무제'…코로나 시대 실험EPL, 코로나 검사서 10명 추가 감염…2주 만에 '또' 두 자릿수모더나, 코로나 백신 긴급사용 신청에 20% '급등'코로나19에도 흑자 낸 에어비앤비, IPO 대박 거둘까英총리 ""크리스마스 전 코로나 백신 승인 기대""코로나 백신, '12월의 선물' 될까…""이르면 다음주 공급""   또한 ""누리동 건물 전체에 대한 긴급 방역을 실시하고, 확진자와 접촉한 직원 전원은 코로나19 검사를 받도록 조치했다""며 ""KBS는 역학조사관의 조속한 현장조사를 요청했으며, 향후 보건 당국의 조치에도 적극적으로 협조할 예정""이라고 전했다. 김소연 한경닷컴 기자 sue123@hankyung.com기사제보 및 보도자료 newsinfo@hankyung.com"
3,한국경제TV,확진자 수에만 매달리는 방역…언제까지 이렇게 할 건가 [여기는 논설실],"                        오늘부터 수도권에서 사회적 거리두기가 다시 2단계로 격상됐다. 신규 감염자 수가 지난주 계속 300명을 넘나들면서 이미 어느 정도 예상된 결과이기는 하지만 국민들 사이에서는 코로나 피로감이 그 어느 때보다 높은 것 같다.무엇보다 자영업자들의 타격이 이루말 할 수 없는 지경이고 일반 시민들도 짜증이 절로 날 정도다. 마스크 안끼면 과태료를 물어야 하는데다 오늘부터 서울시에서는 연말까지 10명 이상 집회도 금지됐다. 서울에서는 지하철 시내버스 등 대중교통 운행 횟수도 줄어든다.방역 필요에 따른 것이라는 모르는 이는 별로 없겠지만 이 정도면 이제 사람들이 서서히 지쳐 가는 국면에 접어든 것도 같다. 한국인이 코로나에 대한 공포를 가장 많이 느낀다는 조사가 있을 정도로 한국사람들은 코로나에 유독 민감하다. 마스크를 전 세계에서 가장 철저하게 써왔던 것도 어찌보면 남한테 피해를 주기 싫다는 생각도 있지만 ""내가 걸리면 어쩌지?""하는 공포가 더 크게 작용했다고 봐도 과언이 아니다.  관련기사 TPP가입을 '바이든 시대' 美·中·日 관계정립의 도구로 삼자는데 [여기는 논설실]서울시장 선거 與 최대 골칫거리 된 부동산 [여기는 논설실] [여기는 논설실] 일본 언론 통해 日 정부 '속마음' 읽기 ""삼성물산 주식 사자""…이건희 별세한 날, 어느 부부의 대화 [여기는 논설실]중국 턱밑에 미사일 배치한 대만의 뚝심 [여기는 논설실][여기는 논설실] 주식양도세 대주주 기준이 뭐길래대통령의 선택적 지시 [여기는 논설실] 의원들의 고성과 윤석열의 '낮은 호통'이 남긴 것들 [여기는 논설실]정치는 어떻게 먹이사슬 정점을 장악했나[여기는 논설실]라임펀드 첫 보도 때 경험한 '이상한 로비' [여기는 논설실]  그런데 요즘 주변을 보면 그런 공포감조차 만성화되고 짜증을 내는 사람들이 늘어가는 것도 같다. 그도 그럴 것이 올해 3월부터 시작돼 이제 8개월이 넘게 계속되는 사회적 거리두기와 그에 따른 생활 불편이 거의 인내의 한계에 도달했기 때문이 아닌가 생각된다.      확진자 수에만 매달리는 방역 정부는 확진자 숫자에 주로 매달리며 이게 많이 늘면 방역단계를 높이고 줄면 낮추고 하는 듯 하지만 이마저도 명확한 원칙이나 일관성이 있는 것 같지도 않다. 무엇보다 중요한 것은 코로나 방역을 하고 거리두기를 하는 이유가 치명적 감염자 발생을 막는다는 것인데 지금의 정부의 방역지침은 오직 확진자 숫자를 줄이려고만 하는 듯하다. 사회적 거리두기 단계만 해도 1단계와 1.5단계 2단계 등으로 나누지만 무슨 거리두기에 소숫점까지 필요한 지도 의문이다. 단계별로 무엇이 금지되는 지에 대해 직접적인 이해관계자가 아닌 한, 정확히 아는 사람도 적지만 알려고 들려는 사람도 많지 않은 것 같다. 사람들이 코로나 공포에 다소 시큰둥 해진 것은 해외에서 들불 번지듯 한 코로나 확산세가 그나마 국내에서는 그리 심하지 않은데다 정부의 방역이 지나치게 정치적 편향성을 띤데 따른 반발감도 작용하고 있지 않나 싶다. 개천절 한글날 집회를 앞두고 대통령 총리부터 시작해 그렇게 집회자들에게 엄포를 놓고 버스로 차단벽까지 치더니 민주노총 등 노동계 집회에 대해서는 구두로 '집회 자제'만을 당부하는데 그쳤다. 노동계 집회 당시 확진자 수가 한글날 개천절 짐회 당시보다 훨씬 많았음에 불구하고 말이다. 노동계 집회에는 집단 코로나 백신이라도 작동한다는 것인가. 정부가 코로나를 정치적으로 악용하고 있다는 얘기는 전부터 적지 않았지만 양쪽 집회를 대하는 태도를 보니 틀린 말은 아는 것 같다. 어쨌든 코로나가 언제 끝날지도 모르고 지금까지 정부가 확보한 백신도 하나도 없는 상태에서 지금처럼 단순 확진자 숫자만을 갖고, 그것도 정치적 필요에 따라 이랬다 저랬다 하는 방역 지침을 언제까지 계속할 수는 없다.  과학과 사실에 입각한 방역으로 전환해야 코로나 대책에서 가장  중요한 것은 이 병에 걸려 사망하거나 심하게 앓는 사람을 최소화하는 것이어야 한다. 그런데 지금까지 정부의 대책은 오직 확진자 숫자를 줄이는 것인 듯하다. 코로나에 대해서는 아직도 밝혀지지 않은 부분이 많지만 이른바 무증상 감염자가 매우 많다는 것은 거의 확인된 사실이다.                                                    코로나의 연령별 치사율은 85세 이상에서는 27%로 비교적 높다. 하지만 75~84세는 7.3%, 65~74세는 2.2%로 낮아진다. 55~64세는 0.7%, 45~54세는 0.2%, 35~44세 0.06%, 0~34세 0.01% 다. 55세 미만중 코로나에 걸려 사망하는 사람은 1천명에 한명도 채 안된다는 얘기다. 그나마 이는 전 세계 통계이고 한국의 경우 대부분의 연령층에서 전 세계 통계보다 치사율이 낮다.의사들을 중심으로 코로나19가 '노인 질환'이라는 이야기나 자주 나오는 이유다. 그런데도 사람들의 코로나 공포는 매우 과장돼 있다. 언론이 단순 사망자 숫자만으로 보도하고 후유증이 큰 사람만 기사로 싣는 것도 그런 공포를 부추기는 데 일조했다. 하지만 코로나 피로감이 점점 커지는 와중에 대중의 막연한 공포와 '정치 방역'의 필요성에만 기대 지금 같은 주먹구구식 방역정책을 지속할 수는 없다. 아니 지속해서는 안 된다.과학에 근거한, 합리적 숫자에 바탕을 둔 그런 방역 정책으로 전환이 절실한 이유다. 우선 질병관리청에서 발표하는 통계부터 바꿔야 한다. 현재는 매일 확지자 숫자만이 언론을 통해 주로 공개된다. 정부는 검사자 숫자도 공개한다고 하지만 질병관리청 홈페이지에는 누적검사자수, 누적검사완료수 등 주로 누적 수치만 나올 뿐, 몇명을 신규로 검사해 확진자가 나온 것인지는 알기 어렵다.일일 검사자 수를 알려면 질병관리청 보도 참고 자료를 찾아 <국내 신고 및 검사 현황>에서 <총계>의 어제와 오늘간 변동치를 봐야 한다.  이 표에는 <일일 검사자 수>라는 이름은 없고 그냥 총계로만 되어 있어 내역을 모르는 사람은 봐도 이것이 일일 검사자 수인지 아는 게 거의 불가능하다. 도대체 왜 이렇게 찾아보기 힘들게 해놨는지 이해하기 어렵다. 가장 중요한 정보는 하루 몇명을 검사해 그중 확진자가 몇명인가 하는 것인 만큼 일일 검사자 수를 질병관리청 홈페이지에 1일 확진자 수 증가분과 함께 공개해야 한다. 그리고 확진자 중 무증상 감염자는 몇명인지도 밝힐 필요가 있다.현재 질병관리청의 코로나 통계는 확진자를 제외하고는 일일 순증 통계보다는 주로 누적 통계만을 발표하고 있어 하루하루 추이를 파악하는 것이 어렵게 돼 있다.  이와 함께 확진자와 사망자의 연령별 분포 등도 매일매일 국민들이 알기 쉽게 적극 공개할 필요가 있다.코로나를 연구하는 해외 논문 등을 보면 한 국가내에서도 지역별 코로나 동향, 국가간, 연령별 코로나 감염, 치료, 사망 동향등을 서로 비교하며 자세히 소개하고 있다. 한국 사례도 종종 인용된다. 이에 반해 정작 국내에서는 지역 통계를 빼면 이런 통계는 찾아보기 힘들다.   코로나 통계 개편과 함께 환자 치료와 방역을 고령자, 중증 환자로 집중할 필요가 있다. 중증이 아닌 확진자들은 격리 등 감염 확산 방지에 초점을 맞추면 되고 의료시설은 생명에 위협이 있을 수도 있는 중증 환자에 집중적으로 투입하는 그런 방식이 되어야 한다. 그래서 병의원, 의료인력, 장비와 의약품 등도 필요한 곳에 효과적으로 동원될 수 있고 불필요한 낭비도 줄일 수 있다. 지금처럼 단순 확진자 수를 갖고 전국에서 전 연령대에 거쳐 무차별적으로 행해지는 방역정책은 효과적이지 않을 뿐더러 경제를 비롯, 일상생활에 막대한 지장을 초래하고 의료 자원의 효율적 이용이라는 측면에서도 바람직하지 않다. 정부가 할 일은 정확한 과학적 지식을 알리고 정말 필요한 곳에 방역자원을 집중하는 것이다.  어처구니 없는 서울시의 코로나 공포 조장이와 관련해 서울시가 시내 곳곳 대형 전광판에 <어느 마스크를 쓰시겠습니까>라는 이름으로 내보낸 영상은 많은 생각을 하게 만든다. 화면은 젊은 여성이 마스크를 끼고 책인가를 읽는 모습과 중환실에서 심폐소생 마스크를 낀 환자의 모습을 대비시키고 있다. 이 화면만 보면 마치 마스크를 안 끼면 누구든 중환자실에 실려가 생사의 기로에 처하게될 것 같은 생각을 갖게 된다. 마스크 착용을 권하기 위한 것이겠지만 불특정 다수에게 사실과 다르게 위험을 과장해 불필요한 코로나 공포를 갖게 만드는, 정말 문제 있는 장면이다. 55세 미만에서는 1천명당 1명도 사망하지 않는 코로나를 마치 죽음의 질병이라도 되는냥 이렇게 광고해도 되나. 아마 구미 선진국에서 이런 식의 공보물이 크게 걸렸다면 아마도 대중들로부터 엄청난 항의와 저항에 부딪혔을 것이다. 지금도 주변에서 ""코로나 때문에 무서워 죽겠다""는 말들을 많이 듣는다. 이런 막연한 공포가 확산된 데는 정부가 의도했든, 아니든 정확한 팩트와 숫자 통계를 제대로 밝히지 않고 있기 때문이다. 그리고 위에서 언급한대로 말도 안되는 과장 광고로 불필요하게 코로나 공포를 확산시키는 서울시 등 지방정부의 책임도 크다.  정부 여당은 코로나 확산이 정치적으로 나쁘지 않다는 계산을 하는 지도 모르겠다. 경제실정도 코로나에 묻을 수 있고 국민들을 공포로 몰아 넣으면 통치하기도 쉬워지기 때문이다. 하지만 그것이 언젠가 엄청난 부메랑으로 돌아올 수도 있다는 점도 생각해봐야 할 것이다.김선태 논설위원 kst@hankyung.com"
4,한국경제TV,"김종인 ""비판자에게만 '살인자' 언급…정치적 방역 의심""","김종인 국민의힘 비상대책위원장이 16일 서울 여의도 국회에서 열린 비상대책위원회의에서 모두발언을 하고 있다. 사진=뉴스1                        김종인 국민의힘 비상대책위원장이 14일 개최된 전국민주노동조합총연맹(민주노총)의 집회를 놓고 ""정부가 정치적 유불리에 따라 코로나 대응을 선택적으로 하고 있다는 의구심을 갖지 않을 수 없다""고 지적했다.김종인 위원장은 16일 국민의힘 비상대책위원회의에서 ""문재인 대통령이 지금처럼 코로나 방역을 정치적으로 접근하면 국민적 저항을 불러일으킬 것""이라며 이같이 밝혔다.김종인 위원장은 ""그동안 정부는 현 정권에 비판적 입장을 취하는 사람들의 집회는 코로나 방역을 내세워 '재인 산성'까지 높이 쌓아 원천 봉쇄했다""며 ""심지어 집회 주최 측을 '살인자'라 지칭하기도 했다""고 말했다.  관련기사 劉 ""니가가라 공공임대"" 安 ""사저 795평""…靑 ""정치적 공격""靑, 문대통령 '13평에 4인가족' 발언 보도에 ""사실 왜곡""(종합)'최장 필버' 윤희숙 ""동료들 추임새 반응하다보니"" ""文 퇴임 후 사저 크기 6평으로""…분노의 국민청원까지 등장이재명 ""3단계 선제 격상""…정총리 ""전문가 의견 수렴하라""靑, 문대통령 '13평에 4인가족' 발언 보도에 ""사실 왜곡""정총리 ""코로나19 확산세 꺾지못하면 3단계 격상 불가피""(종합)김종인, 대국민 사과 내주로 연기…""일단은 필버 힘싣기""[속보] 정총리 ""중대본 상황관리·방역대응체제 최고수준 가동""[속보] 정총리 ""코로나19 최대 위기…매우 긴박한 비상상황""  이어 그는 ""민주노총이 지난 주말 대규모 장외집회를 강행하면서 국민 불안감이 더욱 커지는 실정""이라며 ""정부가 정치적 유불리에 따라 코로나 대응을 선택적으로 하고 있다는 의구심을 갖지 않을 수 없다""고 꼬집었다.                            14일 오후 서울 영등포구 여의도공원 앞에서 전국노동자대회가 열리고 있다. 사진=연합뉴스                        그러면서 김종인 위원장은 ""최근 코로나 확산세가 심상치 않은 것 같다. 신규 확진자가 200명이 넘어서며 일상 감염이 속출하고 있다""며 ""정부가 코로나 대응 단계를 섣부르게 조정하면서 확산세가 거세지고 있다는 지적을 안 할 수 없다""고 강조했다.끝으로 김종인 위원장은 ""코로나 백신 확보에 어떠한 정략적 사고가 개입해선 안 될 것""이라며 ""세계 각국의 백신 확보 경쟁이 치열한 만큼, 정부는 사활을 걸고 백신 확보에 나서야 한다""고 피력했다.김수현 한경닷컴 기자 ksoohyun@hankyung.com"
