,Press,Title,Text
70,한국경제TV,"""들것에 실린 채 죽을 수도""…코로나 악몽 덮친 뉴욕 [조재길의 지금 뉴욕에선]","사진=AP                        앤드루 쿠오모 뉴욕주지사가 오늘 화상 브리핑을 했습니다. 신종 코로나바이러스 감염증(코로나19)의 전개 추이를 전달하고, 주민 스스로 방역을 강화해 달라고 요청하기 위해서였지요. 뉴욕은 지난 2월 미국에 재앙적 전염병을 처음 들여온 곳이란 오명을 갖고 있습니다.쿠오모는 “앞으로 5일 내 뉴욕시의 코로나 환자 입원율이 정상화되지 않을 경우 식당들의 실내 영업을 금지하겠다”고 밝혔습니다. 그러면서 “지금 추세로는 수 일 내 입원율이 안정될 것 같지 않다”고 덧붙였습니다. 현재 뉴욕시에선 하루 1300여 명이 입원하고 있습니다.쿠오모는 “입원 환자가 병원 수용 능력을 초과한다는 건 사람들이 병원 복도에서 들것에 실려 죽을 수 있다는 의미”(Overwhelming the hospital system means people die on a gurney in a hallway)라고 부연했지요.                            사진=AP                        결국 늦어도 다음주 월요일부터는 뉴욕시에서 식당·카페·주점의 실내 영업이 전면 금지될 가능성이 높다는 게 쿠오모의 설명입니다.  관련기사 아이즈원 멤버 전원 음성 판정 ""향후 스케줄 예정대로"" [공식] 이번주 브렉시트 담판…""결과 어떻든 영국 주식 사라""佛 3위 은행 소시에테제네랄, 600개 지점 닫고 인터넷銀 강화 코로나로 생사위기 멕시코 교민 고국서 '폐이식 성공' 새 삶'대선출마' 여지 남긴 이인영…""北코로나 지원, 우리 위한 길""서울시 코로나 선별진료소 운영 시간 연장사회적 거리두기 2.5단계…문 닫은 학원'코로나19 프리' 휴양지 하이난에 몰리는 중국인정총리 ""백신 내년 1분기 도입되나 접종시기 탄력 결정""성격 착하고 수익률도 '착한' ESG 투자  올해 3월부터 수 개월 간 식당 등의 문을 걸어 잠갔던 뉴욕시는 차츰 정상화 단계를 밟아 왔습니다. 지난 9월 30일부터 수용 인원의 25% 내에서 실내 영업을 허용했지요. 식당 업주와 종업원들은 최소 50%로 확대되길 간절히 바랐습니다.그런데 역으로 실내 영업 전면 금지의 수순을 밟고 있는 겁니다. 문제는 겨울 추위입니다. 지금까지는 뉴욕시 식당의 절반가량이 실외 영업 등으로 생계를 이어왔는데, 날씨가 추워질 경우 이게 원천적으로 불가능하기 때문이죠. 미식가의 천국으로 꼽혔던 뉴욕시 식당가엔 악몽 같은 시간이 돌아올 수 있다는 의미입니다.쿠오모는 더 나아가 “7일 평균 병상 가동률이 90%를 넘을 경우 아예 셧다운 조치를 취할 수 있다”고 경고했습니다. 그럼 배달·테이크아웃 영업조차 불가능하게 됩니다. 이 때는 식당·주점 등 뿐만 아니라 일반 소매점도 폐쇄될 겁니다. 약국 식료품점 등 필수 사업장만 영업할 수 있지요.뉴욕 내에선 장기간의 방역 조치에 집단 반발하는 움직임도 생기고 있습니다. 스태튼아일랜드의 한 주점은 야간 영업 제한 조치를 어겼다가 체포될 처지에 놓이자 경찰을 폭행했습니다. 그가 체포되자 이 주점 앞에선 뉴욕주 및 시의 조치에 항의하는 시위가 이어지고 있지요.미국 내 코로나 환자는 급증 추세입니다. 존스홉킨스대 통계에 따르면 지난 일주일간 하루 평균 신규 코로나 환자가 19만6233명으로 집계됐습니다. 역대 최고치입니다. 코로나로 입원한 환자는 현재 10만1500여 명에 달하지요. 뉴욕주와 붙어 있지만 인구 밀도가 낮은 ‘가든 스테이트’ 뉴저지도 위험하긴 마찬가지입니다. 6일엔 역대 가장 많은 6046명의 신규 확진자가 발생했습니다. 이런 추세는 내년 1월 중순에 정점을 찍을 것이란 경고도 나왔습니다. 앤서니 파우치 미 국립알레르기·전염병연구소 소장은 이날 쿠오모 브리핑에 동반 출연해 “내년 1월 중순이 정말로 암울한 시간이 될 것”이라고 말했습니다.                            뉴욕시 내 유대인들이 최근 집회를 하는 모습. 마스크를 쓴 사람이 적다. 뉴욕포스트 캡처                        지난달 말 추수감사절 때 수백만 명이 가족·친지를 방문했던 여파가 본격화하고 있는 가운데, 유대교 축제인 하누카(12월 10~18일), 또 이후 크리스마스 연휴까지 고구마 줄기처럼 연결되기 때문이죠. 유대교 사람들은 마스크를 쓰지 않은 채 밀집된 장소에서 다양한 행사를 여는 것으로 유명합니다.파우치는 “이번 사태에 제대로 대응해 보기도 전에 다양한 행사·모임들이 이어지게 됐다”고 걱정했습니다. 코로나 사태의 초기에 가장 큰 충격을 경험했기 때문일까요. 뉴욕은 또 다시 엄습할 악몽에 떨고 있습니다.뉴욕=조재길 특파원 road@hankyung.com"
71,한국경제TV,"배우 매니저들 강타한 코로나…""검사중"" 지라시에 2연타 '몸살'","권상우, 류수영, 이정재/사진=한경DB                        유명 배우들의 매니저들의 코로나19 확진 소식으로 연예계가 어수선한 가운데실체없는 지라시까지 유포되면서 관련자들의 시름이 깊어지고 있다. 7일 한경닷컴 취재 결과 아티스트컴퍼니, 이엘라이즈, 수컴퍼니, FNC엔터테인먼트 소속 매니저들이 코로나19 확진 판정을 받았다. 아티스트컴퍼니에는 정우성 이정재 등이 소속돼 있고, 이엘라이즈 류수영, 수컴퍼니 권상우 FNC엔터테인먼트 정해인 등 유명 배우들이 소속돼 있는 만큼 더욱 충격이 컸다.공식적으로 소속사에서 입장이 나오기 전 모바일 SNS를 중심으로 몇몇 배우들의 이름과 함께 매니저들이 검사를 받고 '양성', '음성', '검사를 기다리는 중' 등의 내역이 담긴 지라시가 돌았다. 평소 친분이 있었던 매니저들을 묶어 코로나19 검사를 받았다고 한 것.   관련기사 기말고사 코앞인데…""PC방 열면서 학원은 왜 닫나"" 멘붕""코로나 방역 지침, 생계 달린 일인데 비효율적"" 자영업자들 분통나노젠, 베트남서 코로나19 백신 임상 1상 시작 수도권 은행, 28일까지 9시반에 열고 3시반에 닫는다코로나 가짜뉴스 유포한 17명 검찰 송치""찜찜하지만…"" 대학들 전면 비대면 시험수리모델로 예측해보니…""확진자 하루 1000명 나올 수도""""내년 반도체 수출환경 나아질 것…2차전지·바이오헬스 약진 기대""포스트 코로나 시대…해외시장 공략 키워드는 T.E.C.H연일 호주 때리던 중국…이젠 ""코로나 진원지, 호주일 수도""  이에 이름이 언급된 매니지먼트사와 담당 매니저들은 당혹스러움을 감추지 못했다. 한 매니저는 ""이미 수일 전부터 재택근무를 시행하고, 직원들끼리도 만나지 않고 있다""며 ""코로나19로 가뜩이나 힘든 시기에 잘못된 소문까지 나도니 더 힘들다""고 호소했다. 또 다른 관계자 역시 ""누가 이런 내용을 퍼트리는지 모르겠지만, 대충 '아니면 말고 식' 아니겠냐""며 ""검사를 받은 적이 없으니 '음성', '검사 결과 기다리는 중'이라는 것 자체가 말이 안된다""고 말했다. 모 매니저 역시 ""어제부터 그 지라시 때문에 난리였다""며 ""힘든데 더 힘들어졌다""고 토로했다. 한편 확진 매니저들은 소속 배우들과 접촉은 없는 것으로 알려졌다. 배우들의 스케줄을 동행하는 현장 매니저가 아니었기 때문. 다만 선제적 대응 차원에서 코로나19 검사를 받은 사람들도 있고, 이정재와 박소담, 권상우 등도 검사를 받고 음성 판정을 받았다. 확진자는 방역 지침에 따라 격리 치료를 받고, 밀접 접촉자를 확인한 후 2주간 격리를 진행할 것으로 알려졌다.  연말을 앞두고 각종 방송사들의 시상식이 예정된 상황. 또한 앞서 코로나 19로 '달이 뜨는 강' '펜트하우스' '허쉬' '철인왕후' '도시남녀의 사랑법' 등에 확진자가 발생하면서 촬영이 중단된 사례가 있는 만큼 관계자들은 더욱 방역을 철저히 하고 있다고 전했다. 김소연 한경닷컴 기자 sue123@hankyung.com기사제보 및 보도자료 newsinfo@hankyung.com"
72,한국경제TV,"코로나 확산 때면 오르던 與 지지율, 이번엔 '흔들'...왜? ","11월 14일 오후 서울 영등포구 여의도공원 인근에서 민주노총 주최로 열린 전국노동자대회에서 참석자들이 구호를 외치고 있다. 사진=연합뉴스                        문재인 대통령과 더불어민주당의 지지율이 동반하락해 집권 후 최저치를 기록했다는 여론조사 결과가 7일 나왔다. 리얼미터가 YTN 의뢰로 지난달 30일부터 이달 4일까지 전국 만 18세 이상 2513명을 대상으로 조사한 주간 집계에서 문 대통령의 국정 수행 지지율(긍정평가)은 전주보다 6.4%포인트 하락한 37.4%였다. (자세한 내용은 리얼미터 홈페이지 또는 중앙선거여론조사심의위원회 홈페이지를 참조하면 된다.)과거 코로나19(신종 코로나 바이러스 감염증)가 확산할 때마다 여권의 지지율이 반등했던 것과 비교하면 이례적인 현상이다.  관련기사 ""찜찜하지만…"" 대학들 전면 비대면 시험영국, 세계 최초 '화이자 백신' 일반 접종 시작""송년회도 못하는데 차라리…"" 강원·제주 호텔 예약 동났다  가수 청하, 코로나19 확진…""모든 활동 중단""코로나19 확산에 서울 병상가동률 90%…컨테이너 병동 도입울산 양지요양병원 이틀새 92명 확진…고령환자 多 '초비상'문재인 대통령, 역학조사에 공무원·군·경찰 투입 지시[상보]기보,코로나19 위기 광주시 문화콘텐츠기업 맞춤형 지원[속보] 문 대통령 ""조금이라도 의심되면 검사 받아달라""양향자 ""日, 정부개혁 실패로 30년 불황…정부조직혁신위 만들자""  야권에서는 ""그동안 코로나가 확산됐을 때는 신천지나 보수 집회 처럼 특정 진원지가 있어 그에 대한 반발 심리가 정부 지지로 반영됐지만 이번에는 딱히 특정 집단에 책임을 묻기 힘든 상황""이라며 ""여권이 처음으로 시험대에 서게 된 것""이라는 반응이 나온다. 한 국민의힘 관계자는 ""개인적인 감으로는, 문재인 대통령 지지율이 급격히 떨어진 데에는 추미애-윤석열 문제보다도 코로나19 확산이 크게 작용했다고 추측한다""며 ""일반 국민들이 솔직히 추미애나 라임,옵티머스 등에 크게 관심을 두는지 의문이다. 일반인들이 가장 관심 있는 문제는 코로나""라고 지적했다. 이 관계자는 ""이번에는 신천지 탓도 못 했고, 동성애자들 탓도 못 했고, 태극기 집회 탓도 하지 못 하게 됐다""며 ""사회적 거리두기를 완화했다가 다시 부랴부랴 강화하는 등 미숙한 방역행정을 드러냈고, 백신 확보에 뒤처진 모습도 보였다""고 지적했다. 자영업자들의 피로감이 점점 높아지고 있다는 점도 정부에 대한 불만이 고조되는 이유로 꼽았다. 또 다른 관계자는 ""코로나와 추미애 건이 별개의 이슈라기보다도, '코로나가 이렇게 심각한데 정부는 윤석열 찍어내는데 급급하다', '청와대 정무수석은 축구를 했다'는 등 불만을 증폭시키는 역할을 했다""고 분석했다. 실제로 직전 한국갤럽 여론조사에서는 문 대통령 긍정평가 이유를 묻는 질문에서 '코로나 대처'를 꼽는 답변이 8%포인트 급락했다.특히 보수집회를 원천 봉쇄했던 정부는 민주노총 집회는 사실상 허용해 비판을 받았다. 이와 관련 서울시는 지난달 온라인 브리핑을 통해 최근 코로나19 확산은 민주노총 집회 때문이 아니라 석달 전 광복절 집회 탓이라고 주장해 논란이 되기도 했다.박유미 서울시 방역통제관은 ""확진자들의 GPS를 분석한 결과 핼러윈데이나 지난 주말 도심 집회(민주노총 집회)와의 연관성은 나타나지 않았다""면서 ""8·15 광복절 집회 당시 (확진자 수가) 많이 발생해서 아마 지역사회에 꽤 많이 잔존 감염을 시켜놨다고 판단한다. 이것이 최근 발생하는 소규모 다발성 집단감염으로 이어졌다고 생각한다""고 말했다.김명일 한경닷컴 기자 mi737@hankyung.com"
73,한국경제TV,가수만 벌써 6명…청하 코로나19 확진에 가요계 또 '비상' [종합],"청하 /사진=한경DB                        가수 청하가 코로나19(신종 코로나바이러스 감염증) 확진 판정을 받으면서 가요계에 다시금 비상이 걸렸다.MNH엔터테인먼트는 7일 ""청하가 최근 확진자와 접촉한 사실을 인지하고 자발적으로 검사를 받았고, 7일 오전 검사 결과 최종 확진 판정을 받았다""며 ""청하는 모든 활동을 중단하고 바로 자가격리에 들어갔으며 방역당국의 지침에 따라 필요한 조치를 취하고 있다""고 밝혔다.이와 함께 소속사는 ""동선이 겹치거나 접촉이 있었던 소속 아티스트 및 스태프, 직원 등은 함께 검사를 진행했거나 진행할 예정""이라 전하며 확인이 되는대로 후속 조처를 취하겠다고 강조했다.  관련기사 [포토] 원격수업 들어간 서울 시내 중고등학교청하 ""조심한다고 했는데…미안해요"" 코로나19 확진 후 남긴 글가수 청하, 코로나19 확진…""모든 활동 중단"" 청하, 코로나19 확진…활동 중단+자가격리 중 [공식]용산구 ""이태원 홀덤펍 5곳에 확진자…이용자 검사받아야""웨스턴라운지 등 이태원 술집 동시다발 감염…""379명 검사""[속보] 서울 동작구 사우나 29명 감염…19일까지 집합금지[속보] 문 대통령 ""수도권 급속 확산…역학조사 속도 높여야""""비행기 타고 여행가고 싶어요""…정부‧학계 탈출구 찾는다코로나19 확진 615명…이틀째 600명대 전방위 확산 [종합]  최근 다수의 가수들이 코로나19 확진 판정을 받았던 가요계는 청하의 소식에 다시금 긴장하고 있다. 앞서 업텐션 비토·고결, 에버글로우 이런·시현, '미스터트롯' 이찬원이 잇따라 코로나19 검사에서 양성 반응을 보였기 때문. 특히 이들은 활발히 활동 중인 시기였기에 불안감은 더욱 컸다. 청하 역시 내년 1월 정규앨범 발매를 앞두고 선공개 싱글을 순차적으로 공개하고 있던 중이었다. 하지만 코로나19 확진으로 향후 앨범 발매 일정 변동이 불가피해졌다.청하가 등장할 예정인 방송에도 관심이 쏠렸다. 청하는 오는 9일 첫 방송되는 Mnet '달리는 사이'에 출연한다. 해당 방송에는 청하 외에도 선미, EXID 출신 하니, 오마이걸 유아, 이달의 소녀 츄가 함께 한다. 이와 관련해 Mnet 측 관계자는 한경닷컴에 ""지난 11월 20일에 모든 촬영을 마쳤다. 방송은 그대로 진행될 예정""이라며 출연진 및 스태프들이 청하의 코로나19 확진과는 연관이 없다는 입장을 전했다.덩달아 하루 전인 지난 6일 진행된 대형 가요 시상식인 '2020 MAMA(마마)'에도 이목이 집중됐다. 해당 행사에는 아이돌 팀들이 대거 참석해 무대를 꾸몄던 바, 일각에서 연쇄 감염에 대한 우려를 표한 것. 그러나 청하는 '2020 MAMA'에 참석하지 않았다.한편 청하는 코로나19 확진 소식이 전해진 이후 직접 팬카페에 글을 남겼다. 그는 ""너무 미안하고 또 미안하다. 조심한다고 했는데 제가 많이 부족했나보다. 저도 오늘 급히 연락 받고 이제 알았다. 다시 건강한 모습으로 활동하는 모습 보여드리겠다""며 ""우리 별하랑도 조심하고 또 조심하라. 너무 걱정하지 말고 우리 곧 만나자. 다시 한 번 미안하다""고 사과했다.김수영 한경닷컴 기자 swimmingk@hankyung.com기사제보 및 보도자료 newsinfo@hankyung.com"
74,한국경제TV,"청하 ""조심한다고 했는데…미안해요"" 코로나19 확진 후 남긴 글","청하, 코로나19 확진 후 팬들에 글 남겨 /사진=한경DB                        가수 청하가 코로나19(신종 코로나바이러스 감염증) 확진 판정을 받은 가운데, 팬들에게 직접 미안한 마음을 전했다.청하는 7일 공식 팬카페에 '너무 미안해요 걱정하지 마세요!'라는 제목의 글을 게재했다.청하는 ""우리 별하랑(공식 팬덤명) 제 소식 없으면 너무 걱정할까 봐 글 남긴다. 너무 미안하고 또 미안하다. 조심한다고 했는데 제가 많이 부족했나보다""면서 ""저도 오늘 급히 연락 받고 이제 알았다. 다시 건강한 모습으로 활동하는 모습 보여드리겠다""며 팬들을 안심시켰다.  관련기사 가수 청하, 코로나19 확진…""모든 활동 중단""청하, 코로나19 확진…활동 중단+자가격리 중 [공식]용산구 ""이태원 홀덤펍 5곳에 확진자…이용자 검사받아야"" 웨스턴라운지 등 이태원 술집 동시다발 감염…""379명 검사""[속보] 서울 동작구 사우나 29명 감염…19일까지 집합금지[속보] 문 대통령 ""수도권 급속 확산…역학조사 속도 높여야""""비행기 타고 여행가고 싶어요""…정부‧학계 탈출구 찾는다코로나19 확진 615명…이틀째 600명대 전방위 확산 [종합]홍남기 ""국민 위로 위해 소비 촉진 '크리스마스 마켓' 추진""[속보] 서울 244명·경기 156명·인천 40명·울산 38명·부산 35명 등 확진  이어 ""우리 별하랑도 조심하고 또 조심하라. 너무 걱정하지 말고 우리 곧 만나자""며 ""다시 한 번 미안하다""고 사과했다.청하는 이날 코로나19 검사 결과 양성 판정을 받았다. 소속사 MNH엔터테인먼트는 ""청하가 최근 확진자와 접촉한 사실을 인지하고 자발적으로 검사를 받았고, 7일 오전 검사 결과 최종 확진 판정을 받았다""고 밝혔다.이어 ""모든 활동을 중단하고 바로 자가격리에 들어갔으며, 방역당국의 지침에 따라 필요한 조치를 취하고 있다""고 전했다.김수영 한경닷컴 기자 swimmingk@hankyung.com기사제보 및 보도자료 newsinfo@hankyung.com"
75,한국경제TV,"청하, 코로나19 확진…활동 중단+자가격리 중 [공식]","가수 청하 /사진=한경DB                        가수 청하가 코로나19(신종 코로나바이러스 감염증) 확진 판정을 받았다.7일 소속사 MNH엔터테인먼트는 ""청하는 최근 확진자와 접촉한 사실을 인지하고 자발적으로 검사를 받았고, 이날 오전 검사 결과 최종 확진 판정을 받았다""고 밝혔다.이어 ""청하는 모든 활동을 중단하고 바로 자가격리에 들어갔으며, 방역당국의 지침에 따라 필요한 조치를 취하고 있다. 현재 동선이 겹치거나 접촉이 있었던 소속 아티스트 및 스태프, 직원 등은 함께 검사를 진행했거나 진행할 예정이며, 확인이 되는대로 이에 대한 후속 조처를 취하겠다""고 설명했다.  관련기사 용산구 ""이태원 홀덤펍 5곳에 확진자…이용자 검사받아야""웨스턴라운지 등 이태원 술집 동시다발 감염…""379명 검사""[속보] 서울 동작구 사우나 29명 감염…19일까지 집합금지 [속보] 문 대통령 ""수도권 급속 확산…역학조사 속도 높여야""""비행기 타고 여행가고 싶어요""…정부‧학계 탈출구 찾는다코로나19 확진 615명…이틀째 600명대 전방위 확산 [종합]홍남기 ""국민 위로 위해 소비 촉진 '크리스마스 마켓' 추진""[속보] 서울 244명·경기 156명·인천 40명·울산 38명·부산 35명 등 확진[속보] 코로나19 어제 사망자 4명 늘어 총 549명[속보] 코로나19 확진 615명, 이틀째 600명대…지역 580명  끝으로 ""당사는 정부 방침에 적극 협조하여 회사 전체 방역 및 추가 감염의 위험은 없는지 전반적으로 점검을 실시하고, 전체 아티스트 관리에 더욱 만전을 기하겠다""고 했다.청하는 내년 1월 첫 번째 정규앨범 '케렌시아' 발매를 앞두고 있다. 그는 오는 10일 마지막 선공개 싱글 'X(걸어온 길에 꽃밭 따윈 없었죠)'를 공개할 예정이었으나 코로나19 확진으로 인해 추후 일정 변동 가능성도 생겨났다.최근 가요계는 코로나19 확진자가 다수 나오면서 비상이 걸렸다. 앞서 업텐션 비토가 최초로 코로나19 확진 판정을 받은 데 이어 같은 팀 멤버인 고결과 에버글로우 이런·시현, '미스터트롯' 이찬원이 코로나19 양성 반응이 나왔다. 이어 청하까지 확진 판정을 받으며 무려 6명의 가수들이 코로나19에 감염됐다. 다음은 청하 소속사 MNH엔터테인먼트 공식입장 전문MNH엔터테인먼트 입니다.  당사 소속 아티스트 청하가 코로나19 양성 판정을 받아 소식을 전합니다. 청하는 최근 확진자와 접촉한 사실을 인지하고 자발적으로 검사를 받았고, 7일 오전 검사 결과 최종 확진 판정을 받았습니다. 청하는 모든 활동을 중단하고  바로 자가격리에 들어갔으며, 방역당국의 지침에 따라 필요한 조치를 취하고 있습니다.현재 동선이 겹치거나 접촉이 있었던 소속 아티스트 및 스태프, 직원 등은 함께 검사를 진행했거나 진행할 예정이며, 확인이 되는대로 이에 대한 후속 조처를 취하겠습니다.당사는 정부 방침에 적극 협조하여 회사 전체 방역 및 추가 감염의 위험은 없는지 전반적으로 점검을 실시하고, 전체 아티스트 관리에 더욱 만전을 기하겠습니다.김수영 한경닷컴 기자 swimmingk@hankyung.com기사제보 및 보도자료 newsinfo@hankyung.com"
