,Press,Title,Text
0,MBC,"국민의당, 코로나 방역 문제·보완책 집중"," 앵커 21대 국회 첫 국정감사가 잠시 후 시작됩니다.북한의 우리 공무원 피격과 개천절 집회 봉쇄, 코로나19 등 쟁점도 많아 여야의 격돌이 예상됩니다.제1야당인 국민의힘과  정책연대의 뜻을 밝힌 국민의당도 송곳 검증을 벼르고 있는데,국민의당 권은희 원내대표 연결해서 이야기 나눠보겠습니다.권 의원님, 안녕하세요. 권은희/국민의당 원내대표 안녕하세요. 앵커 먼저, 국민의당이 이번 국정감사에서 '이것만은 꼭 짚고 넘어가야겠다'하는 사항은 어떤게 있을까요? 권은희/국민의당 원내대표 코로나19의 장기화로 국민들께서 피로가 누적되고, 민생이 한계수준에 다다르고 있습니다. 그런데 코로나19 극복을 위해서는 지금까지보다 더 긴 시간이 소요된다고 예측되고 있습니다. 이제 정부는 국민들의 인내와 의료진의 희생에 의존하기 보다는 과학적이고 합리적인 방역, 비례적인 대응조치로 코로나19 극복을 위한 긴 시간에 대비해야 합니다. 이번 국감에서 정부의 코로나19방역의 문제점과 보완책을 짚어야할 이유입니다. 또한 인천 라면형제와 같이 올 한해만도 지속적으로 아동학대가 발생하고 있습니다. 늘 아동학대가 발생하면 대통령께 종합대책을 보고하지만 근절하지 못하는 이유는 보건복지부와 교육부, 경찰청과 지방자치단체가 유기적으로 협업하지 못하고, 제각각 형식적으로 대응하기 때문입니다. 이번 국감에서 아동학대근절을 위한 유기적인 현장협업체계를 점검·설계하여야 합니다.라임사태·옵티머스사태 등 사모펀드의 불완전판매로 많은 분들이 피해를 당하였습니다. 사모펀드를 편법적으로 규제완화하여 피해규모가 막대해졌는데, 이러한 편법적 규제완화의 문제를 점검하고 제도개선하여 추가적인 금융사고가 일어나지 않도록 하겠습니다. 앵커 민주당과 국민의힘, 두 당의 의석수만 277석. 총 의석수에서 90%이상을 차지합니다.반면, 국민의당은 모두 세 석 입니다.거대 양당 정치 구도에서 군소정당이 목소리를 내기 쉽지않은 것은 예나 지금이나 마찬가지 일 것 같습니다.정국운영에 대해서는 어떻게 생각하세요? 권은희/국민의당 원내대표 여당이 부동산임대차 3법을 단독으로 처리한 사례와 같이 현재 국회는 더불어민주당이 있을 뿐입니다. 103석의 국민의힘이나 3석의 국민의당이나 모두 국회의 의사결정에서 배제되어 있습니다.원래 국회는 교섭단체를 이룬 정당들이 원내대표간이나 상임위 간사간 합의를 통해 안건을 상정하고, 토론하고 협의한 후 안건을 합의처리하는 관행이 있습니다. 이러한 관행을 통해 야당이 의사결정에 참여하고 제 역할을 할 수 있었습니다. 더불어민주당이 야당이었을 때도 이러한 관행이 지켜졌기 때문에, 국정원댓글사건 국정조사나 최순실 국정농단 특검법안등이 처리될 수 있었습니다. 그런데 지난 20대 국회패스트트랙 이후로 이러한 관행이 모두 무너져서 과반을 점하지 못하는 야당은 제아무리 103석이라도 3석 정당과 아무런 차이가 없게 되었습니다.야당의 견제와 비판에 열려있는 국회가 건강한 정부, 균형있는 입법, 부작용없는 정책을 만들 수 있다는 사실을 정부와 여당은 받아들여야 합니다. 앵커 국민의힘, 국민의당 두 당의 당명도 비슷합니다. 최근 국민의당이 국민의힘과 정책연대의 뜻을 내비추자, 양당의 연대가 야권 통합으로 이어지는 것 아니냐는 관측이 나옵니다.내년 서울시장·부산시장 보궐선거, 또 대선을 앞두고 국민의당과 연대, 어떻게 전망하시는지요? 권은희/국민의당 원내대표 국민의당은 ‘국민과 함께 앞으로’ 나아가기 위한 37대 정책과제로 국민의힘과 정책연대를 논의하고 있습니다. 국정감사 이전에 정책연대를 발표할 예정이었지만 국민의힘이 소속 의원들과 추가 논의할 사항이 있어, 연기되었습니다.‘국민과 함께 앞으로’나아가기 위한 37대 정책과제는 국가개혁과 코로나19 이후 사회변화에 대응하기 위한 과제로, 정책연대 등으로 야권혁신 또한 이끌어 내는 역할을 합니다. 야권은 현재 연대나 통합보다 혁신이 가장 중요한 숙제입니다. 연대나 통합은 혁신 이후의 추후 문제입니다. 앵커 야권은 현재 혁신이 가장 중요한 숙제라는 말씀이 여운이 남습니다.지금까지 21대 첫 국정감사를 앞두고 국민의당 권은희 원내대표와 이야기 나눠봤습니다.오늘 말씀 고맙습니다.                                                                                                                                                                                                                                                                                                                                                                                                                                                                                                                                                                                                                                                                                                                                                                                                                                                                                                                                                                                                                                                                                                                                                                                                                                                                                                                                                                                                                                                                                                                                                                                                                                                                                                                                                                                                                                                                                                                                                                                                                                                                                                                                                                                                                                                                                                                                                                 "
1,MBC,얼어붙은 거래…8월 부동산업 매출액 7년만에 최대폭 감소,"최근 주택거래가 얼어붙으면서 부동산 업종 매출이 7년여 만에 최대 감소 폭을 나타냈습니다.오늘 통계청에 따르면, 부동산업 생산지수는 올해 6월 6.1% 급등한 이후 7월 2.5%로 증가폭이 둔화됐다가 8월에는 한 달 전 대비 6.7% 하락해 마이너스 대로 떨어졌습니다.이는 2013년 7월 부동산업 생산지수가 마이너스 8.1%를 기록한 이후 7년 1개월만에 최대 감소폭입니다.통계청 관계자는 ""부동산 시장 과열을 막기 위한 정책이 나온 이후 8월 주택거래가 감소했고, 이에 중개 수수료 등 부동산 매출액이 줄어들었다""고 설명했습니다.국토교통부에 따르면 8월 주택 매매량은 8만5천여건으로 전달에 비해 39.7% 감소했습니다.                      "
2,MBC,대통령·여당 국정운영 지지도 동반 상승," 앵커 대통령과 여당의 지지 율은 한달 전 조사보다 함께 상승한 것으로 나왔습니다.대선 주자 후보 중에서는 더불어 민주당 이낙연 대표와 이재명 경기 지사가 여전히 양강으로 선두권을 달렸습니다.정치권의 지지 율 조사 결과는 조 명아 기자가 보도합니다. 리포트 문재인 대통령의 국정 운영에 대해 '잘하고 있다'는 긍정적 평가는 51.5%, '잘못하고 있다'는 부정 평가는 44.2%였습니다.한 달 전 조사와 비교해 보면, 긍정 평가는 5.9% 포인트 올랐고 부정 평가는 6.6% 포인트 떨어졌습니다. 지난 달에는 부정 평가가 긍정 평가보다 높게 나타났었는데, 한달 만에 다시 역전됐습니다.호남지역과 수도권에서 긍정적 평가가 높게 나타난 것으로 집계됐고 연령별로는 30대와 40대에선 긍정, 60대 이상에선 부정 평가가 많았습니다.코로나 19 대응에 대해 긍정적으로 평가한 국민의 62.5%는 대통령이 '잘하고 있다'고 평가했지만, 부정적으로 평가한 국민의 83.9%는 대통령이 국정 수행을 잘 못하고 있다고 봤습니다.정당 지지율은 더불어민주당이 39%로 가장 높았고 국민의힘 19.7%, 정의당 6.3%, 국민의 당 4.1% 입니다.  민주당 지지율은 한달 전보다 3.2% 포인트 상승한 반면, 국민의힘 지지율은 7.7% 하락해 격차가 19.3% 포인트 벌어졌습니다.가장 지지하는 정당에 대해 없거나 모른다고 대답한 경우도 지난달보다 소폭 늘어 26.2%로 나타났습니다.[원성훈/코리아리서치 부사장]""지난 총선과 앞으로 있을 보궐선거, 이런 것으로 인해서 지지층이 결집되고… 부동산 가격의 폭등, 그리고 검찰 개혁과 관련된 갈등… 악재들이 있었음에도 불구하고 그런 부분들이 어느 정도 안정화되고…""범진보 5명, 범보수 7명을 포함한 차기 대선주자 선호도 조사에서는 더불어민주당 이낙연 대표가 26.4%, 이재명 경기도지사는 23.2%로 나타났습니다.두 사람 모두 지난달과 마찬가지로 선호도가 오차범위 내에서 비슷하게 나타났습니다.더불어민주당 지지층에서는 이낙연 대표의 선호도가 50.9%로 30.3%인 이재명 지사보다 더 높았습니다.이 대표는 호남권과 진보성향층에서, 이 지사는 30대와 인천·경기 지역에서 상대적으로 선호도가 높게 나타났습니다. 국민의당 안철수 대표는 6.8%, 무소속 홍준표 의원은 5.5%, 오세훈 전 서울시장은 3.1%였습니다.MBC가 코리아리서치에 의뢰해 실시한 이번 여론조사의 표본 오차는 플러스마이너스 3.1%포인트이며 더 자세한 사항은 중앙선거여론조사심의위원회 홈페이지를 통해 확인할 수 있습니다.MBC뉴스 조명아입니다. ==============================조사의뢰 : MBC 조사기관 : (주)코리아리서치인터내셔널 대상 : 전국에 거주하는 만 18세 이상 남녀 1,005명 피조사자 선정 방법 : 성·연령·지역별 할당 / 3개 통신사 무선전화 가상번호 조사방법 : 무선 전화면접(100%) 기간 : 2020년 9월 27일 ~ 28일(2일간) 응답률 : 21.3%(4,708명 중 1,005명 응답) 가중값 산출 및 적용방법 : 지역별/성별/연령별 가중치 부여(셀가중, 2020년 8월 말 행정안전부 주민등록인구통계 기준) 표본오차 : 95% 신뢰수준, ±3.1%p 질문내용 : 중앙선거여론조사심의위원회 홈페이지 참조 [연관기사]1. ""대북정책 강경"" 53.4%…""대화로 해결"" 43.4%2. 대통령·여당 국정운영 지지도 동반 상승MBC뉴스는 24시간 여러분의 제보를 기다립니다.▷ 전화 02-784-4000▷ 이메일 mbcjebo@mbc.co.kr▷ 카카오톡 @mbc제보                                                                                                                                                                                                                                                                                                                                                                                                                                                                                                                                                                                                                                                                                                                                                                                                                                                                                                                                                                                                                                                                                                                                                                                                                                                                                                                                                                                                                                                                                                                                                                                                                                                                                                                                                                                                                                                                                                                                                                                                                                                                                                                                                                                                                                                                                                                                                                "
3,MBC,"""대북정책 강경"" 53.4%…""대화로 해결"" 43.4%"," 앵커 MBC가 추석을 앞두고 어제와 그제 이틀 동안 여론 조사를 했습니다.먼저, 서해상 공무원 피살 사건 이후 대북 정책에 대해서 대화로 풀어야 한다는 의견보다 강경한 대응을 주문하는 의견이 우세했습니다.또 추석 연휴 기간 예고돼 있던 개천절 집회에 대해서는 방역을 위해 금지해야 한다는 의견이 압도적으로 많았습니다.먼저, 이기주 기잡니다. 리포트 최근 서해상에서 발생한 해양수산부 공무원 피살 사건 이후, '대북정책이 어떤 방향으로 추진돼야 하는지' 물었습니다.'남북협력을 중단하고, 북한에 강경하게 대응해야 한다'는 응답이 53.4%로 나와, '북한이 잘못했지만, 대화와 협력을 통해 해결해야 한다'는 응답 43.4%를 10% 포인트 앞섰습니다.코로나19 방역에 대해선 정부 정책에 대체로 공감하는 의견이 많았습니다.응답자의 79.4%가 정부의 방역 대응을 긍정적으로 평가했고, 부정 평가는 19.6%에 불과했습니다.특히 개천절 집회에 대해선 '방역을 위해 집회 금지는 당연하다'는 응답이 78.8%로, '집회와 시위의 자유를 위해 금지할 필요없다'는 응답 19.3%보다 4배 이상 많았습니다.사회적 거리두기에 대해선 '방역을 위해 강력한 거리두기를 해야한다'가 61.1%, '경기침체를 막기 위해 완화해야 한다'가 36.9%로 집계됐고, 절반 이상의 응답자가 '코로나19로 추석 지출이 줄어들 것'이라고 답했습니다.  현 정부 임기내 집값 전망에 대해서도 물었는데, '계속 오를 것 같다""는 응답이 과반을 넘어, 종합부동산세 강화 등 정부의 강력한 부동산 정책의 효과를 아직은 국민들이 체감하지 못하는 것으로 나타났습니다. 의대생들에게 추가로 국가고시 응시 기회를 부여해야 하는지에 대해서는 '형평성과 공정성을 고려해 기회를 줘선 안된다'는 응답이 54.8%로, '의사 수급을 고려해 추가 시험의 기회를 줘야 한다'는 의견을 앞질렀습니다. 추미애 법무부장관의 거취 논란에 대해선, '아들 특혜 의혹에 책임지고 사퇴해야 한다'가 53.9%로, '과도한 정치공세이므로 사퇴해선 안된다' 39.2%보다 많았습니다.이번 설문 조사는 그제와 어제 이틀간 진행돼 추 장관에 대한 검찰의 불기소 결정이 답변에 반영되지는 않았습니다. MBC뉴스 이기주입니다.==============================조사의뢰 : MBC 조사기관 : (주)코리아리서치인터내셔널 대상 : 전국에 거주하는 만 18세 이상 남녀 1,005명 피조사자 선정 방법 : 성·연령·지역별 할당 / 3개 통신사 무선전화 가상번호 조사방법 : 무선 전화면접(100%) 기간 : 2020년 9월 27일 ~ 28일(2일간) 응답률 : 21.3%(4,708명 중 1,005명 응답) 가중값 산출 및 적용방법 : 지역별/성별/연령별 가중치 부여(셀가중, 2020년 8월 말 행정안전부 주민등록인구통계 기준) 표본오차 : 95% 신뢰수준, ±3.1%p 질문내용 : 중앙선거여론조사심의위원회 홈페이지 참조 [연관기사]1. ""대북정책 강경"" 53.4%…""대화로 해결"" 43.4%2. 대통령·여당 국정운영 지지도 동반 상승MBC뉴스는 24시간 여러분의 제보를 기다립니다.▷ 전화 02-784-4000▷ 이메일 mbcjebo@mbc.co.kr▷ 카카오톡 @mbc제보                                                                                                                                                                                                                                                                                                                                                                                                                                                                                                                                                                                                                                                                                                                                                                                                                                                                                                                                                                                                                                                                                                                                                                                                                                                                                                                                                                                                                                                                                                                                                                                                                                                                                                                                                                                                                                                                                                                                                                                                                                                                                                                                                                                                                                                                                                                                                                "
