,Press,Title,Text
34,MBC,[뉴스 열어보기] 나도 근로장려금 받나…맞벌이 최대 105만원," 앵커 간밤에 새로 들어온 소식, 또 사람들의 관심을 끈 뉴스를 전해드리는 '뉴스 열어보기' 시간입니다.  앵커 먼저, 머니투데이입니다. 앵커 국세청이 137만 가구에 근로장려금을 지급할 예정이라고 밝혔습니다.근로장려금은 한 가구에 한 명만 지급받을 수 있고, 지급 대상은 배우자와 부양가족이 있냐 없냐에 따라서 따라서 단독, 홀벌이, 맞벌이 가구로 구분되는데요.작년 총소득 또는 올해 근로소득에 따라서 근로장려금 신청 자격이 주어집니다. 단독 가구는 최대 2천만 원 미만이고 맞벌이 가구는 최대 3600만 원 미만인데요.지급액은 단독 가구의 경우 최대 52만 5천 원, 맞벌이 부부는 최대 105만 원입니다.이번 달 15일까지 신청 가능하고, 국세청의 심사를 거쳐 12월에 지급될 예정입니다. 앵커 다음은 한겨레입니다.자가격리자와 함께 지내던 가족이 코로나19에 감염되는 사례가 잇따라 발생하면서 추가 감염에 대한 우려가 커지고 있습니다.자가격리자와 가족을 분리할 임시생활시설 확충이 시급한 상황인데요.일부 자치단체는 자가기격리자가 지정 임시생활시설에서 격리하는 걸 허용하기도 합니다.다만 발생하는 비용을 모두 지원하지는 않기 때문에, 부담을 느낀 자가격리자들이 가족과 함께 집에 머무르면서 추가 감염의 고리가 되고 있는 건데요.한 지자체 관계자는 ""가족 전파를 막기 위해서 임시생활시설에서 자가격리를 좋겠지만 현실적으로 시설 확보가 쉽지 않고 비용도 만만치 않은 상황""이라고 토로했습니다. 앵커 다음은 서울신문입니다. 사회적 거리두기 2.5단계가 시행되면서 일회용품 사용이 늘어나고 있습니다.어제 환경부에 따르면 올해 상반기 하루 평균 종이류와 플라스틱류 폐기물 발생량은 800톤이 넘었는데요.지난해 같은 기간보다 15퍼센트 이상 늘어난 수치입니다.'찜찜하다'는 심리적 이유로 일회용 컵을 요구하는 사람들이 많아지면서 플라스틱 용기나 비닐 포장재 같은 폐기물 배출이 늘어난 건데요.설상가상으로 폐기물 업체의 경영난이 계속되면서 수거 자체를 거부하는 '플라스틱 대란'이 벌어질 수 있다는 우려도 나오고 있습니다.한 전문가는 ""사회적 거리두기가 이어지면 가정에서 배출되는 쓰레기양도 점점 많아질 것""이라면서 ""다회용기를 빌리고 세척하는 산업을 키울 필요가 있다""고 조언했습니다. 앵커 계속해서 서울신문 살펴봅니다.마스크 착용의 중요성을 강조한 서울시의 포스터가 화제를 모으고 있습니다.지난달 31일, 서울시는 서울도서관 외벽에 '어느 마스크를 쓰시겠습니까?'라는 문구가 담긴 대형 포스터를 내걸었습니다.보건용 마스크를 쓰고 책을 읽는 사람과 인공호흡기를 쓰고 누워 있는 사람을 보여 주면서 '남이 씌워줄 땐 늦습니다'라는 문구를 적어 자발적 마스크 쓰기를 강조한 건데요.해당 포스터를 본 시민들은 ""정신이 바짝 든다"", ""마스크를 턱에 걸치고 쓴 사람들에게 보여 주고 싶다""는 등 뜨거운 반응을 보이고 있습니다. 앵커 다음은 국일일보입니다.우리나라 2분기 실질 국민총소득이 1분기보다 2.2 퍼센트 줄었습니다.국민총소득은 전체 국민이 국내외에서 벌어들인 임금과 이자 같은 모든 소득의 합계인데요.세계 금융위기 당시인 2008년 4분기 이후 최저 수준이라고 합니다.다만 올해 국민소득이 3만 달러 아래로 떨어질 가능성은 낮은 것으로 전망됐는데요.한 전문가는 ""남은 4개월 동안 환율이 1,292원 이하로 유지되면 1인당 국민소득이 3만 달러 밑으로 떨어지지는 않을 것으로 보인다""고 설명했습니다. 앵커 끝으로, 한국경제입니다.국토교통부가 민간임대주택법 시행령 개정안을 오늘부터 40일간 입법예고한다고 발표했습니다.오는 12월 10일부터는 임대사업자가 임차인의 보증금을 제때 돌려주지 않으면 지방자지단체가 직접 임대사업자 등록을 말소할 수 있게 되는데요.다주택 임대사업자 중에서 임대차 계약 만료를 앞두고 보증금 반환을 거부한 채 잠적하는 사례가 적지 않다는 지적이 나오면서 문제점을 개선한 겁니다.또, 임대사업자가 임대차 계약을 신고하지 않아서 지자체장이 보고를 요청했을 때 세 번 이상 응하지 않거나 거짓으로 보고하면 이것 역시 등록 말소의 대상이 됩니다.정부가 발표한 부동산 정책의 후속 조치인 이번 개정안은 지자체의 임대사업자 등록 말소에 관한 세부 사유를 규정했습니다.지금까지 '뉴스 열어보기'였습니다.                                                                                                                                                                                                                                                                                                                                                                                                                                                                                                                                                                                                                                                                                                                                                                                                                                                                                                                                                                                                                                                                                                                                                                                                                                                                                                                                                                                                                                                                                                                                                                                                                                                                                                                                                                                                                                                                                                                                                                                                                                                                                                                                                                                                                                                                                                                                                                "
35,MBC,"박병석 의장 ""국민들 위기의 강 건너도록 국회가 다리 놓아야""","박병석 국회의장은 ""국민이 무사히 위기의 강을 건널 수 있도록 국회가 튼튼한 다리를 놓아야 한다""고 밝혔습니다.박 의장은 오늘 오후 국회에서 열린 21대 정기국회 개회식 기념사에서 ""여야가 코로나 및 민생법안을 신속하게 집중 처리해야 한다""며 이같이 말했습니다.박 의장은 ""코로나19 위기, 부동산 불안 등 국가적 과제가 밀려왔지만 국회가 제때 협력하고 대응했는가""라며 ""21대 국회에 대한 국민의 평가는 냉정하고, 의장과 여야 모두 면목없는 일""이라고 자성했습니다.그러면서 여당에게는 ""집권당답게 책임있는 자세를 보여주고, 포용의 정치, 통 큰 정치를 이끌어달라""고 주문했고, 야당에게는 ""대안정당이자 정책정당으로 자리매김해달라""고 당부했습니다.특히 박 의장은 여야를 향해 ""남북 국회회담 촉구 결의안을 채택해주실 것을 제안한다""며 ""이는 남북관계의 물꼬를 트고 여야 협력의 정치로 전진하는 촉매제가 될 것""이라고 강조했습니다.박 의장은 정부를 향해서는 ""중요한 예산이나 법안, 정책을 국회와 사전 협의 후 추진한다는 원칙을 확립해야 한다""며 ""야당에게도 여당 못지않게 성의있는 설명을 해달라""고 주문했습니다.                      "
36,MBC,"김태년 ""부동산 점검 조직의 재정비 방안 강구""","더불어민주당 김태년 원내대표는 부동산 문제와 관련해 ""실수요자가 부동산 시장 교란 때문에 피해받지 않도록 부동산 점검 조직의 실효적인 재정비 방안을 강구하겠다""고 말했습니다.김 원내대표는 원내대책회의에서 ""8·4 부동산 대책을 시행한 지 한 달 가까이 됐다""며 ""한국감정원 발표에 따르면 수도권을 비롯한 전국 아파트 매매 및 전세가가 안정세를 찾아가고 있다""고 밝혔습니다.이어 ""당정은 긴장을 늦추지 않고 부동산 교란 행위 같은 잔불이 다시 불길로 타오르지 않도록 만전을 기하겠다""며 ""불법행위가 근절돼야 정책이 시장에서 제대로 된 효과를 거둘 수 있다""고 강조했습니다.                      "
37,MBC,"이낙연, 김종인 대권 도전설 ""바람결에 들었다""","더불어민주당 이낙연 대표가 미래통합당 김종인 비대위원장의 대권 도전 가능성에 ""그럴 수 있다고 생각한다""며, ""선택은 그 당과 국민들이 하실 일""이라고 말했습니다.이 대표는 오늘 tbs라디오 '김어준의 뉴스공장' 인터뷰에서 ""그런 이야기를 바람결에 들은 적은 있다""면서, ""가능성이야 늘 있는 것 아니냐""고 덧붙였습니다.또 김 위원장에 대해 ""저는 굉장히 가깝게 느껴왔다""며, ""그 어른은 어떻게 생각하시는지 모르지만 그저 좋은 선후배로 지내왔던 것이 사실""이라고 얘기했습니다.코로나 대응을 위한 2차 긴급재난지원금과 관련해서는 ""당정이 물밑 논의 중으로, 이번 주에 큰 가닥이 잡힐 것""이라며 ""추경을 편성한다면 다음 주 초까지는 결론이 나야 한다""고 말했습니다.또 ""고통을 더 당하는 분들께 더 빨리 더 두텁게 도와드리는 게 제도 취지에 맞다""며 기존의 선별 지급 입장을 재확인했습니다.3·4차 지원금 지급도 생각해야 하냐는 질문에는 ""그런 것도 고려해야 한다""면서, ""코로나 대유행이 이번으로 끝날지도 고려할 수 밖에 없다""고 지적했습니다.통합당 주호영 원내대표가 언급한 상임위원장 재배분 방안에 대해서는 ""어려울 것""이라며 ""당장 정기국회에 해야 할 일이 많은데, 급한 일을 못 하게 하면 안 된다""고 선을 그었습니다.정부·여당이 추진하는 부동산 정책에 대해서는 ""효과를 나타내기 시작했다고 보인다""면서 ""매매시장은 안정화의 길로 가고 있지만, 임대차시장은 정책 변화가 컸으니, 과도기적 진통이 있는 것 같다. 안정화해야 한다""고 강조했습니다.                      "
38,MBC,[뉴스 열어보기] '거리두기 2단계' 격상 후 대중교통 이용객 감소폭 2배," 앵커 간밤에 새로 들어온 소식, 또 사람들의 관심을 끈 뉴스를 전해드리는 '뉴스 열어보기' 시간입니다.  앵커 먼저, 노컷뉴스입니다. 앵커 사회적 거리두기 2단계 격상 이후 서울시 대중교통을 이용하는 승객이 크게 줄어든 것으로 나타났습니다.작년 같은 기간과 비교할 때 이용객 감소폭이 2배 가까이 늘어난 건데요.서울시는 재택근무가 늘어나고 외출을 자제하려는 시민들이 많아지면서 대중교통 이용객이 줄었다고 설명했습니다.버스보다는 지하철 이용객이 줄었고, 일반인보다는 청소년 이용객이 많이 줄었습니다. 앵커 다음은 국민일보입니다.올해 정부와 지자체가 발송한 재난문자가 지난해보다 47배 넘게 늘어난 것으로 나타났습니다.행정안전부에 따르면 올해 초부터 8월까지 발송된 재난문자는 약 2만 4천 건이 넘는데요.대부분 코로나19와 관련된 내용이었지만 일부 지자체에서는 정책 홍보성 문자도 섞어보내면서, 재난문자가 주는 경각심이 떨어지고 있다는 지적이 나오고 있습니다.재난문자는 현행법상 지자체장이 필요하다고 여기면 마음껏 보낼 수 있고 문자 발송 비용까지 무료이기 때문에 오남용에 대한 우려가 꾸준히 제기돼 왔는데요.행정안전부는 ""일부 오남용 문제를 잘 알고 있다""면서 ""시급하지 않은 문자는 자제하도록 수시로 교육하고 있다""고 설명했습니다. 앵커 다음은 동아일보입니다. 코로나19 확진자가 짧은 기간 크게 늘어나면서 진단검사에 걸리는 시간이 길어지고 있습니다.특히 확진자가 많아진 수도권 일부 지역에서는 검체 채취부터 최종 결과를 받기까지 평소보다 2배 정도 더 걸리는 것으로 나타났는데요.검사량이 많아지다 보니 결과 판정도 늦어질 수밖에 없는 상황입니다.중앙방역대책본부에 따르면 사랑제일교회에서 첫 확진자가 나오기 전에는 전국 진단검사 건수가 약 4만 8천 건에 불과했지만, 2주 뒤엔 폭발적으로 늘어나면서 13만 건을 넘겼습니다.최근에는 폭염 속에서 직원들이 과로와 탈진으로 쓰러지는 일까지 발생하면서 '진단검사 과부하'에 대한 우려도 커지고 있습니다. 앵커 한국일보 살펴봅니다.의사들이 떠난 의료 현장을 묵묵히 지키고 있는 간호사들이 어쩔 수 없이 위법행위를 떠안게 되는 상황까지 벌어지고 있습니다.동맥혈 채취나 처방 같이 의사만이 할 수 있는 업무를 간호사들이 떠맡게 됐기 때문인데요.대한간호협회 관계자는 ""간호사들이 나중에 위법한 진료를 한 혐의를 받게 될까 봐 두려워하고 있다""고 토로했습니다.앞서 대한간호협회는 ""나이팅게일 선서에서 환자의 생명에 해로운 일은 어떤 상황에서도 하지 않고 헌신하기로 다짐했다""면서 파업에 동참하지 않겠다는 입장을 분명히 했는데요.성명을 통해 의사들의 진료 거부를 즉각 중단하라고 촉구하기도 했습니다. 앵커 다음은 세계일보입니다.지난해 학대로 사망한 아동이 40명을 넘었습니다.아동을 학대한 가해자는 부모가 가장 많았고, 학대 행위는 주로 거주지에서 발생한 것으로 조사됐는데요.보건복지부가 국회에 제출한 보고서에 따르면, 지난해 아동학대 신고 건수는 약 4만 건으로 전년보다 13.7 퍼센트 늘어났습니다.또 지난해 학대로 숨진 아동만 마흔두 명이었는데, 그중 19명이 1세 미만이었던 것으로 나타났습니다.보건복지부 관계자는 ""여전히 양육자에 의한 학대가 많은 편""이라면서 ""'체벌은 학대'라는 인식과 올바른 양육방법에 대한 교육이 필요하다""고 설명했습니다. 앵커 끝으로, 서울신문입니다.서울 아파트 전월세 계약이 크게 줄어든 것으로 나타났습니다.서울부동산정보광장에 따르면 8월 한 달 동안 서울에서 체결된 아파트 전월세 임대차 계약은 약 6천 건으로, 7월보다 절반가량 줄었는데요.새로운 임대차법이 시행되면서 기존 임차인들이 보증금을 올려주고 2년 더 거주하는 쪽으로 방향을 틀자 전세 공급이 줄어든 것으로 분석됩니다.반면, 월세보다 보증금을 더 많이 내는 반전세 비중은 올 들어서 최고치를 기록했는데요.반전세 역시 임대차법 시행으로 세금 부담이 커진 집주인들이 월세로 세금을 해결하려고 하면서 반전세를 선호하게 됐기 때문이라고 합니다.지금까지 '뉴스 열어보기'였습니다.                                                                                                                                                                                                                                                                                                                                                                                                                                                                                                                                                                                                                                                                                                                                                                                                                                                                                                                                                                                                                                                                                                                                                                                                                                                                                                                                                                                                                                                                                                                                                                                                                                                                                                                                                                                                                                                                                                                                                                                                                                                                                                                                                                                                                                                                                                                                                                "
39,MBC,"김종인 ""이낙연 대표, 원만한 여야 관계에 더 노력해달라""","미래통합당 김종인 비상대책위원장은 더불어민주당 이낙연 신임 대표를 향해 ""새로 선출된 민주당 지도부는 원만한 여야 관계를 이끌어가는 데 더 노력해달라""고 당부했습니다.김 위원장은 오늘 비대위 회의에서 ""개원 국회부터 시작해 여야 대치가 국민 눈살을 찌푸리게 하는 모습을 보여줬다""며 이 같이 말했습니다.이어 ""코로나 사태로 다소 상쇄된 것 같이 느껴지지만, 부동산 정책 실패에 대한 분노가 지속하고 있다는 것을 명심하라""며 ""코로나 사태를 극복하기 위해 여야 협조가 무엇보다 중요한 시기""라고 덧붙였습니다.                      "
