,Press,Title,Text
15,news1,"북한, 태풍 피해에 코로나 방역도 각성…""위험성 더욱 커져"" ""오물 흘러들어 바이러스 전파 공간 조성…방역 유지해야""(서울=뉴스1) 이설 기자|2020-09-06 10:48 송고기사보기네티즌의견인쇄확대축소","(평양 노동신문=뉴스1) = 북한 노동당 기관지 노동신문은 2일 신종 코로나바이러스 감염증(코로나19) 방역 사업을 두고 ""비상방역전을 공세적으로 벌여나가는 것은 우리 앞에 나선 가장 중차대한 과업＂이라고 밝혔다. 사진은 마스크를 착용한 채 거리를 다니는 평양 시민들의 모습. [국내에서만 사용가능. 재배포 금지. DB 금지. For Use Only in the Republic of Korea. Redistribution Prohibited] rodongphoto@news1.kr북한은 6일 연이은 태풍 피해로 신종 코로나바이러스 감염증(코로나19)의 위험성이 더욱 커졌다면서 방역 강도를 높일 것을 주문했다. 노동당 기관지 노동신문은 이날 '태풍과 큰물(홍수)에 대처하여 비상방역사업을 빈틈없이'라는 제목의 기사를 싣고 ""비상방역사업을 더욱 강도 높이, 빈틈 없이 전개해나가는 것은 오늘 우리 앞에 나선 매우 중요한 과업의 하나""라면서 이 같이 밝혔다. 신문은 ""태풍과 큰물로 인하여 오염된 지역의 오물들이 해안가나 국경지대의 강하천들에로 흘러들어 악성 비루스(바이러스)를 전파시킬 수 있는 공간을 조성하고있는 것으로 하여 위험성은 더욱 커지고 있다""라고 설명했다. 이어 ""이러한 실태는 모든 일꾼들과 당원들과 근로자들이 한순간도 해이됨이 없이 태풍과 큰물 피해에 의한 후과를 가시는 것과 함께 비상방역기관에서 시달하는 지시와 포치를 가장 정확하게 집행하여 완벽한 방역 형세를 철저히 유지해나갈 것을 요구하고 있다""라고 부연했다. 또 ""일꾼들은 태풍 피해, 큰물피해 복구에 동원된 모든 성원들이 최대로 각성 분발하고 비상방역 규율을 엄격히 준수하여 사소한 비정상적인 요소도 나타나지 않도록 사상교양사업을 더욱 공세적으로 전개해나가야 한다""라고 덧붙였다. 특히 ""자료에 의하면 악성 비루스는 오염된 물체의 겉면에서 일정한 기간 생존할 수 있다고 한다""면서 ""태풍에 의해 해안가와 강하천들에 쌓인 오물들을 철저히 방역학적 요구에 맞게 소독, 수거, 매몰하여야 한다""라고 강조했다. 아울러 ""비상방역 부문에서는 오물이 많이 쌓인 지역 안의 주민들에 대한 검병과 체온 재기 등을 더욱 엄격히 진행하며 주민지대에 대한 소독을 보다 책임적으로 진행하여야 한다""면서 통제의 강도를 높여야 한다고 촉구했다. 최근 북한은 제9호 태풍 '마이삭'의 영향으로 함경남·북도 해안연선 지대에서 1000여 세대의 살림집(주택)들이 각각 파괴된 것으로 전해졌다. 이에 김정은 국무위원장은 5일 피해지역 현지에서 당 중앙위원회 정무국 확대회의를 소집하고대책을 논의했다.sseol@news1.kr"
16,news1,"노동신문 ""코로나19 방역은 '사활적 사업'…방심하면 대재앙"" 1면 논설서 빈틈없는 방역 주문…감염자 '0명' 주장은 고수(서울=뉴스1) 양은하 기자|2020-07-30 10:08 송고기사보기네티즌의견인쇄확대축소","(평양 노동신문=뉴스1) = 북한 노동당 기관지 노동신문은 30일 신종 코로나바이러스 감염증(코로나19) '최대비상체제' 아래 각지에서 진행 중인 비상 방역사업을 소개했다. [국내에서만 사용가능. 재배포 금지. DB 금지. For Use Only in the Republic of Korea. Redistribution Prohibited] rodongphoto@news1.kr북한은 30일 신종 코로나바이러스 감염증(코로나19) 방역을 '사활적 사업'이라고 강조하며 빈틈없는 방역을 주문했다. 코로나19 감염이 의심된다는 탈북자의 월북을 계기로 국가비상방역체계를 '최대비상체제'로 격상한 이후 연일 경각심 고조에 공을 들이고 있다. 노동당 기관지 노동신문은 이날 '당중앙위원회 정치국 비상확대회의 결정 관철에서 무한한 책임성과 충실성, 헌신성을 발휘하여야 한다' 제목의 1면 논설에서 회의 결정을 관철해야 한다며 이 같이 강조했다. 신문은 ""만일 비상 방역사업을 순간이라도 방심하고 소홀히 한다면 그로 하여 초래될 후과는 무엇으로써도 보상할 수 없다""라며 ""세계적인 악성 전염병의 급속한 전파로 하여 대재앙을 겪고 있는 수많은 나라들의 실태가 이것을 입증해주고 있다""라고 주장했다.이어 ""현시기 우리가 가장 경계하여야 할 것은 이번 사태의 심각성을 깨닫지 못하고 안일한 인식에 포로돼 비상방역 사업을 만성적으로, 기계적으로, 실무적으로 대하는 현상""이라며 방역에 만전을 기울일 것을 거듭 당부했다. 신문은 또 방역 규율과 질서를 엄격 준수하는 등 중앙비상방역지휘부의 지휘와 통제에 복종할 것도 요구했다. 특히 간부들에게는 ""비상방역 사업을 빈틈없이 조직집행하며 예견성 있는 대책으로 인민생활을 최대한 안정시키는 것""을 주문했다. 그러면서 ""전체 인민이 한 사람같이 떨쳐나서며 악성 비루스(바이러스)가 유입될 수 있는 빈 공간을 모조리 찾고 대책을 세워나가야 한다""라고 덧붙였다. 한편 북한은 코로나19 의심자가 귀향한 개성시를 중심으로 강도 높은 방역을 이어가고 있다. 최룡해 최고인민회의 상임위원장 겸 국무위원회 제1부위원장이 개성시를 찾아 방역 실태를 점검하기도 했다. 하지만 현재까지 북한은 공식적으로 코로나19 감염자가 없다는 입장을 유지하고 있다. 이날 신문도 별도 기사에서 ""아직까지 우리나라에 단 한 명의 신형 코로나비루스 감염자도 발생하지 않았다""라고 밝혔다.yeh25@news1.kr"
17,news1,코로나19로 확 달라진 열차·고속도로 휴게소 풍경…방역 '안간힘' KTX 등 열차 창가 좌석만 판매…마스크 착용 의무화 등 방역 강화고속도로 휴게소 내 실내 취식 금지…출입명부 기록·발열 확인 등(대전ㆍ충남=뉴스1) 한희조 기자|2020-10-02 19:20 송고기사보기네티즌의견인쇄확대축소,"© 뉴스1추석 연휴를 하루 앞둔 지난달 29일 오후 충남 예산역의 열차 승강장은 한산했다. 몇 사람이 거리를 두고 열차를 기다리고 있었지만, 고향을 오가는 승객들로 붐볐던 예년 명절 풍경과는 사뭇 다른 모습이었다.추석 연휴동안 지역 간 이동을 자제하라는 자치단체 권고에 따라 이용객이 많이 줄어든 데다,귀경행렬이 시작되기 전에 미리 친인척 집을 방문한 뒤 연휴 전 귀가하는 등 차선책을 택하는이들도 생겨났기 때문이다.천안에 사는 84세 김 모 할머니는 ""코로나19 때문에 불안해서 자녀들에게 고향에 내려오라고 할 수가 없다. 그래서 추석보다 이틀 앞서 인근에 있는 큰 딸 집에 들렀다. 다른 아이들은 서울이나 경기도에 사는데, 이번 추석 연휴에는 오지 말라고 했다""고 밝혔다.서울로 향하는 무궁화호 열차 안에는 마스크를 쓴 승객들이 창가쪽 좌석에만 앉아 이동했다.정부는 지난달 29일부터 오는 4일까지 6일간 시행하는 '정부합동 특별교통대책'의 일환으로 KTX·SRT 등 모든 열차가 승객을 절반만 채운 채 운행하도록 지침을 내놨다.한국철도공사는 승객 간 거리두기를 위해 추석연휴기간 열차 승차권에 대해 창가 측 좌석만 판매하고 통로 측 좌석은 판매하지 않았다.홍성에 사는 신형일씨(32)는 ""타지에서 명절을 쇨 수 없어 고향으로 가야하지만 코로나19 확산이 우려돼 대중교통 이용이 꺼려지는 건 사실""이라며 ""창가 쪽 좌석만 판매하니 많은 사람이 밀집하지 않아도 되고, 다른 승객들과 거리를 둘 수 있어 안심하고 이동할 수 있는 것 같다""고 말했다.한국철도공사 관계자는 ""지역 간 대이동이 불가피한 만큼 코로나19 예방에 초점을 맞춰 이같은 대책을 세운 것으로 알고 있다""며 ""승객들의 마스크 착용을 의무화하고 목적지에 도착할 때마다 열차 내 소독을 실시하는 등 코로나19 확산 예방을 위해 방역에 총력을 기울이고 있다""고 강조했다. © 뉴스1명절이면 오랜 귀경행렬에 지친 시민들로 분주했던 고속도로 휴게소도 상황이 달라졌다.2일 충남에 위치한 한국도로공사 대전방향 예산휴게소에서는 식음료를 구매하려는 시민들이 발열을 확인하고 출입명부를 작성한 뒤 실내시설로 입장했다.구입한 식음료는 식당에서 포장해 자가용이나, 투명 가림판이 설치된 야외 테이블에서 섭취하는 이색적인 풍경이 펼쳐졌다.강화된 코로나19 방역 대책의 일환으로 고속도로 휴게소 내 매장 좌석 운영이 금지됐기 때문이다.추석을 맞아 여행길에 고속도로 휴게소를 방문했다는 이민호씨는 ""고속도로 휴게소는 사람이 많이 모이는데다 음식을 섭취하는만큼 코로나19 감염 위험이 높아 정부가 강력하게 방역을 강화한 것이 적절하다고 본다""고 밝혔다.다만 ""생각보다 인파가 더욱 없어 놀랐다. 휴게소 내 입점한 자영업자들의 생계에 큰 영향이 있을 것 같아 걱정""이라고 우려했다.예년 이맘때쯤이면 휴게소 주차장을 가득 메울 만큼 많은 시민이 방문했지만, 올해는 발길이 훨씬 줄었다. 계속되는 코로나19 상황으로 매출에 큰 타격을 입을 것이 불가피한 휴게소 관계자들은 복잡한 마음을 내비쳤지만, 시민들을 위한 방역 관리가 우선이라는 입장이다.예산휴게소 상품담당 오미혜 주임은 ""지난해 최고 매출이 6000만 원가량인 데 비해 올해는 5분의1 수준으로 줄었다""며 ""매장 내 식음료 판매가 제한되다보니 안심이 된다는 시민들도 있지만, 불편감을 호소하는 분들도 더러 있는 게 사실""이라고 말했다.그러면서 ""코로나19 확산 방지가 우선인만큼 발열체크와 수기명부 작성, 식품 위생관리 등에 온 힘을 쏟고 있다""고 강조했다.gmlwh1010@news1.kr"
18,news1,"북한 최룡해, '봉쇄' 개성시 시찰…코로나19 방역 실태 점검 방역·물자 반입 실태 파악…민생 살피기 의도(서울=뉴스1) 양은하 기자|2020-07-30 07:40 송고기사보기네티즌의견인쇄확대축소","(평양 노동신문=뉴스1) = 최룡해 북한 최고인민회의 상임위원회 위원장이 개성시를 찾아 비상방역사업을 점검했다고 노동당 기관지 노동신문이 30일 전했다. 최 위원장은 개성시와 인접한 지역에 긴급 전개된 방역초소들을 돌아보면서 방역과 물자반입실태를 구체적으로 파악했다. [국내에서만 사용가능. 재배포 금지. DB 금지. For Use Only in the Republic of Korea. Redistribution Prohibited] rodongphoto@news1.kr최룡해 북한 최고인민회의 상임위원장 겸 국무위원회 제1부위원장이 개성시를 찾아 신종 코로나바이러스 감염증(코로나19) 방역 실태를 점검했다. 노동당 기관지 노동신문은 30일 ""최룡해 동지가 개성시의 비상방역사업정형을 요해(파악)하였다""라고 보도했다. 최룡해 상임위원장은 개성시 인근에 세워진 방역초소를 돌아보고 방역과 물자 반입 실태를 파악했다. 그는 ""개성 시민들의 생활에 필요한 식료품, 의약품 등의 물자 보장 사업이 집중적으로 진행되는 데 맞게 소독과 검역사업을 방역학적 요구대로 엄격히 진행하라""라고 주문했다. 현지에서 진행된 협의회에서는 ""방역사업에 동원된 일꾼들과 방역 성원들이 당 중앙의 지시와 포치를 가장 정확하게 집행하며 해당 기관들 사이의 긴밀한 협동 밑에 철저하고도 안정적인 대책을 세우기 위한 문제들이 토의되었다""라고 신문은 전했다. 개성시는 최근 월북한 탈북민이 귀향한 곳이다. 북한은 그가 코로나19 의심자라며 개성시를 봉쇄하는 등 국가비상방역체계를 '최대비상체제'로 격상해 대응하고 있다. 공식 서열 2위인 최룡해 상임위원장을 개성에 보낸 것은 강도 높은 방역 사업이 진행되는 지역의 민생을 살피면서 동시에 이곳이 탈북자로 인해 코로나19 확산 가능성이 있다는 것을 보여주려는 것으로 해석된다.yeh25@news1.kr"
19,news1,"계룡시, 코로나 방역소독 완료 업소 ‘클린존’ 인증 추진 확진자 방문 업소 대상 방역완료 표시(대전ㆍ충남=뉴스1) 조문현 기자|2020-09-08 11:09 송고기사보기네티즌의견인쇄확대축소","방역완료 표시하는 ‘클린존’ 인증 스티커© 뉴스1계룡시 보건소는 코로나19 확진자 방문 업소에 대해 방역 완료를 표시해주는 ‘클린존’ 인증 사업을 시행한다.8일 시에 따르면 클린존 인증사업은 최근 코로나19로 인해 소상공인의 매출 감소가 심각한 상황에서 방역·소독이 완료됐음을 알리는 클린존 스티커 부착을 통해 안심하고 해당 업소를 방문토록 하기 위한 것이다.시에서는 현재 19개 업소에 클린존 스티커를 부착했으며, 확진자가 가장 최근에 방문한 업소까지 방역을 모두 완료했다.손병임 보건소장은 “코로나19 확진자 및 접촉자가 방문한 모든 업소에 대해 방역소독을 완료한 상황으로, 해당 업소를 방문하더라도 감염 우려는 전혀 없다”며 “클린존 인증사업이 확진자 방문 업소의 영업 정상화에 도움이 되길 바란다”고 말했다.cho7112@news1.kr"
20,news1,"북한, 코로나19 방역에 '특급경보'…""고도의 각성 발휘"" '불법 귀향자' 재언급…방역 경각심 높이는 듯평양·신의주·남포 등 주요 도시 방역사업 박차(서울=뉴스1) 김정근 기자|2020-08-04 10:40 송고기사보기네티즌의견인쇄확대축소","(평양 노동신문=뉴스1) = 북한 노동당 기관지 노동신문은 4일 평양시의 비상방역사업 현황을 전했다. [국내에서만 사용가능. 재배포 금지. DB 금지. For Use Only in the Republic of Korea. Redistribution Prohibited] rodongphoto@news1.kr신종 코로나바이러스 감염증(코로나19) 방역을 위해 '특급경보'를 내린 북한이 ""조성된 방역 위기를 타개하는 데서 최대의 적은 해이성""이라며 각성을 촉구했다.노동당 기관지 노동신문은 4일 1면에 '최대비상체제는 고도의 각성과 엄격한 준수를 요구한다'라는 제목의 논설을 싣고 이 같이 밝혔다.신문은 ""최대비상체제 하에서의 방역전의 성과 여부는 전적으로 그를 대하는 사람들의 관점과 각오에 달려있다""라며 ""각성하여 긴장하게 일하는 사람에게는 당의 의도와 어긋나게 행동하는 현상이 절대로 나타날 수 없다""라고 목소리를 높였다.아울러 ""최근 개성시에서 위험한 사태가 발생했다""라며 ""불법 귀향자에게서 악성비루스감염자로 의진할 수 있는 석연치 않은 결과가 나온 것과 관련하여 해당 지역에 비상사태를 선포하고 국가 비상 방역체계를 최대비상체제로 이행하도록 하였으며 특급경보를 발령하였다""라고 코로나19와 관련한 최근 상황을 정리했다.특히 지난달 19일 재입북했다고 알려진 코로나19 '의진자'가 다시 신문에 언급된 것은 지난달 27일 이후 처음이다. 이는 해당 의진자에 의해 촉발된 현 특급경보를 상기시키고 방역에 대한 경각심을 높이려는 의도로 풀이된다.한편 의진자의 상태가 여전히 '석연치 않은 결과'로만 설명된 것을 미루어 볼 때 그의 건강에 별다른 변화는 없는 것으로 판단된다. 격리 기간도 2주가량 지난 만큼 북한 내 코로나19에 대한 '실체적 위협'은 일정 부분 줄어든 것으로 보인다.다만 ""악성 전염병을 통제·관리할 수 있는 수준에 이르렀다고 자평하며 탕개를 늦추었다가 엄중한 후과(나쁜 결과)가 초래되고 있는 나라들의 실태가 보여주는 엄연한 현실""이라며 방역의 고삐를 당기고 있는 만큼 의진자에 대한 완전한 확진 판정은 좀 더 시간이 걸릴 것으로 예상된다.(평양 노동신문=뉴스1) = 북한 노동당 기관지 노동신문은 4일 신종 코로나바이러스 감염증(코로나19)와 관련한 남포수출입품검사검역소의 방역사업 현황을 보도했다. [국내에서만 사용가능. 재배포 금지. DB 금지. For Use Only in the Republic of Korea. Redistribution Prohibited] rodongphoto@news1.kr이날 신문은 3면 전체를 할애해 코로나19 방역과 관련된 특집 기사를 싣고 수도 평양을 비롯한 신의주, 남포 등의 방역사업 현황을 자세히 전했다.평양은 지하철·버스 등 평양시로 들어오는 입구와 주요 지점마다 방역초소를 증강 배치하고 방역진을 구축하고 있다. 또 평양시의 의료진은 주민에 대한 검진을 진행해 발열 증상을 보이는 사람과 호흡기 질환을 가진 환자들을 찾아내는 방역사업을 진행 중이다.신의주시에서는 특급경보에 맞게 새로운 방역초소와 방역 인원을 증강하고 있다. 이어 보호복, 마스크, 비접촉식 체온계 등의 방역물자 보장에도 힘쓰고 있다고 신문은 설명했다.남포시는 배가 들어오는 항만 시설이 있는 만큼 방역에 더욱더 철저한 모습이다. 특히 남포수출입품검사검역소는 사람과 물자 교류에 촉각을 곤두세우고 있다.신문은 ""이곳 검역소에서는 악성 전염병의 유입 공간을 차단하기 위해 검사검역을 보다 치밀하게 실시하고 있다""라며 ""입항하는 배들에 대한 전면 소독을 엄격히 진행하고 납입 물자들에 대한 방치 전 소독과 방치 후 소독을 어김없이 깐깐히 하고 있다""라고 강조했다.또 ""하선 작업에 동원된 성원들이 출입 시 소독 통로를 반드시 통과하도록 하는 것을 비롯하여 제정된 행동 질서와 방역 규율을 철저히 준수하도록 하고 있다""라며 ""남포수출입품검사검역소에서는 비상 정황이 발생할 경우 신속히 대처할 수 있는 검사기구와 설비들을 철저히 갖추고 방역 전선을 믿음직하게 지켜가고 있다""라고 주장했다.한편 신문은 ""당의 노선과 정책, 결정을 사상적으로 접수하고 철저히 관철해나가는 여기에 충성의 길, 애국의 길, 인민을 위한 길이 있다""라며 사상 무장을 강조하기도 했다. 방역 사업이 일정 부분 안정화 단계에 들어섰다는 판단하에 이번 사안을 내부 결속을 다지는 계기로도 활용하는 모습이다.(평양 노동신문=뉴스1) = 북한 노동당 기관지 노동신문은 4일 신종 코로나바이러스 감염증(코로나19)와 관련한 평양시의 비상방역사업 현황을 전했다. [국내에서만 사용가능. 재배포 금지. DB 금지. For Use Only in the Republic of Korea. Redistribution Prohibited] rodongphoto@news1.kr carrot@news1.kr"
21,news1,"'정부 코로나19 방역활동 방해' 신천지 이만희, 3일 첫 준비기일 코로나19 확산세 여파 비공개로 진행(수원=뉴스1) 유재규 기자|2020-09-02 16:13 송고기사보기네티즌의견인쇄확대축소","이만희 신천지예수교 증거장막성전 총회장이 2일 오후 경기 가평 신천지 평화의 궁전에서 열린 코로나바이러스 감염증(코로나19) 사태 관련 기자회견에서 총회장 특별 편지를 공개하고 있다. © News1 허경 기자신종 코로나바이러스 감염증(코로나19)의 정부 방역활동을 방해한 혐의로 고발된 신천지예수교 증거장막성전(신천지) 이만희 총회장(89)에 대한 첫 공판준비기일이 3일 열린다.2일 수원지법에 따르면 형사11부(부장판사 김미경)는3일 오전 10시30분 감염병예방법 위반 등 혐의로 구속기소된 이씨에 대한 첫 준비기일을 비공개로 진행한다.공판준비기일은 피고인의 주 혐의점에 대해 검찰 측과 변호인 측에서 쟁점을 정리하고 공판을 어떻게 진행할지 조율하는 자리로 본격적인 재판에 앞서 이뤄지는 하나의 절차다.공개재판이 원칙이긴 하나, 재판부는 코로나19의 확산세의 영향으로 공판진행에 반드시 필요한 검찰과 변호인 측만 참여시키는 비공개 방식으로 1차 준비기일을 갖기로 했다.출석 의무가 자유로운 준비기일이기 때문에 이씨를 비롯해 구속기소된 신천지 간부 등 피고인 4명이 법정에 출석할 지는 불투명하다.수원지법 관계자는 ""추후 재판에 대한 공개여부는 재판부의 판단에 따라 결정될 것""이라고 말했다.이씨는 신천지 대구교회를 중심으로 코로나19가 확산하던 때인 지난 2월 방역당국에 교인명단과 시설현황을 누락하거나 허위로 제출하는 등 방역 업무를 방해한 혐의를 받는다.또 신천지 연수원인 가평 평화의 궁전 신축 등과 관련해 56억원을 빼돌리고, 공공시설에 무단으로 진입해 만국회의 행사를 수차례 강행한 혐의도 받는다.이씨를 포함한 신천지는 코로나19가 신천지 신도에 의해 확산되자 지방자치단체와 전피연 등 단체로부터 여러 차례 고발당했다.이 가운데 전국신천지피해자연대는 코로나19 관련, 정부의 방역활동을 방해해 온 국가를 위기로 빠뜨렸다는 취지로 지난 2월 이씨를 고발하고 대검찰청은 이 총회장 고발 사건을 수원지검에 배당했다. 수원지검은 과천 총회 본부와 가평 평화의 궁전, 부산과 광주, 대전의 신천지 관련 시설 여러 곳을 압수수색하고 여러 증거물을 확보, 이씨를 상대로 2차례 조사한 끝에 지난 7월28일 구속영장을 청구했다.수원법원종합청사. 2019.5.24/뉴스1 © News1 조태형 기자또 같은 날에는 검찰이 방역 방해 등 혐의로 신천지 간부 A씨 등 3명을 구속기소하고 4명을 불구속 기소했다. 지난 8월1일 수원지법은 감염병예방법 위반, 위계에 의한 공무집행방해, 특경법 위반(횡령), 업무방해 등 혐의를 받고 있는 이씨를 '범죄혐의 일부 소명' '수사 과정의 증거인멸 정황' '추가 증거인멸 염려' 등 이유로 구속영장을 발부, 이씨를 구속했다.이에 신천지 측은 이씨의 구속이 부당하다는 취지로 같은 달 12일 수원지법에 구속적부심 청구서를 제출했지만 법원은 범죄사실의 소명 정도, 수사상황 진행 등 구속영장 발부가 부적법하지 않다며 '이유없음'으로 구속적부심 청구를 기각했다. koo@news1.kr"
