,Press,Title,Text
42,news1,"[뉴스1 PICK] '거리두기 2단계' 코로나19 방역강화 첫날  당국 ""이번 주 확산 저지 분수령…거리두기 2단계 30일까지 시행""""거리두기 2단계"" 호텔 뷔페도 '줄휴업'…'혼란가중' 웨딩은 어쩌나?(서울=뉴스1) 임세영 기자|2020-08-20 07:28 송고기사보기네티즌의견인쇄확대축소","19일 오후 경기도 수원시내 한 예식장에서 직원들이 신종 코로나바이러스 감염증(코로나19) 예방을 위해 방역을 하고 있다. 최근 수도권 지역의 사회적 거리두기 2단계 격상으로 실내 50인, 실외 100인의 모임이나 행사가 전면 금지되며 결혼식, 동창회, 동호회, 야유회, 회갑연, 장례식, 돌잔치 등 사적 모임도 포함된다. 2020.8.19/뉴스1 © News1 조태형 기자방역당국이 수도권 지역의 신종 코로나바이러스 감염증(코로나19) 확산 상황과 관련해 ""이번주가 대규모 확산을 저지하는데 가장 중요한 분수령""이라고 밝혔다. 방역당국은 사회적 거리두기 2단계 격상 조치를 오는 30일까지 실시하되 추후 상황을 보며 조정하겠다는 입장이다. 김강립 중앙재난안전대책본부 1총괄조정관(보건복지부 차관)은 19일 정례브리핑에서 ""사랑제일교회 관련 검사중이거나 검사 대기가 다수 남아있고, 이외의 다른 지역에서 집단감염이 연쇄적으로 발생하고 있어 금주까지는 환자 증가 추이가 계속될 것""이라며 이같이 말했다. 19일 서울 양천구 목동 종로학원에 휴원안내가 붙어 있다. 정부는 신종 코로나바이러스 감염증(코로나19) 확산으로 사회적 거리두기를 2단계로 격상한 이후 전날(18일) 수도권 방역조치 강화 추진계획을 통해 대형학원, PC방, 노래연습장 등 고위험시설 12종을 대상으로 오는 30일까지 집합을 금지했다. 2020.8.19/뉴스1 © News1 유승관 기자19일 서울 양천구 목동 종로학원에 휴원안내가 붙어 있다. 정부는 신종 코로나바이러스 감염증(코로나19) 확산으로 사회적 거리두기를 2단계로 격상한 이후 전날(18일) 수도권 방역조치 강화 추진계획을 통해 대형학원, PC방, 노래연습장 등 고위험시설 12종을 대상으로 오는 30일까지 집합을 금지했다. 2020.8.19/뉴스1 © News1 유승관 기자수도권 대형 유명 뷔페 매장이 신종 코로나바이러스 감염증(코로나19) 확산으로 영업을 잠정 중단한 19일 서울의 한 한식 뷔페에 운영 중단 안내문이 붙어 있다. 정부가 코로나19 확산 방지를 위해 서울·경기·인천 등 수도권 지역을 대상으로 '뷔페 금지' 조처를 내렸기 때문이다. 업계에 따르면 CJ푸드빌 '빕스'와 '계절밥상' 서울, 경기, 인천 총 36개 매장은 일시적으로 운영을 중단한다. 빕스는 전국 41개 매장 중 24개, 계절밥상은 13개 매장 중 12개나 해당한다. 2020.8.19/뉴스1 © News1 허경 기자수도권 대형 유명 뷔페 매장이 신종 코로나바이러스 감염증(코로나19) 확산으로 영업을 잠정 중단한 19일 서울의 한 한식 뷔페에 운영 중단 안내문이 붙어 있다. 정부가 코로나19 확산 방지를 위해 서울·경기·인천 등 수도권 지역을 대상으로 '뷔페 금지' 조처를 내렸기 때문이다. 업계에 따르면 CJ푸드빌 '빕스'와 '계절밥상' 서울, 경기, 인천 총 36개 매장은 일시적으로 운영을 중단한다. 빕스는 전국 41개 매장 중 24개, 계절밥상은 13개 매장 중 12개나 해당한다. 2020.8.19/뉴스1 © News1 허경 기자19일 서울 중구 남대문시장 거리 한 음식점이 점심시간에도 불구하고 손님이 없어 한산한 모습을 보이고 있다. 역대 가장 긴 장마에 신종 코로나바이러스 감염증(코로나19) 재확산으로 상인들은 혹독한 상황을 맞고 있다. 2020.8.19/뉴스1 © News1 송원영 기자19일 서울 중구 남대문시장 거리 한 음식점이 점심시간에도 불구하고 손님이 없어 한산한 모습을 보이고 있다. 역대 가장 긴 장마에 신종 코로나바이러스 감염증(코로나19) 재확산으로 상인들은 혹독한 상황을 맞고 있다. 2020.8.19/뉴스1 © News1 송원영 기자19일 오전 서울 중랑구 금란교회 예배당에 마련된 신종 코로나바이러스 감염증(코로나19) 선별진료소에서 중랑구 보건소 의료진이 피검사자의 검체를 채취하고 있다. 2020.8.19/뉴스1 © News1 구윤성 기자19일 오전 서울 중랑구 금란교회 예배당에 마련된 신종 코로나바이러스 감염증(코로나19) 선별진료소에서 중랑구 보건소 의료진이 진료준비를 하고 있다. 2020.8.19/뉴스1 © News1 구윤성 기자실내 50인 이상 실외 100인 이상 대면 모임 및 행사는 원칙적으로 금지되고, 결혼식·장례식·야유회·콘서트·박람회·학술대회 등이 포함된다. 고위험시설인 △클럽·룸살롱 등 유흥주점 △콜라텍 △단란주점 △감성주점 △헌팅포차 △노래연습장 △실내 스탠딩 공연장 △실내집단운동(격렬한 GX류) △뷔페 △PC방 △방문판매 등 직접판매홍보관 △대형학원(300인 이상) 등에 대해서도 집합금지 조치가 시행된다. 다만 기존 고위험시설인 유통물류센터는 필수산업시설에 해당하는 만큼 이번 집합금지 조치에서 제외됐다. 수도권 지역 교회에서는 모두 비대면 예배만을 허용하고, 교회 주관 소모임 및 행사, 단체식사 등이 금지된다. 해당 집합금지 조치 등을 위반할 경우 감염병예방법에 따라 300만원 이하의 벌금이 부과되며, 확진자 발생 시 입원·치료비 및 방역비에 대한 구상권이 청구될 수 있다.신종 코로나바이러스 감염증(코로나19) 확산 예방을 위해 사회적 거리두기 2단계가 시행된 19일 오후 서울 송파구 일대에서 구청 관계자가 한 코인 노래연습장에 코로나19 확산 억제를 위한 집합금지명령문을 붙이고 있다. 서울시는 정부의 사회적 거리두기 2단계 후속 강화조치에 따라 19일 0시부터 별도 해제시까지 유흥시설과 노래연습장 등 기존 12종의 고위험시설에 대한 영업중단 조치를 시행한다. 고위험시설로 분류된 12종은 클럽·룸살롱 등 유흥주점과 콜라텍, 단란주점, 감성주점, 헌팅포차, 노래연습장, 실내 스탠딩공연장, 실내집단운동(격렬한 GX류), 방문판매 등 직접판매홍보관, 대형학원(300인 이상), 뷔페, PC방 등이다. 2020.8.19/뉴스1 © News1 이승배 기자신종 코로나바이러스 감염증(코로나19) 확산 예방을 위해 사회적 거리두기 2단계가 시행된 19일 오후 서울 송파구 일대에서 구청 관계자가 한 pc방에 코로나19 확산 억제를 위한 집합금지명령문을 붙이고 있다. 서울시는 정부의 사회적 거리두기 2단계 후속 강화조치에 따라 19일 0시부터 별도 해제시까지 유흥시설과 노래연습장 등 기존 12종의 고위험시설에 대한 영업중단 조치를 시행한다. 고위험시설로 분류된 12종은 클럽·룸살롱 등 유흥주점과 콜라텍, 단란주점, 감성주점, 헌팅포차, 노래연습장, 실내 스탠딩공연장, 실내집단운동(격렬한 GX류), 방문판매 등 직접판매홍보관, 대형학원(300인 이상), 뷔페, PC방 등이다. 2020.8.19/뉴스1 © News1 이승배 기자19일 서울 양천구 목동의 한 학원에서 관계자들이 방역 작업을 하고 있다. 정부는 신종 코로나바이러스 감염증(코로나19) 확산으로 사회적 거리두기를 2단계로 격상한 이후 전날(18일) 수도권 방역조치 강화 추진계획을 통해 대형학원, PC방, 노래연습장 등 고위험시설 12종을 대상으로 오는 30일까지 집합을 금지했다. 이를 어길 시 감염병 예방 및 관리에 관한 법률에 따라 300만원 이하의 벌금과 확진자 발생시 그에 따른 치료비 및 방역비 등 구상권이 청구된다. 2020.8.19/뉴스1 © News1 유승관 기자19일 오후 경기도 수원시내 한 예식장에서 직원들이 신종 코로나바이러스 감염증(코로나19) 예방을 위해 방역을 하고 있다. 최근 수도권 지역의 사회적 거리두기 2단계 격상으로 실내 50인, 실외 100인의 모임이나 행사가 전면 금지되며 결혼식, 동창회, 동호회, 야유회, 회갑연, 장례식, 돌잔치 등 사적 모임도 포함된다. 2020.8.19/뉴스1 © News1 조태형 기자신종 코로나바이러스 감염증(코로나19) 확산 예방을 위해 사회적 거리두기 2단계가 시행된 19일 오후 서울 마포구 홍대거리에서 시민들이 길을 거닐고 있다. 서울시는 정부의 사회적 거리두기 2단계 후속 강화조치에 따라 19일 0시부터 별도 해제시까지 유흥시설과 노래연습장 등 기존 12종의 고위험시설에 대한 영업중단 조치를 시행한다. 고위험시설로 분류된 12종은 클럽·룸살롱 등 유흥주점과 콜라텍, 단란주점, 감성주점, 헌팅포차, 노래연습장, 실내 스탠딩공연장, 실내집단운동(격렬한 GX류), 방문판매 등 직접판매홍보관, 대형학원(300인 이상), 뷔페, PC방 등이다. 2020.8.19/뉴스1 © News1 이재명 기자신종 코로나바이러스 감염증(코로나19) 확산 예방을 위해 사회적 거리두기 2단계가 시행된 19일 오후 서울 마포구 홍대거리에서 시민들이 길을 거닐고 있다. 서울시는 정부의 사회적 거리두기 2단계 후속 강화조치에 따라 19일 0시부터 별도 해제시까지 유흥시설과 노래연습장 등 기존 12종의 고위험시설에 대한 영업중단 조치를 시행한다. 고위험시설로 분류된 12종은 클럽·룸살롱 등 유흥주점과 콜라텍, 단란주점, 감성주점, 헌팅포차, 노래연습장, 실내 스탠딩공연장, 실내집단운동(격렬한 GX류), 방문판매 등 직접판매홍보관, 대형학원(300인 이상), 뷔페, PC방 등이다. 2020.8.19/뉴스1 © News1 이재명 기자김 1총괄조정관은 ""결혼식을 앞두고 있는 예비 부부들, PC방과 노래방 등을 운영하는 사업주분 등의 일상과 상업에 영향을 미친다는 점에서 정부로서도 곤혹스럽고 어려운 결정이었다""며 ""하지만 지금 방역망의 통제력을 회복하지 못한다면 전국적으로 대규모 유행으로 확산될 위험이 높다는 점에서 신속하고 과감한 조치를 취할 수밖에 없었다""고 양해를 부탁했다. seiyu@news1.kr"
43,news1,울산시장배 'e스포츠대회' 성료…코로나19 방역수칙 준수  (울산=뉴스1) 김기열 기자|2020-07-20 12:01 송고기사보기네티즌의견인쇄확대축소,"제2회 울산광역시장배 e스포츠대회 리그 오브 레전드에서 우승한 'DRX challenge'팀.(울산시 제공) ©뉴스1코로나19 재확산속에 울산에서 열린 e스포츠대회가 무사히 종료됐다.20일 울산시에 따르면 (재)울산정보산업진흥원이 주관하는 '2020 제2회 울산광역시장배 e스포츠대회'가 18~19일 이틀간 열렸다.대회는 코로나19 확산 예방을 위해 전자출입명부, 거리두기 등 방역수칙을 철저히 준수해 PC방에서 차분하고 질서 있게 진행됐으며, 안전사고나 발열이상 증세를 보였던 선수도 없었다. 대통령배 전국 아마추어 e스포츠대회의 울산지역 대표선발을 겸한 이번 대회는 리그 오브 레전드, 배틀그라운드, 오디션, 카드라이더, 모바일 게임 첫 정식 종목인 브롤스타즈까지 총 5개 종목에 182명의 선수가 선발돼 토너먼트 형식으로 진행됐다.단체전 리그 오브 레전드에서 'DRX challenge'팀(김연웅,목정규,송현민,윤세준,장재영), 배틀그라운드는 'XQ3'팀(김민재,이승철), 오디션은 '성공을 기원하며 발전을 기원하며'팀(김상구,김태현,박창희), 첫 정식 모바일게임 종목 브롤스타즈에서는 '글로리아'팀(곽재우,도지송,신은규)이 각각 우승을 차지했다.개인전 카드라이더에서는 이민형 선수가 1위를 차지했으며, 종목별 1~2위에게는 각각 울산광역시장상과 (재)울산정보산업진흥원장상의 상장과 상금이 수여됐다.리그 오브 레전드, 오디션, 브롤스타즈 1위팀과, 배틀그라운드, 카트라이더 1~2위 팀은 오는 11월 문화체육관광부가 주최하고 한국e스포츠협회에서 개최하는 '제12회 대통령배 전국 아마추어 e스포츠대회'의 울산지역 대표로 참가하게 된다.시 관계자는 ""e스포츠와 게임분야에 건전한 환경 조성과 게임콘텐츠 산업 육성을 위하여 정책적 지원을 아끼지 않겠다""며 ""울산e스포츠 협회와 함께 e스포츠 시설 확충, 지역의 e스포츠 인재발굴 및 육성과 e스포츠문화 저변확대를 위해 노력해 나가겠다""고 말했다. kky060@news1.kr"
44,news1,"""추석연휴 코로나19 확산 막자""…진안군, 특별방역 추진 (진안=뉴스1) 김동규 기자|2020-09-28 15:37 송고기사보기네티즌의견인쇄확대축소","28일 전북 진안군이 추석연휴 코로나19 방역대책 회의를 갖고 있다.(진안군제공)2020.9.28/뉴스1전북 진안군은 28일 군청 상황실에서 전춘성 군수 주재로 실·과·소·읍·면장이 참석한 가운데 추석연휴 신종 코로나바이러스 감염증(코로나19) 특별방역 대책회의를 가졌다고 밝혔다.전춘성 군수는 “이번 추석 연휴가 코로나19의 지역 재확산 여부를 판가름할 중요한 시기임을 감안해야 한다”며 “추석 전 주요시설 방역을 포함한 종합 방역대책을 세우고 연휴기간 군민이동 최소화, 사회적 거리두기, 개인방역수칙 준수 등의 ‘대군민 홍보 방안’을 마련하라”고 지시했다.이에 따라 진안군은 30일부터 내달 4일까지 비상근무반을 편성해 종합상황실을 24시간 운영하고 경찰서, 소방서, 병·의원 등 유관기관과 협력체계를 구축하기로 했다.진안군은 코로나19 예방을 위해 선별진료소를 운영하고 터미널·전통시장 등 유동인구가 많은 장소에 특별 방역주간을 운영할 계획이다. 또 중·고위험 다중이용시설 합동점검반을 편성해 사회적 거리두기, 방역수칙 준수 여부 등을 점검하고, 주요 관광지에 방역 관리 요원을 배치해 생활 방역수칙 준수를 지도할 방침이다.전춘성 진안군수는“군민의 불편함이 없도록 방역과 안전을 최우선으로 추진할 예정이다”며 “내 가족과 이웃의 안전을 위해 고향방문, 지역 간 이동 자제, 사회적 거리두기, 개인 방역수칙 준수에 적극 동참해주시기 바란다”고 말했다.kdg2066@news1.kr"
45,news1,"檢, 정부 코로나19 방역활동 방해 신천지 이만희 구속기소 (수원=뉴스1) 유재규 기자|2020-08-14 20:20 송고기사보기네티즌의견인쇄확대축소","신종 코로나바이러스 감염증(코로나19)의 정부 방역활동을 방해한 혐의로 고발된 신천지예수교 증거장막성전(신천지) 이만희 총회장(89)이 재판에 넘겨졌다.© News1 조태형 기자신종 코로나바이러스 감염증(코로나19)의 정부 방역활동을 방해한 혐의로 고발된 신천지예수교 증거장막성전(신천지) 이만희 총회장(89)이 재판에 넘겨졌다.14일 검찰에 따르면 수원지검 형사6부(부장검사 박승대)는 감염병예방법 위반 등 혐의로 이씨를 구속기소했다.이와 함께 같은 혐의로 신천지 총무 등 11명도 기소했다.이씨는 신천지 대구교회를 중심으로 코로나19가 확산하던 때인 지난 2월 방역당국에 교인명단과 시설현황을 누락하거나 허위로 제출하는 등 방역 업무를 방해한 혐의를 받는다.또 신천지 연수원인 가평 평화의 궁전 신축 등과 관련해 56억원을 빼돌리고, 공공시설에 무단으로 진입해 만국회의 행사를 수차례 강행한 혐의도 받는다.이씨를 포함한 신천지는 코로나19가 신천지 신도에 의해 확산되자 지방자치단체와 전피연 등 단체로부터 여러 차례 고발당했다.이 가운데 전국신천지피해자연대는 코로나19 관련, 정부의 방역활동을 방해해 온 국가를 위기로 빠뜨렸다는 취지로 지난 2월 이씨를 고발하고 대검찰청은 이 총회장 고발 사건을 수원지검에 배당했다. 수원지검은 과천 총회 본부와 가평 평화의 궁전, 부산과 광주, 대전의 신천지 관련 시설 여러 곳을 압수수색하고 여러 증거물을 확보, 이씨를 상대로 2차례 조사한 끝에 지난 7월28일 구속영장을 청구했다.또 같은 날에는 검찰이 방역 방해 등 혐의로 신천지 간부 A씨 등 3명을 구속기소하고 4명을 불구속 기소했다. 지난 1일 수원지법은 감염병예방법 위반, 위계에 의한 공무집행방해, 특경법 위반(횡령), 업무방해 등 혐의를 받고 있는 이씨를 '범죄혐의 일부 소명' '수사 과정의 증거인멸 정황' '추가 증거인멸 염려' 등 이유로 구속영장을 발부, 이씨를 구속했다. koo@news1.kr"
46,news1,"휴가철 방역 느슨했나…충북 8월 들어 코로나19 확진자 폭증 소규모 집단감염에 이달만 20명 확진…도내 전체 '21.5% 차지'청주서 우즈베키스탄인 6명, 옥천서 초등생 가족·친척 4명 감염(청주=뉴스1) 엄기찬 기자|2020-08-20 10:20 송고 | 2020-08-20 10:29 최종수정기사보기네티즌의견인쇄확대축소","© News1 김일환 디자이너충북의 신종 코로나바이러스 감염증(코로나19) 확진자가 소규모 집단감염을 중심으로 8월 들어 폭증하고 있다.20일 충북도 재난안전대책본부에 따르면 도내에서는 지난 2월20일 첫 확진자 발생 이후 현재까지 모두 93명이 코로나19 확진 판정을 받았다.충북은 지난 3월 11명의 확진자가 발생한 괴산군 장연면 오가리 마을 집단감염 말고는 산발적인 감염으로 비교적 안정적인 코로나19 방역을 이어오고 있었다.하지만 8월 들어 소규모 집단감염이 속출하면서 그 양상이 급변했다. 이달 들어 발생한 확진자만 20명이다. 도내 전체 확진자의 21.5%에 달한다. 8월에 발생한 확진자 20명 가운데 해외 입국자 감염 사례인 4명을 제외하고는 모두 지역 내 감염이다. 지역사회 감염 확산이 현실로 다가온 셈이다.지난 3~4일에는 청주의 한 빌라에서 함께 생활하던 우즈베키스탄 국적의 20~30대 외국인 6명이 한꺼번에 코로나19 확진 판정을 받았다.지난 19일에는 옥천의 한 초등학교에 다니는 10대 남학생이 감염된 데 이어 이튿날에는 부모와 고모까지 확진 판정을 받았다.최근에는 '수도권발 n차 감염' 사례도 잇따르고 있는데, 지난 16일 충주에서는 확진자 아들과 접촉한 50대 부부가 양성 판정을 받았다. 부부의 아들은 여의도순복음교회 신도다.지난 18일에는 서울 광화문 광복절 집회에 참석했던 50대 여성이 확진 판정을 받았다. 이 집회에만 충북에서 500명 이상이 참석한 것으로 확인돼 추가 감염까지 우려되는 상황이다.공교롭게도 본격적인 여름 휴가철과 맞물려 충북의 코로나19 확진자가 급증하면서 이동이 많은 시기 방역당국은 물론 개인까지 방역에 소홀했다는 지적이 나온다.충북도 관계자는 ""개인의 허술하고 느슨한 방역 의식은 방역을 감당하기 어려운 상황으로 만들 수 있다""며 방역수칙 준수를 당부했다. sedam_0815@news1.kr"
47,news1,"전주시 보건소, 대면업무 중단…코로나19 방역 ‘총력’ 선별진료소 운영에 인력 보강…역학조사반 10개 팀 편성(전주=뉴스1) 임충식 기자|2020-08-24 16:24 송고기사보기네티즌의견인쇄확대축소","전북지역 신종 코로나바이러스 감염증(코로나19) 확진자가 연일 발생하고 있는 20일 전북 전주시 화산체육관에 마련된 코로나19 선별진료소에서 의료진들이 검사자 검체를 채취하고 있다. 2020.8.20 /뉴스1 © News1 유경석 기자전북 전주시가 코로나19 대응에 행정력을 집중하고 있다. 전주시보건소(소장 김신선)는 24일 진료와 예방접종 등 대면사업을 일시 중단한다고 밝혔다. 대신 선별진료소에 인원을 보강하는 등 코로나19 대응 업무에 모든 행정력을 집중할 계획이다.보건소는 당장 이날부터 전주시 공중보건의와 통합돌봄창구 간호사 등 의료인력을 덕진 선별진료소에 추가 배치했다. 전북도 공중보건의와 중앙사고수습본부의 임상병리사도 추가 확보했다.또 화산체육관에 위치한 임시선별진료소에도 전주시의사회 소속 의사 6명이 추가 투입됐다.보건소는 이와 함께 전 직원을 동원, 10개의 역학조사반을 편성하고 확진자 동선 및 접촉자 파악에 총력을 기울일 예정이다.전주시는 보건소 직원들뿐만 아니라 시 직원들을 △CCTV 자료 수집 △전화상담 △확진자 방문지 방역작업 △자가격리자 관리 등의 업무에 투입, 코로나19 확산 방지 업무에 만전을 기할 계획이다.전주시보건소 관계자는 “선별진료 운영과역학조사에 총력을 기울이기 위해보건소 업무를 잠정 중단했다”며 “코로나19 확산을 막기위해 최선을 다하겠다”고 말했다.한편, 전주지역 확진자는 현재까지 총 30명이며, 이 중광복절 연휴 이후 확진자 수만 19명에 달한다. 보건소는 그간 코로나상황실 운영을 통해1만3059명의 코로나19 진단검사를 실시했다. 유선상담 건수는 5만5898건에 달한다.94chung@news1.kr"
48,news1,"대전시, 코로나 방역·안전 위주 추석명절 종합대책 수립 8개 대책반 가동 395명 비상근무대전추모공원 1일 160가족 제한(대전=뉴스1) 김경훈 기자|2020-09-21 09:38 송고기사보기네티즌의견인쇄확대축소","17일 대전 대덕구 덕암동에 추석명절 고향 방문 자제 내용이 적힌 현수막이 붙어 있다. 2020.9.17/뉴스1 © News1 김기태 기자대전시가 21일 시민들이 안심하고 편안하게 추석을 보낼 수 있도록 코로나19 방역과 안전을 위주로 한추석명절 종합대책을 발표했다.시는 21일부터 10월 4일까지 2주간을 추석명절 종합대책 중점 추진 기간으로 정하고 서민생활 안정, 생활불편해소, 환경정비, 시민안전 등 8개 분야 67개 시책에 행정력을 집중하기로 했다.오는 30일부터 추석 연휴기간 중에는 종합상황실을 중심으로 코로나19 대응, 의료·식중독, 가축방역, 교통, 청소·환경, 재난·재해, 소방, 상수도 등 8개 대책반을 가동해 1일 79명, 전체 395명이 비상근무에 들어간다.시는 수도권 발 코로나19의 전국적 확산이 지속되는 상황에서 추석 맞춤형 생활방역 수칙 확산과 실천이 절실한 상황으로 판단하고, 5개 자치구 보건소 선별진료소(오전), 감염병 전담병원, 생활치료센터를 정상 가동한다.연휴기간 자가격리자의 이탈 방지를 위해 위치확인시스템(GPS) 상황판을 통한 실시간 모니터링과 불시 현장 점검반을 투입하기로 했다.추석 명절에 발생될 코로나19 대응을 위해 4개 반 8명으로 구성된 별도의 코로나19 상황실을 운영하고, 역학조사반도 6개 반(20명)을 꾸려 24시간 비상근무를 실시한다.코로나19 감염 확산을 방지하기 위해 방문 성묘를 자제하도록 하는 복지부 방침에 따라 국립대전현충원의 위패봉안실, 제례실, 참배객 대기실, 휴게실, 식당 등은 운영하지 않는다. 다만, 안장된 국가유공자의 기일, 삼우제, 49제 등 특별한 경우에 한해서만 사전예약제로 참배할 수 있다.서구 괴곡동 대전추모공원은 사이버 참배가 불가능해 1일 160가족으로 제한하는 1일 방문총량제를 시행한다.연휴기간 중 발생한 생활쓰레기 수거 대책도 내놓았다. 9월 30일과 10월 3일은 정상 수거하고, 10월 1일은 조기에 수거하며, 10월 2일은 수거하지 않는다. 안전분야로는 전통시장, 대규모 점포, 공연장 등 재난취약시설에 대한 안전 점검을 실시하고, 9월 29일부터 10월 5일까지 전 소방관서에서 화재예방 특별 경계근무에 들어간다.어려운 이웃의 따뜻한 명절 지원을 위해 기초생활수급자 1만 6119세대, 사회복지시설 등 228곳 8724명에게 위문품을 전달하고, 쪽방 생활인, 노숙인 보호를 위해 5곳에서 무료 급식을 한다. 공동 차례상, 어울림 한마당 행사는 열지 않는다.허태정 시장은""코로나19 확산 방지를 위해 추석 연휴기간 가급적 고향·친지 방문을 자제해 줄 것""을당부했다.khoon3654@news1.kr"
