,Press,Title,Text
29,news1,"오늘 동네의원 4곳 중 1곳 휴진…갈등 봉합 못하면 코로나 방역 구멍  13일 오후 2시기준 휴진율 24.7% 집계…6년전보다 높을 것으로 예상 병원 진료로 의료 공백 없지만, 코로나19 극복엔 의사 협조가 필수(서울=뉴스1) 음상준 기자, 이영성 기자|2020-08-14 06:30 송고 | 2020-08-14 09:01 최종수정기사보기네티즌의견인쇄확대축소","전국 의사들의 집단휴진 총파업을 하루 앞둔 13일 서울의 한 대형병원 응급실로 환자들이 이송되고 있다. 대한의사협회는 정부의 의대정원 확대와 공공의대 설립 등에 반발하며 14일 총파업을 예고했다./뉴스1 © News1 황기선 기자14일 전국 동네의원 4곳 중 1곳이 의과대학 정원을 확대하는 정부 의료정책에 반대하기 위해 하루 일정으로 집단휴진에 들어간다. 다만 병원급 이상 의료기관은 이번 집단휴진에 참여하지 않는 만큼, 의료 공백은 크지 않을 것으로 예상된다. 하지만 수도권을 중심으로 신종 코로나바이러스 감염증(코로나19)이 확산세를 보이는 일촉즉발 상황에서 동네의원이 앞다퉈 휴진하는 것을 두고 우려의 목소리가 나오는 것도 사실이다.◇2014년 20.9%→2020년 최소 24.7%…휴진 이유, 원격의료→의대정원 확대이번 동네의원 집단휴진은 지난 2014년 이후 6년 만으로, 의료기관 참여율은 다소 높아질 것으로 예상된다. 지난 2014년 휴진율은 20.9%(보건복지부 기준)였다. 반면 대한의사협회가 발표한 휴진율은 49.1%로 양측 간의 간극이 컸다. 복지부 통계를 기준으로 삼아도 전국 동네의원 5곳 중 1곳이 문을 닫았다.반면 올해 집단휴진 참여율은 2014년보다 높을 것으로 보인다. 복지부가 13일 오후 2시 기준으로 집계한 휴진율은 24.7%다. 이는 6년 전보다 3.8% 포인트 높은 수치다. 하지만 이날 휴진율은 25%를 넘어설 것으로 예상되고 있다. 복지부 관계자는 ""14일 집단휴진 당일에는 여름 휴가철인 만큼 실제 참여율은 더 높아질 것""이라며 ""다만 병원급 의료기관이 집단휴진을 신고한 사례는 아직까지 없다""고 설명했다. 2014년 집단휴진 당시 의협은 정부가 원격의료를 포함한 의료 산업화를 무리하게 밀어붙여 동네의원 진료 환경이 더 나빠지고 의료전달 체계에도 악영향을 미친다고 비판했다.의료전달체계는 환자가 의료기관을 방문할 때 중증도에 따라 1차 동네의원, 2차 병원, 3차 대형병원으로 단계를 밟아가는 의료 시스템이다. 단계가 높은 병원에 가면 진료비가 훨씬 비싸져 감기 등 경증질환 환자들이 대학병원으로 쏠리는 현상을 억제한다. 이번 집단휴진은 오는 2022년부터 매년 400명씩(10년 한시적) 총 4000명의 의사를 추가로 양성하는 보건복지부 정책에 반대하기 위해서다. 의사가 부족하기보다 의사인력이 수도권으로만 몰리도록 정부가 잘못된 정책을 펼쳤다는 게 의협 주장이다. 무리하게 의사인력을 확대하는 것보다 기존 인력을 비수도권 등 취약지역에서 근무할 수 있는 환경을 구축하는 게 우선이라는 입장이다. 의대 정원을 확대하는 것은 지난 2014년 집단휴진 명분인 원격의료 도입보다 훨씬 민감한 문제다. 향후 10년간 4000명의 의사인력이 쏟아질 경우 일선 의료기관 수익이 감소하고 경쟁은 더 치열해질 수밖에 없다. 복지부는 우리나라 의사인력이 턱없이 부족한 만큼 의대 정원 확대는 불가피하다는 입장을 고수하고 있다. 복지부 관계자는 ""지난해 우리나라 인구 1000명당 활동의사는 2.4명으로 OECD 평균 3.4명(2017년 기준)의 71% 수준에 머물렀다""며 ""의대 정원과 공공의대를 통해 해당 수치를 OECD (평균)수준까지 높이겠다""고 강조했다.대한의사협회가 집단 휴진에 들어간 지난 2014년 3월 10일 당시 서울 동작구의 한 내과의원을 찾은 한 시민이 의원 측이 내건 휴진 안내와 보건소가 부착한 업무개시 명령이 나란히 붙은 출입문을 흔들어 보고 있다./뉴스1◇휴진에 따른 '진료 차질' 없을 듯…휴진 이후 코로나 협조가 문제지난 7일 전공의 집단휴진에 이어 이날 동네의원 휴진 역시 일선 의료현장에 미치는 영향을 크지 않을 전망이다. 이번 휴진에는 동네의원뿐만 아니라 전공의, 봉직의사들도 함께 참여한다. 하지만 진료를 중단하기 어려운 병원급 의료기관 특성상 전공의와 봉직의 참여율은 낮을 것으로 예상된다. 지난 2014년 집단휴진 때도 병원급 이상 의료기관은 정상적으로 진료 업무를 보면서 동네의원 중심으로 집단휴진이 이뤄졌다. 복지부는 14일 동네의원 집단휴진을 피할 수 없다고 보고 지난 12일 김강립 차관이 대한병원협회와 대한중소병원협회, 대한간호협회를 차례로 만나 대책을 논의했다. 김강립 차관은 이날 병원협회, 중소병원협회 임원진에게 ""환자들에게 위험이 생기지 않도록 집단휴진에 대비해 휴진 당일 진료 연장과 응급의료체계 유지 등이 이뤄지도록 협조해 달라""고 거듭 요청했다.문제는 이번 집단휴진 이후 복지부와 의사단체 갈등이 더 깊어지면 코로나19 방역에 구멍이 생길 수 있다는 점이다. 현재 코로나19는 수도권을 중심으로 소규모 집단감염이 연이어 발생하고 있다. 지난 12~13일 이틀 연속으로 신규 확진자가 50명대로 쏟아졌다. 중앙방역대책본부는 13일 브리핑에서 ""수도권 상황은 지난 5월 초 이태원 클럽 때보다 훨씬 위험한 상황""이라고 경고했다. 이런 상황을 고려해 복지부는 의사단체를 상대로 강경 발언을 삼가는 모습을 보였지만, 당분간 냉각기가 이어질 전망이다. 현재 코로나19 확산세는 예사롭지 않다. 오는 9~10월 지난 2~3월 대구와 같은 2차 감염파도가 온다면 의사단체 협조가 꼭 필요하다. 집단휴진 이후가 걱정되는 이유다.sj@news1.kr"
30,news1,"'최대비상체제' 북한 코로나19 방역, 6개월 전과 다른 점은 최룡해·박봉주 등 고위급 간부 잇달아 방역 현장 점검방역 인식 바뀐 듯…이동 부담 덜고 손소독·발열 확인 집중(서울=뉴스1) 양은하 기자|2020-08-05 07:00 송고기사보기네티즌의견인쇄확대축소","(평양 노동신문=뉴스1) = 최룡해 북한 최고인민회의 상임위원회 위원장 겸 국무위원회 제1부위원장이 개성시를 찾아 비상방역사업을 점검하는 모습. [국내에서만 사용가능. 재배포 금지. DB 금지. For Use Only in the Republic of Korea. Redistribution Prohibited] rodongphoto@news1.kr북한이 신종 코로나바이러스 감염증(코로나19) 방역 관련 국가비상방역체계를 '최대비상체제'로 격상하면서 방역 초기였던 지난 2월과 비교해 대응 방법에도 변화가 감지된다.가장 눈에 띄게 달라진 점은 고위급 간부들의 잇단 방역 현장 실태 점검이다.앞서 최룡해 북한 최고인민회의 상임위원장 겸 국무위원회 제1부위원장이 지난달 30일(보도일 기준) 개성시를 찾은 데 이어 박봉주 당 중앙위 부위원장이 4일 남포항을 찾아 방역점검에 나섰다.김재룡 내각총리도 지난 2월12일과 5월24일 남포시를 찾아 방역 사업을 점검했었지만 이번에는 북한의 공식 권력 서열 2위와 3위가 연이어 현지에 파견됐다는 점에서 무게감이 조금 다르다.이는 북한이 최근 코로나19 대응 수위를 한층 높인 데 따른 것으로 보인다. 김정은 국무위원장은 지난달 25일 정치국 비상확대회의에서 '최대비상체제'를 선포하고 특급경보를 발령했는데 고위급이 직접 방역 현장을 찾으면서 1호의 지시가 제대로 이행되고 있음을 보여주려는 것이다. 방역 장기화에 강도까지 높아지면서 성난 민심을 달래려는 의도도 있어 보인다. 특히 최룡해 상임위원장이 찾은 개성시는 비상사태가 선포되고 '완전봉쇄' 조치가 내려지는 등 강력한 통제가 이뤄지고 있다.김 위원장을 제외하면 북한에서 사실상 가장 높은 인물인 최룡해 상임위원장을 이곳에 보냄으로써당국이 어려운 상황의 주민을 챙기고 있다는 점을 강조하는 모습이다.대외적으로는 탈북민의 월북으로 촉발된 이번 상황을 그만큼 심각하게 보고 있다는 것을 부각하려는 속셈일 수 있다. 추후 코로나19 사태가 확대될 경우 이에 대한 책임을 우리 정부에 전가하기 위한 포석이라는 것이다. 다만 북한은 현재까지 '감염자 0명' 주장을 고수하고 있다.실제 북한 내 코로나19 상황이 이전과 비교해 더 심각해졌는지는 확인할 수 없지만 이번 고위급 파견에는 방역에 대한 북한의 인식 변화도 영향을 미쳤을 것으로 보인다.코로나19 확산 초기에는 감염 경로와 방역 방법 등에 대한 불확실성이 컸던 만큼 이동에 대한 불안과 두려움도 컸을 것이다. 당시에는 국경 근처 주민과 외국인을 격리 조치했고 마스크 보급도 완전히 이뤄지지 않았다. 6개월간의 방역과 각국의 코로나19 대처 방법 등을 관찰하면서 이동에 대한 부담이 조금씩 완화됐을 수 있다. 노동당 기관지 노동신문에 보도된 코로나19 방역 관련 사진도 조금 달라졌다. 이전에는 공항이나 기차역, 열차, 버스 내부를 소독하는 사진이나 방역 대책을 논의하는 의료진 사진이 많았다면 최근에는 주민들이 곳곳에 놓여있는 소독수로 손을 씻거나 건물 입구나 도로에서 온도계로 체온을 측정하는 사진이 눈에 띈다.이는 내부 생산과 외부에서 받은 방역 물자가 어느 정도 확보되면서 더 철저한 방역이 가능해진 것으로 해석된다.(평양 노동신문=뉴스1) = 북한 노동당 기관지 노동신문은 3일 신종 코로나바이러스 감염증(코로나19) 최대비상체제에 돌입한 천리마구역당위원회를 조명했다. [국내에서만 사용가능. 재배포 금지. DB 금지. For Use Only in the Republic of Korea. Redistribution Prohibited] rodongphoto@news1.kr yeh25@news1.kr"
31,news1,"주호영 ""의사파업, 정부가 물러서라…코로나 방역 전념하게 해야"" ""정부가 협의없이 정책 제기…K 방역 주역 괴롭혀서는 안 된다""""비대면 진료 강행하면 K 방역 구멍…정부가 대국적으로 갈등 정리를""(서울=뉴스1) 유경선 기자|2020-08-27 18:14 송고기사보기네티즌의견인쇄확대축소","주호영 미래통합당 원내대표가 26일 오전 서울 여의도 국회에서 열린 비상대책위원장·중진의원 회의에서 발언하고 있다. 2020.8.26/뉴스1 © News1 성동훈 기자주호영 미래통합당 원내대표는 27일 전국의사총파업과 관련해 신종 코로나바이러스 감염증(코로나19) 상황에서 정부가 일방적 정책으로 불필요한 갈등을 유발했다며 결자해지에 나서야 한다고 촉구했다.주 원내대표는 이날 페이스북에 올린 '의사파업, 정부가 물러서야 할 다섯 가지 이유'라는 제목의 글을 올리고 ""코로나19 확진자가 오늘 440명 이상 크게 늘어난 와중에 정부는 코로나19 방역에 전념해야 할 의사들과 전면전을 벌이고 있다""며 이렇게 밝혔다.주 원내대표는 ""의대 정원 10년간 4000명 증원, 공공의대 신설, 한약 첩약 의료보험 적용, 비대면 진료 허용은 정부가 갑작스럽게 불쑥 내놓은 정책""이라며 ""의료계와 충분한 협의없이 제기됐다""고 비판했다.전문가와 시민사회단체가 참여하는 추천위원회가 공공의대생을 선발한다는 내용을 보건복지부가 발표한 데 데해서는 ""시민단체 활동가 자녀의 의대 진학을 돕기 위한 현대판 음서제냐""라며 ""충분히 검토되지 않은 설익은 정책""이라고 꼬집었다.이어 코로나19 재확산 국면에서 의료인력을 현장으로 빨리 돌려보내야 한다며 ""정부는 지금까지 'K 방역'을 자랑해왔고, 대한민국의 전국민 의료보험제도·의료시스템·방역 체계가 세계 최고 수준임이 코로나19 사태에서 확인됐다""며 ""그 주역이 의사들인데, 이들에게 포상과 칭찬은 못해줄망정 설익은 의료정책을 강요하면서 괴롭혀서는 안 된다""고 적었다.주 원내대표는 ""의사 수가 적정한지 아닌지를 두고 정부와 의사들이 감정싸움을 할 일이 아니고, 국회에 특위를 구성하든지 해서 좀더 장기적인 관점에서 다루기를 바란다""고 강조했다.또 ""'문재인 케어' 도입으로 건강보험 재정에 구멍이 났고, 1~3차 의료기관 사이 칸막이가 너무 낮아서 '비대면 진료'가 확산될 경우 지역 의원과 작은 병원들은 생존이 위협받는다고 우려하고 있다""며 ""코로나19 위기를 이용해 비대면 진료를 밀어붙인다면 정부가 자랑하는 K 방역에는 구멍이 날 수밖에 없다""고 주장했다.주 원내대표는 ""지금은 온 나라가 역병과 전쟁을 치르고 있는 때""라며 ""정부가 대국적으로 갈등을 정리하고 코로나19 방역에 매진하길 바란다""고 덧붙였다.  kaysa@news1.kr"
32,news1,"文대통령, 오늘 교회지도자들 만나 '코로나 방역' 협조 당부 청와대 초청 간담회…""코로나 상황 엄중함 설명하고 협조 요청""(서울=뉴스1) 구교운 기자|2020-08-27 05:00 송고기사보기네티즌의견인쇄확대축소","문재인 대통령이 지난해 7월3일 청와대에서 열린 한국교회 주요 교단장 초청 오찬 간담회에 참석해 인사말을 하고 있다. (청와대 제공) /뉴스1문재인 대통령은 27일 한국 교회 지도자들을 청와대에 초청해 신종 코로나바이러스 감염증(코로나19) 방역에 관한 협조를 당부한다.문 대통령은 이날 오전 11시 청와대 본관에서 김태영·류정호·문수석 한국교회총연합 공동대표회장 등 교회 지도자 16명과 1시간 동안 간담회를 진행한다.이번 간담회는 전광훈 목사와 사랑제일교회 등 일부 교회를 중심으로 방역 당국의 방역조치 및 역학조사에 관한 방해 행위가 조직적으로 이뤄지고 있는 상황에서 교회 지도자들의 협조를 요청하기 위해 마련된 것으로 풀이된다.또 코로나19로 힘든 시기를 겪고 있는 국민들에게 종교계가 연대의 힘을 모을 수 있도록 역할을 당부하고, 교회의 애로사항과 조언을 청취할 예정이다.문 대통령은 취임 후 지난해 7월 개신교와 불교, 올해 8월 천주교 등 종교 지도자들을 각각 1차례씩 초청해 간담회를 진행했다. 이날 간담회를 포함하면 교회 지도자들은 2번째 초청하는 것이다.청와대 관계자는 ""이날 간담회는 최근 다시 빠르게 확산되고 있는 코로나19 위기 상황의 엄중함을 설명하고 협조를 구하기 위해 이뤄진다""고 설명했다.  kukoo@news1.kr"
33,news1,"양승조 충남지사, 코로나19 방역 현장·취약계층 점검 코로나19 임시생활시설 방문해 현장 근무자 격려(대전ㆍ충남=뉴스1) 한희조 기자|2020-09-10 16:14 송고기사보기네티즌의견인쇄확대축소","양승조 충남도지사가 보령시 대천1동 대한노인회 보령시지회를 방문했다. © 뉴스1양승조 충남도지사가 10일 보령지역 코로나19 일선 방역 현장을 점검하고 노인‧장애인 등 취약계층과 소외지역 마을을 방문했다.이날 현장 점검 및 간담회에는 양 지사와 보령시장, 해당 지역구 의원, 마을주민 및 단체 대표 등이 참여했다. 양 지사는 이날 보령시 대천1동 대한노인회와 대천3동 보훈회관 등을 방문해 노인 일자리 확대 등 노인의 사회 참여 활동 지원 방안과 국가유공자 참전수당 지원 등 예우 방안에 대해 논의했다. 또 코로나19 임시생활시설로 활용 중인 성주산 자연휴양림을 방문해 해외 입국자 및 국내 접촉자 격리 현황과 방역 상황을 살피고, 현장 근무자들을 격려했다. 지난 2월 임시생활시설로 지정된 성주산 자연휴양림은 주간 11명, 야간 4명의 근무자가 24시간 관리하고 있으며 현재 입소자는 총 30명이다. 끝으로 미산면 옥현2리 내동마을을 방문해 마을 시설 개선 등 지역주민 건의사항을 청취하고, 코로나19 확산 차단을 위해 개인 위생수칙을 철저히 준수해 줄 것을 당부했다.gmlwh1010@news1.kr"
34,news1,"통합 ""방역에 여야 있을 수 없다""…코로나19 대책 수립 시동 김종인 취임 후 첫 코로나19 긴급대책회의…""질본 중심으로 통제해야""주호영 ""책임전가 희생양 찾기 중단돼야""…백신·병상·마스크 등 점검(서울=뉴스1) 김일창 기자|2020-08-23 15:32 송고 | 2020-08-23 16:17 최종수정기사보기네티즌의견인쇄확대축소","김종인 미래통합당 비대위원장이 23일 오후 서울 여의도 국회에서 열린 '코로나19 관련 기자간담회'에서 모두발언을 하고 있다. 2020.8.23/뉴스1 © News1 성동훈 기자미래통합당은 23일 코로나19(신종 코로나바이러스 감염증)의 확산을 막기 위해 종합적인 대책을 수립하겠다고 밝혔다. 정부·여당을 향해서는 부동산 등 정책 실패를 코로나 정국으로 돌파하려는 행태를 당장 중단하라고 촉구하는 한편, 질병관리본부 중심의 방역 대책 수립, 2차 긴급재난지원금 검토 등에 나서자고 제안했다.김종인 비상대책위원장은 이날 오후 국회에서 첫 코로나19 관련 긴급대책회의를 갖고 ""코로나19 방역에 여야가 있을 수 없는 만큼 통합당은 코로나19와의 전쟁에 총력을 다할 것""이라고 말했다.김 위원장은 정부·여당이 맞서야 할 것은 야당이 아니라 코로나19라는 점을 강조한 뒤""방역에 여야가 있을 수 없다""며 ""지지율을 신경 쓰는 '정치 방역'을 중단하고 코로나19 방역에 집중하라""고 목소리를 높였다.그는 ""다시 강조하지만 코로나19는 질병관리본부(질본)를 중심으로 전문가가 지침을 내리고 통제할 수 있도록 해야 한다""고 강조했다. 통합당은 △지역 상황에 맞는 사회적 거리두기 시행 △2차 재난지원금 △4차 추가경정예산안 △지방 보건소 등에 대한 질본의 지휘권 인정 △의사협회 파업 중단 끌어내기 등을 정부·여당에 요구했다.주호영 원내대표는 지난 15일 광화문 집회 참석자들에게 확산 책임을 묻는 듯한 정부여당의 태도를 꼬집었다. 주 원내대표는 ""이럴 때일수록 국민이 화합해 코로나19를 극복해야 함에도 정부여당은 희생양을 찾고 책임을 전가하고 있다""며 ""그러면서 정부여당에 우호적인 단체에 대해서는 전혀 제재를 가하지 않는 등의 여러 문제가 있다""고 말했다.이어 ""통합당은 이런 위기 순간에 여야는 물론이고 모든 국민이 일심으로 단결해 방역 당국이 제시하는 원칙 기준을 지켜 이 위기를 극복할 것""이라며 ""그 과정에서 정부가 제대로 하는지 전문가의 의견은 존중하는지 이런 점을 챙길 것""이라고 덧붙였다.코로나19대책특위 위원장으로 내정된 신상진 전 의원은 ""치료제 확보를 위해 어떤 노력을 하는지, 중증 환자 병상과 KF94 마스크 확보 등의 준비가 잘 되는지 등을 앞으로 점검할 것""이라며 ""재난지원은 국가 재정 대책에도 한도가 있기에 취약계층이나 피해를 많이 본 사람들에게 우선적으로 지원될 수 있는 방안을 검토하겠다""고 했다.그러면서 ""다른 건 몰라도 코로나19 극복만큼은 최우선 순위로 두고 여야가 힘을 합쳐 극복할 수 있도록 노력해달라""고 민주당에 당부했다.ickim@news1.kr"
35,news1,"전문가들 ""추석 코로나 특별방역 지침 금주엔 발표해야"" ""충분한 시간 갖고 대비할 수 있도록 지침 미리 내놔야""""귀경길 최소화 대책과 함께 지역내 다중시설 방역대책도""(서울=뉴스1) 황덕현 기자, 강수련 기자, 원태성 기자|2020-09-16 15:23 송고기사보기네티즌의견인쇄확대축소","정세균 국무총리가 16일 서울 세종로 정부서울청사에서 열린 코로나19대응 중대본회의에 참석하고 있다. 2020.9.16/뉴스1 © News1 김명섭 기자신종 코로나바이러스 감염증(코로나19) 상황이 감염자 세자릿수가 계속되는 가운데 정부는 수도권의 거리두기를 2단계로 조정하고 추석연휴를 전후해 2주간을 특별방역기간으로 정해 특단의 대처를 해나가기로 했다. 그러나 구체적 방법은 나오지 않은 상태다. 방역 전문가들은 지자체별 행정당국은 물론 시민들과 경제 주체들이 대비할 수 있도록 이번주 내 구체적인 발표가 이뤄져야 한다고 한목소리를 냈다. 정세균 국무총리는 16일 오전 코로나19 대응 중앙재난안전대책본부 회의를 주재한 자리에서 ""올해 추석 연휴 만큼은 무엇보다도 코로나19로부터 가족의 안전을 서로 지켜주는 명절이 될 수 있도록 적극적인 동참을 부탁드린다""면서 특별방역기간 운영의사를 밝혔다. 정 총리는 ""좀 더 멀리 내다보고 국민들이 예측 가능하도록 행동수칙을 미리 안내해 방역의 실천력을 극대화하기 위한 결정""이라며 운영 이유를 밝혔다. 하지만 아직 세부지침은 전파되지 않았다. 중대본을 중심으로 각 부처간 소통이 계속되고 있는 것으로 알려졌다. 구체적인 안이 나오기까지는 다소 시간이 걸릴 것으로 보인다. 하지만 의료 전문가들은 이번주 안에는 구체적인 안이 나와야 한다고 지적한다. 추석 명절은 지난 1일 KTX 명절 예매 개시에서 이미 시작됐기 때문에 발빠른 정부 계획과 권고 사항이 발표되야 한다는 것이다. 한국도로공사도 지난 주말 교통예보를 내면서 ""추석을 앞둔 시점에서 벌초를 하기 위한 차량들이 전주보다 많이 쏟아져 나와 고속도로 이용률이 늘었다""고 밝힌 바 있다. 우왕좌왕하다가는 이미 때를 놓칠 수 있다는 지적이다. 지난 2018년 추석 연휴 당시 경기도 성남시 궁내동 경부고속도로 서울요금소 인근 서울방향(왼쪽) © News1 박세연 기자천은미 이대목동병원 호흡기내과 교수는 ""구체적인 행동지침 등을 (코로나19) 관련 연구논문 등을 근거로 국민들에게 브리핑할 필요가 있다""고 제언했다. 고속버스를 비롯한 대중교통 예약을 50% 아래로 감축시키는 등 특단 대안도 제시했다. 그는 ""(고향에) 내려가지 못하게 할 것이면, 수도권 내에서는 다중이용시설 이용 자제 등 방법도 함께 내야 할 것""이라고 덧붙였다. 지역간 이동을 조정하면서, 지역 내 집단감염을 막을 수 있는 방안도 함께 나와야 한다는 것이다. 김우주 고려대병원 감염내과 교수는 ""귀성열차와 버스 예매가 끝난 상황이고, 코로나19로 지친 몸과 마음을 가족에서부터 '힐링'(Healing)할 수 있는 상황""이라면서 이미 이동을 계획한 이들의 발을 돌리기는 어려울 것이라고 말했다. 그렇지만 각 가정 내에서, 또 귀성과 귀경 상황에서 마스크 착용 등 개인 보건수칙을 지킬 것을 강조했다. 김 교수는 ""(코로나19 국내 발병 이후)지난 9개월간 집단감염이 많았지만,집에서 가족 간 전파도 상당했다""면서 ""오가는 길과 가정 내에서 안전하게 보낼 수 있는 수칙이 강화되야 할 것""이라고 제언했다. 정기석 한림대성심병원 호흡기 내과 교수는 ""(이번 수도권 2.5단계 거리두기처럼) 하루 전에 권고, 제한사항을 내놓는 것은 사람들이 대비하기 힘들다""면서 ""충분한 시간을 가지고 대비할 수 있도록 미리 지침을 발표하는 게 좋겠다""고 덧붙였다.16일 오후 서울 서초구 보건소 옆에 마련된 신종 코로나바이러스 감염증(코로나19) 언택트 선별진료소에서 의료진이 검체 채취를 하고 있다. 지난 14일부터 운영 중인 이 선별진료소는 역학조사실, 문진·검체실, 대면진료실, X-ray실 등으로 구성돼 코로나 뿐만이 아닌 다른 감염병에도 대응할 수 있다. 또한 환자들과 의료진 사이에 유리와 글로브 월이 설치된 비접촉 워킹스루 시설이다. 2020.9.16/뉴스1 © News1 안은나 기자 ace@news1.kr"
