,Press,Title,Text
42,한겨례,노동부 ‘신종 코로나’ 방역 등에 특별연장근로 허용키로,"28일 경북 포항시 북구 장성동 포항시북구보건소에서 신종 코로나바이러스 감염증 확산에 대비해 보건소 관계자가 공공기관에 비치할 마스크와 손 세정제를 점검하고 있다. 고용노동부는 이날 이 병의 방역·검역·치료 관련 업무의 특별연장근로를 허용하겠다고 밝혔다. 연합뉴스신종 코로나바이러스 감염증의 위기 경보가 ‘주의’에서 ‘경계’로 격상되는 등 이 병의 확산 우려가 커지면서, 고용노동부가 관련 업무의 특별연장근로 허용 방침을 밝혔다.노동부는 28일 보도자료를 내어 “신종 코로나바이러스 감염증의 방역·검역·치료 등 대응에 차질이 없도록, 이런 업무와 관련한 특별연장근로 인가 신청이 접수되면 신속히 조치하겠다”고 밝혔다. 특별연장근로는 자연재해와 재난 또는 이에 준하는 사고의 경우 주 52시간 이상 일할 수 있도록 노동자 동의를 받아 노동부 장관이 인가하는 제도로, 지난해엔 아프리카돼지열병 방역 업무과 태풍 ‘타파’ 피해복구 작업, 일본의 수출 제한 품목 관련 기업 등에 허용된 바 있다.노동부는 또, 전국 지방노동관서와 안전보건공단, 민간 재해예방기관 등을 통해 각 사업장에 청결관리와 사업장 내 감염유입·확산 방지, 의심 또는 확진 환자 및 격리대상 발생 시 조치 사항 등의 내용을 담은 ‘사업장 대응지침’을 29일 전달하기로 했다. 이와 함께 지방노동관서와 안전보건공단은 의료기관과 항공사, 대형마트 다중이용시설 사업장의 자체점검과 대응계획 수립 등을 지도하고, 필요할 경우 사업장을 직접 방문해 이 병의 예방 활동도 벌이기로 했다.조혜정 기자 zesty@hani.co.kr"
43,한겨례,"“대규모 행사·축제·시험, 코로나19 방역 뒤 시행 무방”","문재인 대통령이 12일 오전 서울 남대문시장을 찾아 코로나19 확산에 따른 방문자 감소로 어려움을 겪고 있는 상인과 이야기를 나누며 어묵을 사고 있다. 김정효 기자 hyopd@hani.co.kr정부가 코로나19로 인해 대규모 행사와 축제, 시험 등을 무조건 취소하거나 연기하는 대신 방역 조치를 충분히 취하면 행사를 추진해도 된다고 권고했다. 다만 밀폐되고 좁은 공간에서 열리거나 노인·임산부 등 건강취약계층이 모이는 행사에 대해서는 연기 또는 참가자 축소 등 조정 방안을 마련하는 것이 좋다는 입장이다.정부는 12일 이런 내용을 담은 ‘신종 코로나바이러스 감염증 관련 집단행사 방역관리지침’을 내놨다. 정은경 중앙방역대책본부장은 “아직까지는 중국, 동남아 등에서 유입되거나 이들 나라에서 감염돼 국내에 들어온 뒤 확진 판정을 받은 이와 밀접하게 접촉한 가족, 지인 중심으로 ‘제한적인 전파’가 발생하고 있다”며 “지역사회에서 벌어지는 모든 행사를 취소하거나 그럴 정도의 위험도는 아니라고 본다”고 밝혔다. 정부가 이날 내놓은 지침을 보면, 앞으로 대규모 행사 주최 기관은 코로나19 증상 신고접수 담당자를 지정해 지방자치단체와 핫라인을 구축하도록 하고 의심환자 발생에 대비한 격리공간과 체온계, 보건용 마스크 등을 갖추도록 했다. 또 이번 감염증이 비말 감염이라는 점을 고려해 참가자들이 밀접 접촉하거나 재채기와 콧물, 가래, 기침 등을 유발할 수 있는 프로그램을 자제하도록 권고했다. 만일 행사 중 의심환자가 발생하면 보건소에 신고하고 의심환자를 환기가 잘되는 공간에 격리해 대기시켜야 한다. 환자 이송 뒤에는 격리공간 소독과 임시 폐쇄 등의 절차도 밟아야 한다.아울러 정부는 중국에서 입국한 뒤 14일이 지나지 않은 사람들과 호흡기 증상을 보이는 이들은 행사 참석을 자제하도록 하고, 시험을 볼 경우에는 별도로 공간을 분리해서 운영해줄 것을 요청했다.한편 교육부는 올해 1학기에 한해 전공(학과)별로 전체 교과목의 20%까지로 제한돼 있는 원격수업(온라인강의) 운영 기준을 완화하기로 했다고 이날 밝혔다. 4주 이내에서 대학들이 개강을 연기할 수 있도록 한 데 따른 후속 조처다.노지원 이유진 기자 zone@hani.co.kr"
44,한겨례,[사설] ‘코로나 방역’ 앞장서 이끄는 한국의 진단키트 미국 수출,"국산 코로나19 진단키트를 미국으로 수출하기 위해 14일 오후 인천국제공항 화물터미널에서 관계자들이 진단키트가 담긴 상자를 옮기고 있다. 외교부 제공국산 코로나19 진단키트 60만회 분량이 14일 미국으로 수출됐다. 지난달 24일 도널드 트럼프 미국 대통령이 문재인 대통령과의 통화에서 진단키트 지원을 요청했고, 국산 제품들이 미국 식품의약국(FDA)의 사전 승인을 얻어 수출이 이뤄졌다.국내 업체가 미국 일부 지역에 진단키트를 소량 공급한 적은 있지만, 미 연방정부 차원의 진단키트 대량 발주는 처음이다. 미국이 세계 최대 의약품 시장이고, 식품의약국의 승인을 받는 일은 매우 어렵다. 식품의약국의 한국산 진단키트 사전 승인은 그 자체로 의미가 크다.국산 진단키트의 미국 수출은 한-미 관계에 대한 두 나라 국민 인식에도 영향을 줄 것으로 보인다. 한국의 국력이 커졌지만 양국에는 여전히 미국이 일방적으로 한국을 돕고 지켜주는 수직적 관계로 여기는 사람이 많다. 한국이 이번에 미국을 도와주면서 한-미 관계가 서로 돕는 수평적 관계라는 인식이 커지는 계기가 될지 주목된다.한국형 방역 모델에 대한 국제사회의 호평이 늘면서 우리에게 방역 도움을 요청하는 나라가 늘고 있다. 지금까지 국산 진단키트가 전세계에 770만회 분량이 수출됐다. ‘대결과 갈등’의 구조에 기반한 외부 군사 위협 대처와 달리 국제 보건 협력은 ‘협력과 상생’의 구조에서 출발해야 한다.지난달 26일 주요 20개국(G20) 화상 정상회의에 이어 14일 한국, 중국, 일본 정상이 아세안 10개국 정상과 ‘아세안+3 화상 특별정상회의’를 열어 코로나19 대응 국제 협력 방안을 논의했다. 문재인 대통령은 의제 발언을 통해 “한국은 인도적 지원 예산을 추가로 확보하고, 아세안을 포함한 각국의 지원 요청에 형편이 허용하는 대로 최대한 협조할 것”이라고 말했다. 문 대통령은 한-아세안 보건장관 대화 채널 신설 등도 제안했다. 어느 한 나라가 건강하지 못하면 모든 나라가 건강할 수 없다는 인식 속에서 동아시아 각국이 감염병 공동 관리 시스템을 만들어야 한다."
45,한겨례,"청, “북이 승낙하면 코로나19 방역 사업 바로 시행할 준비 돼”","청와대가 28일 문재인 대통령이 전날 북한에 제안한 코로나19 공동 방역에 관해 “북한이 받아들인다면 곧바로 시행할 준비가 돼 있다”고 말했다. 동해 북부선 연결과 개별 북한 관광 문제는 “미국과 오랫동안 협의한 사안”이라고 했다.    청와대 고위 관계자는 이날 기자들과 만나 전날 문 대통령이 4·27 2돌을 맞아 북한에 제안한 코로나19 공동 방역에 관해 “인도주의적인 문제들이기 때문에 남북 협력에 큰 제약은 없을 것으로 본다”며 “대북 제재에 해당되는 사안은 아니다”라고 말했다. 그는 “아직 북쪽의 반응은 없지만, 받아들인다면 곧바로 시행할 준비는 돼 있다”며 “희망적으로 기대한다”고 말했다.  그는 동해 북부선 철도 복원과 남북 연결 사업에 관해서는 “미국과 그동안 긴밀히 협의해 왔다”며 “그런 배경 아래 철도 연결을 추진하는 것”이라고 말했다. 북한 개별 관광 역시 그는 “북한과 오래 협의해온 사안”이라고 덧붙였다. 현재 동해선에서 끊어진 남쪽 제진역에서 북쪽 감호역까지 10.5㎞ 구간 연결에 미국 쪽이 반대하지 않았다는 것으로 풀이된다. 정부는 동해선 철도 연결이 성사되면 철로를 통한 남북 이산가족 상봉, 금강산 관광 재개 등도 염두에 둔 것으로 알려진다.  청와대는 김정은 북한 국무위원장을 둘러싼 여러 소문에 관해 “어떤 상황인지 청와대에서 언급하는 것은 맞지 않는 것 같다”며 “청와대 대변인이 언급한대로 식별할 만한 특이 동향을 발견하지 못했다”고 말했다.  한편, 이 관계자는 오거돈 부산시장의 성범죄 사실을 청와대가 미리 알았다는 미래통합당의 주장에 관해 “청와대와 대통령을 연결 시키려는 것”이라며 “내용 자체가 황당하다”고 비판했다. 그는 “문 대통령은 2012년 국회의원에 출마하면서 법무법인 부산의 지분까지 다 정리했다. 관련 없는 내용을 억지로 연결하려는 것”이라고 했다. 성연철 기자 sychee@hani.co.kr"
46,한겨례,"울산시, ‘코로나19’ 대응 방역전문가 자문단 구성·운영","대구에서 영남권 최초로 코로나19 확진자가 무더기 발생하자 울산시가 ‘방역전문가 자문단’을 구성하는 등 코로나19 차단을 위한 총력 대응에 나섰다.울산시는 19일 코로나19 등 신종·재출현 감염병 대응과 유입 차단을 위한 방역전문가 자문단을 구성해 운영한다고 밝혔다. 자문단은 변태섭 울산시 의사회 회장이 단장을 맡고, 전문의·교수 등 모두 8명으로 구성됐다.자문단은 국내외에서 발생하는 감염병 유입·확산 가능성을 예측·분석하고, 병원체의 기초 임상과 의학적 소견을 토대로 역학조사와 위험성 분석, 방역 조처 등의 자문에 응하게 된다. 특히 병원에서 확진 환자가 발생할 때 추가 확산을 막기 위해 병원의 일부 또는 전부 폐쇄 여부 결정과 이행 상황 점검, 격리 병실 등에 대한 감염관리 현황점검 등 실효적이고 구체적인 대응 방향을 세우는 데도 조언을 하게 된다.울산시는 자문단의 조언을 바탕으로 실효성 있는 방역대책을 세워 시행하기로 하고, 이날 오후 3시30분 시장 접견실에서 송철호 시장이 참석한 가운데 첫 자문단 회의를 연다. 이날 회의는 자문단 위촉장 수여에 이어 코로나19 대응 상황 보고, 자문과 토론 등으로 진행된다.송철호 시장은 ""국외여행 경력이 없고 감염경로가 불분명한 코로나19 확진자가 대구에서 추가 발생하면서 지역사회 감염 우려가 커지고 있다. 민간 전문가로 구성된 자문단과 함께 힘을 합쳐 감염병 위기 상황을 잘 헤쳐나가고 시민 불안을 해소하도록 노력하겠다""고 밝혔다.신동명 기자 tms13@hani.co.kr    화보보기519  [화보] 코로나19 국내 비상     화보보기344  [화보] 코로나19 해외 비상 "
47,한겨례,이탈리아 검찰 ‘코로나 초기 방역 실패’ 책임 조사,"이탈리아 간호사 노조 소속 간호사들이 10일(현지시각) 밀라노에 위치한 롬바르디 지역본부 앞에서 코로나19 환자들을 치료하던 중 희생된 이들을 추모하며 당국을 향해 근무 조건 개선 등을 요구하는 시위를 하고 있다. 밀라노/AP 연합뉴스이탈리아에서 코로나19 희생자 유가족들이 코로나19 인명 피해가 커진 경위를 조사해달라고 검찰에 고소장을 냈다. 이탈리아 북부 롬바르디주 베르가모의 코로나19 희생자 유가족들을 대리하고 있는 콘수엘로 로카티 변호사는 10일 롬바르디주의 코로나19 발생 대처 상황을 조사해달라는 40건가량의 고소장을 검찰에 제출했다고 밝혔다. 그는 <로이터> 통신 인터뷰에서 “사람들은 (어쩌다가 인명 피해가 이렇게 커졌는지) 설명을 원하고 있다”며 이와는 별개로 9월께 여러건의 민사소송을 준비하고 있다고 덧붙였다. 베르가모가 속한 롬바르디주는 이탈리아 코로나 희생자(미국 존스홉킨스대 집계 기준 3만4114명) 절반 가량이 집중되는 등 가장 심각한 피해를 입은 지역이다. 이탈리아 정부는 3월8일에서야 베르가모에 위치한 소도시 코도뇨 일대를 ‘레드존’으로 지정하고 봉쇄를 시작한 바 있다. 베르가모 지방검찰은 이번 조사에서 베르가모 주요 지역에서 코로나19가 확산 되기 시작되고 한 달이 지난 3월8일까지 봉쇄 조처를 늦춘 이유를 파악하는 데 집중할 것으로 알려졌다. 이미 아틸리오 폰타나 주지사와 줄리오 갈레라 주 보건장관을 불러 조사도 했다. 폰타나 주지사 등은 조사에서 “연방정부가 결정하지 않는 한 주정부 차원에서 특정 지역의 봉쇄를 결정할 순 없다”고 주장했다. 하지만 주세페 콘테 총리는 기존에 “롬바르디주가 원했다면 해당 지역을 더 빠르게 봉쇄했을 것”이라고 한 바 있어, 책임을 둘러싼 공방이 이뤄질 것으로 보인다. 검찰은 오는 12일 로베르토 스페란차 보건장관과 루치아나 라모르게세 내무장관 등 관계 부처 장관은 물론 콘테 총리 등을 대상으로 이번 주에 정부의 방역 실패 경위를 조사한다는 계획이다. 이정애 기자 hongbyul@hani.co.kr"
48,한겨례,"검찰, 코로나19 ‘방역 방해’ 신천지 이만희 총회장 등 19명 구속기소","이만희 총회장코로나19 방역 활동을 방해한 혐의 등으로 구속된 이만희(89) 신천지예수교 증거장막성전(신천지) 총회장이 재판에 넘겨졌다.수원지검 형사6부(부장 박승대)는 14일 감염병예방법 위반, 위계에 의한 공무집행 방해, 특정경제범죄가중처벌법 위반(횡령), 업무방해 등의 혐의로 이 총회장을 구속기소했다. 또 신천지 관계자 11명을 같은 혐의로 함께 재판에 넘겼다. 이 총회장은 신천지를 중심으로 코로나19가 확산하던 지난 2월 신천지 간부들과 공모해 방역당국에 신도명단과 집회장소를 축소해 보고한 혐의로 지난 1일 구속됐다.이 총회장은 신천지 연수원인 평화의 궁전을 신축하는 과정에서 50억여원의 교회 자금을 가져다 쓰는 등 56억원을 횡령하고, 2015년부터 지난해까지 지방자치단체의 승인 없이 해당 지자체의 공공시설에서 종교행사를 연 혐의도 받는다. 이 총회장과 함께 불구속기소 된 11명은 대부분 신천지 간부들로, 증거인멸에 관여하거나 서류를 위조해 건축 허가를 받고 시설물을 무단 사용하는 등 불법적인 방법으로 교단 활동을 해 온 것으로 조사됐다.검찰은 지난 2월 27일 전국신천지피해자연대(전피연)로부터 이 총회장에 대한 고발장을 접수해 고발인 조사를 진행하고, 신천지가 제출한 자료와 방역 당국이 확보한 자료 간 불일치 사례를 확인하는 등 수사를 벌여왔다. 이날 이 총회장을 포함해 12명이 추가 기소되면서 이번 사건으로 재판에 넘겨진 인원은 모두 19명으로 늘었다.한편, 이 총회장은 법원에 구속이 합당한지를 판단해 달라며 구속적부심을 청구했지만, 수원지법 형사11부는 지난 13일 “범죄사실의 소명 정도, 수사 진행 상황, 건강 상태 등을 종합적으로 고려하면 구속영장 발부가 부적법하다거나 구속 계속의 필요성 등이 인정되지 않을 정도의 사정 변경이 생겼다고 보이지 않는다”며 이를 기각했다.김기성 기자 player009@hani.co.kr"
49,한겨례,네이처 “코로나19 철통방역 없었다면 한국인 1155만명 확진됐을 것”,"코로나19에 대한 각국의 방역 대책이 없었다면 한국 등 6개국에서만 6200만명이 양성 판정을 받았을 것이라고 미국 버클리 캘리포니아주립대 연구팀이 <네이처>에 밝혔다. UC버클리대 제공코로나19에 대한 방역을 철저히 하지 않았다면 한국인은 1155만명이 더 감염됐을 것이라는 분석이 나왔다. 이는 실제 감염 인구의 1165배에 이르는 엄청난 수치다.미국 버클리 캘리포니아주립대 연구팀은 8일(현지시각) 한국·미국 등 6개국 정부가 코로나19 감염 확산을 막기 위해 사회적 거리두기 등 각종 방역 대책을 세워 5억3천만명이 감염을 피할 수 있었다는 분석을 저명한 과학저널 <네이처>에 발표했다. 연구팀은 이들 인구를 대상으로 각국별로 진단검사를 했을 경우 6200만명이 양성 판정을 받았을 것이라고 덧붙였다.연구팀은 여행 제한, 학교와 기업체 문닫기, 집안에 머물기 등 한국, 미국, 중국, 이탈리아, 이란, 프랑스 등 6개국이 코로나19 방역을 위해 올해 1월부터 4월6일까지 시행한 1717건의 방역대책의 효과를 분석했다. 솔로몬 샹 버클리대 세계정책연구소장은 “인간의 노력으로 짧은 시간에 이렇게 많은 사람들을 구한 적은 없었다”며 “집에 머물고 약속을 취소하는 등 개인적인 희생이 있었지만 데이터는 (이런 희생으로) 하루하루가 크게 달라졌다”고 말했다.현재 세계적으로 확진환자는 약 700만명에 이르고, 이 가운데 40만명이 목숨을 잃었다. 하지만 방역 대책이 없었다면 이 수치는 상상할 수 없을 만큼 커졌을 것이라고 연구팀은 분석했다. 예를 들어, 중국의 경우 분석 기간인 3월5일까지 7만4473명이 양성 판정을 받았는데, 우한 폐쇄 등 방역 대책이 없었다면 85.9배인 639만5576명이 확진 판정을 받았을 것이라는 분석이다. 한국은 4월6일 기준 양성 판정 환자가 9924명이었는데, 만약 강력한 사회적 거리두기 등 대책이 없었다면 1165배인 1155만7091명이 확진 판정을 받았을 것이라는 게 연구팀 분석이다.방역 대책의 예방 효과는 각국마다 달라, 아무런 방역을 하지 않았을 때 양성 판정을 받았을 추정 인구 배수는 이란은 227배, 이탈리아는 17배, 미국은 14배, 프랑스는 12배였다.연구팀은 집안에 머물기, 기업체 문닫기, 비상사태 등 봉쇄 조처 등은 명확한 효과를 보인 반면 여행 제한이나 금지는 이란과 이탈리아에서는 효력을 봤지만 미국 등지에서는 유효성이 뚜렷하지 않았다고 분석했다.연구팀은 “연구를 통해 분명히 알 수 있었던 것은 정책 도입의 작은 지연이 엄청나게 다른 결과를 낳는다는 것”이라고 밝혔다. 이근영 기자 kylee@hani.co.kr"
50,한겨례,‘코로나19 방역 저해’ 최근 6개월간 총 480건 수사·재판 진행,"서울 서초구 서초동 서울중앙지검 1층 현관. 한겨레 자료 사진지난 6월 일본에서 입국한 30대 남성 ㄱ씨는 코로나19 ‘감염병 의심자’로 분류돼 자가격리를 통보받았다. 그는 자가격리 해제를 불과 하루 앞두고 자신의 차량을 운전해 대형마트 주차장에 들렀다가 감염병예방법 위반 혐의로 재판에 넘겨졌다. 지난 4월 코로나19 확진 환자와 접촉이 의심돼 자가격리된 ㄴ씨 역시 자가격리 기간 중 길거리를 배회하다 적발돼 같은 혐의로 불구속기소됐다.최근 코로나19가 재확산되는 가운데 검찰이 수사 중이거나 재판에 넘긴 코로나19 방역 저해 관련 사건이 총 480건에 이르는 것으로 드러났다. 이 통계에는 경찰이 구속영장을 청구하지 않고 수사 중인 사건은 제외돼 있어 실제 사건 수는 더 많을 것으로 보인다.24일 대검찰청이 공개한 ‘코로나19 사범 관련 통계’(올해 2월~8월24일 오전 9시 기준)를 보면, 가장 큰 비중을 차지하는 유형은 감염병예방법 위반 사건이다. 집합제한명령 위반과 역학조사시 거짓 자료 제출, 입원치료 및 격리 조처 위반, 진찰 거부 행위 등이 여기에 포함된다. 검찰이 관리하는 사건만 356건에 이르고, 이 가운데 300건(구속기소 13건)이 재판에 넘겨졌다. 감염병 의심자가 격리 조처를 위반하면 1년 이하의 징역이나 1천만원 이하의 벌금을 물릴 수 있다.정부기관과 관공서에 코로나19 확진자 접촉 경위를 허위로 신고하는 등 허위사실유포와 명예훼손, 위계공무집행방해 혐의로 적발된 사건은 87건(기소 38건), 코로나19 관련 개인정보를 제삼자에게 누설하는 등 공무상비밀누설과 개인정보보호법을 위반한 사건은 37건(기소 16건)에 달한다.임재우 기자 abbado@hani.co.kr"
51,한겨례,베이징 코로나 재확산 비상…방역 당국 “유럽형 바이러스”,"코로나19 집단 감염이 다시 시작된 중국 수도 베이징에서 15일 확진자 발생으로 봉쇄식 관리에 들어간 한 주거단지 들머리에 마스크를 쓴 경찰과 경비요원들이 배치돼 출입자 통제를 하고 있다. 베이징/AP 연합뉴스중국 수도 베이징에서 코로나19 지역사회 전염으로 확진자가 계속 나오면서 방역당국이 집단감염 발생지역을 중심으로 봉쇄식 관리와 전수 핵산검사 등 대응 조치를 강화하고 있다.15일 국가위생건강위원회 집계 결과, 전날 하루 중국에선 외국에서 역유입된 사례(10건)을 포함해 신규 확진자가 모두 49명 나왔다. 이 가운데 36명이 베이징에 집중됐다. 최초 집단 감염 발생지인 베이징 남부 펑타이구 신파디 농수산물 도매시장 발 코로나19 2차 확산 우려가 커지면서, 방역당국도 발빠르게 대응 수위를 높이고 있다.관영 <신화통신>의 보도를 종합하면, 방역 당국은 신파디 시장 인근지역 거주민 4만6천여명에 대한 핵산검사를 위해 24개 검사센터를 설치해 전날 오후 2시까지 모두 2만9천여명의 검사용 샘플을 채취했다. 이 가운데 1만2973명은 음성판정을 받았으며, 나머지는 검사 결과를 기다리고 있다.신파디 시장과 관련해 확진환자가 나온 하이옌구 위취안 시장 주변 10개 주택단지도 이날부터 봉쇄식 관리에 들어간다고 밝혔다. 이에 따라 해당 지역 주민은 당분간 자가 격리에 들어가며, 코로나19 진단 검사도 받게 된다. 위취안 시장 부근 초중고등학교는 졸업반을 제외한 모든 학년의 등교도 이날부터 잠정 중단했다.바이러스 유입 경로가 여전히 확인되지 않으면서, 베이징시 각 구 정부는 6월1일 이후 신파디 시장에 다녀왔거나, 시장 관계자와 접촉한 주민들의 자발적 등록과 진단 검사를 독려하고 있다. 베이징 최대 농수산물 유통센터인 신파디 시장이 폐쇄되면서 공급 부족에 대한 우려 탓인지 주말부터 일부 슈퍼마켓 신선식품 매대는 채워놓기 무섭게 텅 비기도 했다. 이날 오전 출근시간 대엔 바이러스 확산 소식에 대중교통 대신 차량을 몰고 나온 이들이 늘면서 극심한 교통체증이 빚어지기도 했다. 이런 가운데 방역당국이 신파디 시장에서 발견된 코로나19 바이러스의 염기서열 분석 결과, 기존에 중국에서 유행한 바이러스가 아닌 유럽에서 역유입된 확진자한테서 검출된 바이러스와 유사하다는 점을 강조하고 나서 눈길을 끈다. 앞서 베이징 방역당국은 집단감염 발생 초기 “신파디 시장에서 수입된 연어를 자른 도마에서 코로나19 바이러스가 검출됐다”고 밝힌 바 있다.베이징발 코로나19 확산으로 지방 정부에도 비상이 걸렸다. 베이징 인근인 허베이성과 텐진을 비롯해 상당수 지방정부가 베이징 방문 자제령을 내렸고, 산둥·네이멍구·쓰촨성 등지에선 최근 14일 동안 베이징 집단감염 발생지역 방문자에 대해 14일 간 자가 격리를 명했다. 또 광둥·허난·간쑤성 등지에선 신선식품 안전검사를 대폭 강화하기로 했다. 베이징/정인환 특파원 inhwan@hani.co.kr    화보보기50  [화보] 코로나19, 해외 봉쇄 완화 "
