,Press,Title,Text
0,한국경제TV,"한정애 국회 복지위원장 ""의료정책 일방강행 않겠다…의사들 돌아와달라""","한정애 더불어민주당 신임 정책위의장이 1일 오전 국회에서 열린 원내대책회의에서 발언하고 있다. /사진=연합뉴스                        국회 보건복지위원장인 한정애 더불어민주당 의원(사진)은 1일 공공의대 설립, 의사정원 확충 등 의료계가 반발하고 있는 정부 의료정책과 관련해 ""당의 이름을 걸고 강행 처리하지 않고, 논의체에서 충분히 협의된 제3의 안이 나오면 그것을 법제화해 처리하겠다""고 밝혔다.한정애 의원은 이날 KBS 라디오 '김경래의 최강시사'와의 인터뷰에서 ""의대 정원을 늘리지 않고, 찾아서 할 수 있는 방법이 있다면 하겠다""며 이같이 말했다.한정애 의원은 ""이제는 주장에서 벗어나서 논의와 토론을 할 때가 됐다. 국회가 그 장을 열겠다""고 전했다. 대한전공의협의회(대전협)는 정부 의료정책에 대해 '원점 재논의' 등을 합의문에 명문화할 것을 요구한 바 있다.  관련기사 이낙연 ""김종인 대권 도전? 바람결에 들은 바 있다""文 '히포크라테스 선서' 언급에 뿔난 의료계 ""취임 선서는?""홍남기 겨냥해 ""박근혜 사람 커밍아웃""…선 넘는 與 인사들 홍남기 ""철 없다"" 비판에 ""철 들도록 노력하겠다"" 비꼰 이재명野 ""의료진 북한에 강제파견?""…""품격있는 '시무7조' 논쟁"" [여의도 브리핑]이재명, 홍남기에 ""인터뷰 확인도 안 하고 비난…당황스러워""의사 국가시험 1주일 연기이인영 ""北 재난시 의료인 파견? 기본적으로 가능한 것""""불의에 맞서는 제자들 지키겠다"" 복지부 막아선 의대 교수들 [종합]24살 與 최고위원…청년 배려하겠다던 이낙연 '파격 인선'  이어 ""원점 재검토라는 단어가 그렇게 중요한지 모르겠다. 정부나 국회를 굴복시켰다는 것이 그렇게 큰 의미가 있는가""라며 ""모든 정책을 진행할 때 소통이 조금 부족했다고 해서 그걸 다 원점 철회라는 방식으로 요구한다면 과연 어느 정부가 견딜 수 있을까. 그 단어에 집착할 것이 아니라 그 내용이 무엇을 뜻하는지 봐주는 것이 맞지 않는가""라고 덧붙였다.그는 ""지금 의료현장에서 일어나고 있는 상황들에 대한 것까지를 포함해 여러분들과 함께 논의를 진행하고 협의하겠다""며 ""국회를 믿어주시고 이제는 현장으로 돌아와달라""고 당부했다.                            전공의들이 무기한 파업을 지속하기로 한 지난달 31일 서울 종로구 서울대병원 본관 앞에서 한 전문의가 정부가 추진하고 있는 의대 정원 확대, 공공의대 설립 등을 반대하며 1인 피켓 시위를 하고 있다. /사진=허문찬기자  sweat@hankyung.com                        의사 국가고시 한 주 연기에 대해선 ""정부가 이 상황에 대해 진정성을 보이고 있다는 것을 보여준 것""이라고 했다.이어 ""국회가 제안한 국회 내 협의기구 등을 통해서 모두가 공감대를 표명한 의료서비스 지역 불균형 해소, 필수 의료 강화, 공공 의료 확충에 더해 의료계가 제기하는 문제들까지 의료계와 함께 협의할 수 있다는 아주 큰 틀에서의 보장과 보증을 했다고 본다""면서 ""이 이상 어떻게 더 약속을 할 수 있을까 하는 생각을 하지만, 그럼에도 불구하고 국회에 요구하는 사항이 있다면 저희는 항상 열려 있다는 말씀을 드린다""고 전했다.주호영 미래통합당 원내대표가 제안한 '여야정 합의체'에 대해선 ""만약 의료계에서 신종 코로나바이러스 감염증(코로나19) 상황이 안정된 이후 '나 몰라라' 하면 어떻게 하느냐고 하는 불안감이 있다면 9월 정기국회에서 바로 협의체를 꾸리겠다""고 덧붙였다.조준혁 한경닷컴 기자 presscho@hankyung.com"
1,한국경제TV,"국립법무병원 공무원 의사 11명 '사표'…""잘못된 의료정책""","전공의·전임의 등 의료계가 의대정원 확대, 공공의대 설립 등 주요 정책 철회를 촉구하며 집단휴진을 이어가고 있다. 1일 서울 종로구 서울대병원 본관 앞에서 한 전공의가 정부의 의료정책에 반대하는 피켓을 들고 있다./사진=뉴스1                        전공의 집단휴진으로 의료 공백이 발생한 가운데, 법무부 산하 국립법무병원(치료감호소)에서 일하는 공무원 신분의 의사들이 정부의 의료정책에 반발하는 의미로 사표를 냈다.국립법무병원 정신과 의사 11명은 지난 1일 입장문을 내고 ""사직서 제출을 통해 후배들인 전공의들과 같은 뜻을 나누며 그들의 주장에 전폭적인 지지의 뜻을 보내고자 한다”고 밝혔다.이들은 ""사회 안전을 위해 일해 온 국립법무병원 의사로서 스스로 본연의 역할과 책임이 매우 막중함을 알고 있다""면서도 ""그러나 중요 의료정책이 잘못 진행되고 있는 것을 보고 또 동료 의사, 후배 전공의들이 자신의 자리를 떠나고 있음을 보면서 마냥 침묵할 수는 없다""고 전했다.  관련기사 [속보]""코로나19 확산 상황 따라 군의관 추가 요청도 검토""[속보]""정부·국회·의료계 약속 믿고 전공의들은 복귀해달라""정총리 ""전공의 업무 복귀 늦을수록 환자 고통 늘어…돌아오라"" 與 ""의료정책 원점 재검토""…의사파업 돌파구 여나12일째 집단휴진, 전공의 10명 가운데 8명 근무 안해정부 ""정원확대 일단 보류"" vs 전공의 ""문서화해야 복귀""서울성모병원 외과 내달 7일 수술 중단…교수급 의료진 첫 단체행동정부·의사 '지역의사 부족'엔 공감…해법은 ""증원"" vs ""수가 인상""""불의에 맞서는 제자들 지키겠다"" 복지부 막아선 의대 교수들 [종합]'일하는 전공의' 非의사 논란에 면허증 제시하며 신상 밝혔다  이어 ""우리가 진정으로 바라는 것은 이런 의사 표현을 하지 않아도 본연의 역할을 제대로 할 수 있는 의료정책과 환경""이라고 강조하며 정부에 △의과 정원 확대와 공공의대 설립 등의 의료정책 철회 △전공의에 대한 행정명령과 고발 취하 △향후 의료정책에 대해 의사협회 등과 지속적 협의 등을 요청했다.한편, 정부는 전공의 집단휴진으로 발생한 의료 공백을 메우기 위해 군의관을 투입할 방침이다.2일 국방부에 따르면 1차로 파견이 확정된 인원은 22명이다. 이들은 우선 인천의료원·인하대병원 등 수도권 민간 의료기관을 지원한다. 당초 중앙사고수습본부가 국방부에 요청한 군의관 규모는 53명 규모로, 국방부는 일정과 의료기관이 확정되는 대로 나머지 인원도 추가 지원할 방침이라고 밝혔다.이미경 한경닷컴 기자 capital@hankyung.com"
2,한국경제TV,"與 ""의협과의 합의 이행에 최선""…野 ""의료계 결단에 감사"" [여의도 브리핑]","박능후 보건복지부 장관(오른쪽)과 최대집 대한의사협회장이 지난 4일 서울 광화문 정부서울청사에서 열린 의·정 협의체 구성 합의서 체결식에서 합의서에 서명한 뒤 악수하고 있다. /사진=연합뉴스[여의도 브리핑]은 각 정당이 주목한 이슈는 무엇인지, 어떤 공식 입장을 냈는지 살펴봅니다. 때로 화제가 되고 때로는 이슈 몰이에 실패한 정당의 말들을 집중 조명합니다. 매일 아침 찾아뵙겠습니다. <편집자 주>한정애 더불어민주당 정책위의장(오른쪽)과 최대집 대한의사협회장이 지난 4일 서울 여의도 민주당사에서 정책협약 이행 합의서에 서명 후 주먹을 맞대고 있다. /사진=뉴스1  민주당 ""의협과의 합의 이행 위해 최선 다하겠다""더불어민주당은 지난 4일 총 2건의 논평을 냈습니다. △대한의사협회와의 정책이행 합의에 대한 내용 1건 △사회적 거리 두기 '2.5단계' 연장에 대한 내용 1건 등이었습니다.의협과 정부여당은 같은 날 신종 코로나바이러스 감염증(코로나19) 안정화까지 의대 정원 및 공공의대 확대 논의를 전면 중단하고 의료계도 집단휴진을 마치는 데 최종 합의했는데요. 민주당 이에 환영의 메시지를 냈습니다. 다음은 민주당의 논평입니다.최인호 민주당 수석대변인 : 의료계의 집단휴진 문제해결을 위해 오늘 오전 대한의사협회와 민주당의 정책협약 이행 합의를 했습니다. 지난 1일 한정애 정책위의장과 의협 간 대화 이후 사흘 만에 이루어진 것으로 진정성 있는 대화의 결과라 생각합니다. 대한의사협회와 민주당은 코로나19 확산이 진정될 때까지 그동안 의료계가 반대했던 의대 정원 확대와 공공의대 신설 관련 논의를 중단하고, 코로나19 안정화 이후에 협의체를 구성해 재논의하기로 했습니다.아울러 민주당은 공공보건의료기관의 경쟁력 확보를 비롯해 의료인들의 근로조건 개선 등 전반적인 의료환경 개선을 위한 지원방안 마련에도 노력하기로 했습니다. 많은 우여곡절이 있었지만 오늘 합의는 코로나19 위기에서 국민과 환자를 우선한 결정이라고 생각합니다. 오늘을 계기로 집단휴진에 나선 의료인들이 조속히 복귀하길 바라며, 코로나19 위기를 함께 극복해 나가길 기대하겠습니다. 민주당도 합의 이행에 최선을 다하겠습니다.최대집 대한의사협회장과 한정애 더불어민주당 정책위의장이 지난 4일 서울 여의도 민주당사에서 정책협약 이행 합의서에 사인 했다. 사진은 합의서. /사진=연합뉴스 국민의힘 ""극적 합의 환영…4대 정책 면밀히 검토""국민의힘은 총 5건의 논평을 냈습니다. △정부여당과 의료계의 극적 합의에 대한 내용 2건 △뉴딜 펀드에 대한 비판 1건 △재판장에서 증언 거부에 나선 조국 전 법무부 장관에 대한 비판 1건 △사회적 거리 두기 '2.5단계' 연장에 대한 내용 1건 등 이었습니다.  관련기사 안철수, 국민의힘 행사 강연자로…연대론 불붙나4차 추경 9조원 안팎…소상공인 선별 지원 위법 기업에 매출 10% 벌금 매기자는 與 신동근 ""안철수, 점점 홍준표 닮아간다…'꼴보수' 가까워져""민주당 출신 성비위에 입 연 양향자…""성의식 대개조 필요""문 대통령 지지도 소폭하락…'국민의힘' 개명효과는 ""아직""최대집, 전공의 반발 움직임에 ""더 이상 집단행동 안 된다""국민의힘 찾는 안철수…""야권 혁신에 대해 논의""이재명 ""안철수, 본인이 '패륜'…초심으로 돌아가달라""고민정 ""文 SNS 논란, 정부와 의료진 갈라치는 모습 불편""  국민의힘은 정부여당과 의협 간 합의에 환영의 메시지를 냈습니다. 아울러 공공의대 등 4대 정책에 대한 검증에 나설 것이라고 밝혔는데요. 다음은 국민의힘의 논평입니다.김은혜 국민의힘 대변인 : 진료 현장으로의 복귀를 결정한 의료진분들은 물론, 정부와 의료진 사이에서 조정을 위해 애써주신 모든 분들께 국민을 대신해 감사의 말씀을 드린다. 위기 때 더 뭉쳤던 우리 국민의 저력 그대로 이제 코로나 19 위기극복에 한층 힘을 모을 수 있게 돼 정말 다행이라고 생각한다.다만, 코로나19라는 중차대한 시기에 의료진을 자극한 정부의 밀어붙이기식 정책추진, 되레 정부가 사회적 갈등을 부추긴 데에 대해서는 같은 잘못이 되풀이되지 않도록 복기하고 개선이 되어야 한다. 국민의힘은 정기국회 과정에서 의료계 파업의 원인이 된 공공의대 의대 증원 등 4대 정책에 대해 면밀히 검토하고, 철저히 검증할 계획이다.반복되는 폭염과 호우 속에서도 코로나19와 사투를 벌이고 있는 의사와 간호사, 자원봉사자 및 구급대원께 다시 한번 노고에 대한 위로와 감사의 말씀을 전한다. 한 분 한 분, 모두가 소중한 국민이다. 코로나는 그런 '우리'의 힘으로 극복될 것이다. 국민의힘도 더 노력하겠다.지난 4월12일 경기도 안양시 안양중앙공원에서 제21대 국회의원선거 안양동안을에 출마한 정의당 추혜선 후보가 지지를 호소하고 있다. /사진=연합뉴스 드디어 추혜선 LGU+행에 비판 성명 낸 정의당정의당은 총 2건의 논평을 냈습니다. △정부여당과 의료계의 극적 합의에 대한 내용 1건 △추혜선 전 정의당 의원의 LGU+행에 대한 내용 1건 등이었습니다. 추혜선 전 의원의 행보에 정의당 지도부는 아무런 입장을 내지 않았었는데요. 최근 당대표 출마를 선언한 박창진 갑질근절특별위원장 정도만이 비판의 목소리를 냈습니다. 다음은 정의당의 논평입니다.조혜민 정의당 대변인 : 지난 3일 오전, 정의당 상무위원회는 추혜선 전 의원이 최근 LG유플러스 자문을 맡은 것과 관련해 정의당이 견지해온 원칙에 어긋난다고 판단하였습니다. 지난 20대 국회에서 정무위원회 소속 의원으로 활동했던 추 전 의원이 국회의원 임기 종료 후, 피감기관에 취업하는 것은 재벌기업을 감시해왔던 정의당 의원으로서의 신뢰를 저버리는 행위라 보았기 때문입니다. 이에 지난 3일 오후, 정의당은 추혜선 전 의원에게 LGU+ 자문 취임을 철회해줄 것을 공식적으로 요청하였으며, 현재 답변을 기다리고 있습니다. 이 일로 인해 여러 우려를 보내주신 당원 및 시민 여러분들께 죄송하다는 말씀을 전하며, 정의당은 진보 정치의 가치를 훼손하지 않고 정의당다운 길을 갈 수 있도록 보다 노력하겠습니다.박능후 보건복지부 장관(왼쪽)과 최대집 대한의사협회장이 지난 4일 서울 종로구 정부서울청사에서 집단휴진을 중단하고 의대정원 확대 등의 의료정책을 협의하는 의정협의체를 구성하는 내용의 합의문 서명식에 참석하고 있다. /사진=신경훈 기자 khshin@hankyung.com 국민의당 ""4대 의료정책 원점 재논의 환영""국민의당도 총 2건의 논평을 냈습니다. △부동산 거래분석원에 대한 비판 내용 1건 △정부여당과 의료계의 극적 합의에 대한 내용 1건 등이었습니다. 의사 출신 안철수 대표가 이끄는 국민의당은 의료계 집단휴진에 대해 적극적으로 목소리를 내왔는데요. 다음은 국민의당의 논평입니다.안혜진 국민의당 대변인 : 의료계가 약 보름간 이어온 집단휴진 사태를 마무리 짓고 의료현장에 복귀하기로 했다. 정부 여당과 의료계가 밤샘 협상 끝에 오늘 공공의료 확충 정책과 관련한 5개 조항에 최종합의를 도출한 것이다. 의료진의 현장 복귀를 진심으로 환영하고 다소 늦었으나 협상을 위한 정부 관계자의 노력에 감사드린다.특히 문제가 되었던 4대 의료정책은 모든 가능성을 열어놓고 원점에서 재논의하기로 하고, 집권 여당과 정부는 물론, 이해당사자인 의료계가 직접 참여하는 공동 협의체를 구성하여 논의를 하기로 했다니 천만다행이다. 힘들게 도출시킨 합의안인 만큼, 의료계뿐만 아니라 국민 전체가 불안해하고 크게 우려했던 초유의 사태가 두 번 다시 발생하지 않도록 정부는 성실히 이행하여 향후 보다 현실적이고 실효성이 높은 공공의료 정책 마련에 힘써주길 바란다.이번 갈등을 해결함에 있어서 하심의 마음으로 결단을 내린 정부 관계자와 다시금 숨 가쁘게 돌아가고 있을 의료현장에 복귀한 의료진 모두에게 다시 한번 감사의 마음을 전한다.조준혁 한경닷컴 기자 presscho@hankyung.com"
3,한국경제TV,"與 ""의료정책 원점 재검토""…의사파업 돌파구 여나","< 어느 마스크를 쓰시겠습니까? > 서울시가 마스크 착용을 의무화하는 행정명령을 내린 가운데 1일 중구 서울도서관 외벽에 이를 알리는 대형 현수막이 걸려 있다. 마스크를 쓰지 않으면 코로나19에 감염돼 중태에 빠질 수 있다는 섬뜩한 내용이 담겼다.  허문찬 기자 sweat@hankyung.com                         의대 정원 확대, 공공의대 설립 등 의료정책을 놓고 의견차를 좁히지 못하고 있는 정부와 의료계 사이에 여당이 나서 ‘원점 재검토’를 시사했다. 전공의들이 주도하고 있는 의사 파업에 돌파구를 마련할지 관심을 모으고 있다. 한정애 더불어민주당 정책위원회 의장과 최대집 대한의사협회 회장은 1일 저녁 국회에서 만나 의사 집단 파업에 관해 의견을 나눴다. 한 시간가량 대화를 한 한 정책위의장은 “의료 현안 중 입법과 행정의 영역을 분리해 입법 과정에 있는 것이 가장 문제가 되는 만큼 우리가 완전하게 제로 상태에서 논의할 수 있다는 점을 최 회장에게 전달했다”며 “최 회장이 의협 소속 여러 단체와 논의한 다음 우리에게 다시 의견을 제안하기로 했다”고 말했다.최 회장은 “공공의대 설립, 첩약 급여화, 비대면 진료 등 여러 문제의 층위가 복잡하다”며 “정부와 풀 문제도 있고 핵심적으로 중요한 부분은 여당과 풀어야 해 비공개로 만났다”고 설명했다. 그는 “의대 정원 확대, 지역 의사제, 공공의대 신설 등 법안이 발의돼 있는데, 이에 대한 철회와 원점 재검토를 두고 서로 얼마만큼 진정성을 갖고 전향적으로 이야기할 수 있을지 많은 대화를 했다”면서도 “오늘 대화에서 의견 일치에 이른 것은 없으며 의견을 충분히 나눴다”고 덧붙였다.  관련기사 '물백신' 접종자 407명…하루 만에 83명 늘어와이브레인, 우울증 치료 전자약 임상 3상 마쳐""지방간·간염증·간섬유화 등 개선…혁신 신약 기대"" 최대집 의협 회장직 유지…""국시 재응시 기회 만들 것""[종합][속보] '독단적 합의 논란' 최대집 의협 회장직 지켰다…불신임안 '부결'""정부·여당과 독단적으로 합의""…최대집 의협회장 탄핵될까한명도 없다더니…전주서만 '물백신' 179명 접종수련병원협 ""후배들 국시 기회 달라…국민께 간곡히 호소""최대집 '후배 구하기'…""의대생들 국시 응시 협조해달라""바이젠셀, 급성골수성 백혈병 치료 물질 국내 임상 1상 승인  대한전공의협의회 비상대책위원회는 이날 첫 기자회견을 열어 “정부가 의료정책을 먼저 철회한 뒤 원점에서 재논의하겠다는 것을 명문화하면 즉시 의료현장에 복귀하겠다”며 강경한 태도를 보였다. 그러나 정부 접촉 창구는 의협이 주도하는 ‘범의료계 투쟁위’로 하기로 한 만큼 의료계 내부 회의 결과에 따라 파업 중단 여부가 결정될 것이라는 전망이 나온다. 중재자로 나선 與 ""특위 꾸려 논의""…전공의 수용할지 주목한정애 더불어민주당 정책위원회 의장과 최대집 대한의사협회 회장의 1일 긴급 회동은 새 민주당 지도부의 의지가 작용했다. 이낙연 민주당 대표는 한 정책위의장에게 “여당 정책위의장으로서 의료계 채널을 가동해 대화로 문제를 해결해보라”고 주문한 것으로 전해졌다. 그동안 여당은 문제 해결을 촉구하는 의료계 요구에 대해 주무부처인 보건복지부가 처리해야 한다는 방침을 고수했다. 그러나 새 지도부가 꾸려지면서 대화를 통해 문제를 해결하겠다는 의지가 반영된 것으로 풀이된다. 회동에 참석한 신현영 민주당 의원은 “여당과 의료계 모두 이번주가 문제 해결의 분수령이라는 것을 잘 알고 있다”며 “의료 정책과 관련해 입법 부분이 핵심인 만큼 여당이 중재 역할을 적극적으로 하기로 한 것”이라고 설명했다. 전공의들 ‘원점 재검토’ 명문화 요구                            여당과 의협 지도부 간 회동에서 여당이 ‘원점 재검토’를 시사한 만큼 의료계 파업이 해결의 급물살을 탈 가능성도 높아졌다. 그러나 의료계 파업을 주도하는 것은 전공의들이기 때문에 이들이 어떤 선택을 하느냐에 달려 있다는 분석이 나온다.박지현 대한전공의협의회 비상대책위원장은 이날 서울 당산동 서울시의사회관에서 젊은의사 비대위 출범 기자회견을 열었다. 젊은의사 비대위원장을 겸직하는 박 위원장은 “의대 정원 확대, 공공의대 설립, 첩약 급여화 등은 의료 전문가와의 합의 없이 졸속 추진됐기 때문에 철회해야 한다”며 “이를 문서로 약속한다면 의료 현장에 복귀할 것”이라고 말했다.전공의들은 지난달 23일 정세균 국무총리와의 면담에서 신종 코로나바이러스 감염증(코로나19) 진료에 참여하기로 한발 물러서면서 협상 타결 가능성을 내비쳤다. 그러나 복지부가 업무개시명령을 발동하고 전공의 10명을 경찰에 고발하면서 분위기가 급변했다. 지난달 30일 파업 철회를 대의원회의 표결에 부쳤으나 압도적인 표 차이로 파업을 계속하는 것으로 결론 났다. 전공의들 사이에서 정부를 믿지 못하겠다는 분위기가 형성되면서다. 이에 전공의들은 의료정책을 원점에서 재논의하겠다는 약속을 문서화해 달라고 정부에 요구해왔다.한 정책위의장과 최 회장이 긍정적인 분위기에서 대화를 나눴다 하더라도 전공의들이 요구하는 문서화된 합의는 이뤄지지 않았기 때문에 젊은의사 비대위가 어떻게 받아들일지도 미지수다. 한 정책위의장은 최 회장에 이어 박 비대위원장을 만나 이번 파업에 대해 논의했으나 특별한 합의안은 나오지 않았다. 與, 정부·의료계 사이 중재자로여당이 의료계와의 대화에 직접적으로 나선 것은 법과 원칙을 강조한 정부가 먼저 물러나는 것은 모양새가 좋지 않다고 판단했을 가능성이 높다. 정치권에선 국회가 특별위원회 등의 별도 기구를 설립해 의료계와 해결 방안을 찾을 것이라는 전망이 나오고 있다.복지부는 이날 전공의 집단휴진 현장조사에 나서지 않았다. 이어 근무 내용이 확인된 전공의 및 전임의 4명에 대한 고발을 취하했다고 밝혔다. 이를 두고 일각에선 전공의와의 대화를 이어가기 위한 유화 제스처가 아니냐는 해석이 나온다. 정 총리도 이날 “정부는 단 한 명의 의료인도 처벌받는 것을 원하지 않는다”며 “협의체를 구성해 정부안보다 더 나은 안을 함께 만들어보자는 것이 정부 방침”이라고 말했다.여당이 전향적 태도를 보이면서 그동안 의료계 요구를 수용하지 않았던 정부가 방침을 바꿀지도 관심이 모아진다. 윤태호 중앙사고수습본부 방역총괄반장(복지부 공공의료정책관)은 이날 브리핑에서 “한방 첩약 급여화 시범 사업은 국민건강보험법에서 정한 최고의결기구인 건강보험정책심의위원회에서 8개월 이상 논의한 사안”이라며 “이를 정부가 철회하라는 것은 관련법 위반을 요구하는 것”이라고 반박했다. 공공의대 설립에 대해선 “국회가 법률을 제정해야만 정책 추진이 가능하고 아직 정해진 것은 없다”고 선을 그었다.박상익/김소현 기자 dirn@hankyung.com"
4,한국경제TV,"[속보] ""의사 외 의료정책 이해당사자의 의견도 폭넓게 청취""","                        한경닷컴 뉴스룸 open@hankyung.com 관련기사 [속보] ""의대생 국가고시 시행 준비 중…재신청 기한 조정 가능""[속보] 비수도권 유초중 등교인원 1/3 제한, 20일까지 연장…고교는 2/3[속보] '고3 제외' 수도권 유초중고 전면 원격 수업 20일까지 연장 [속보] 중대본 ""의료계·학계·환자·시민단체 의견 귀 기울이겠다""[속보] 중대본 ""의료계와 합심해 코로나 극복하고 의료 청사진 희망""[속보] ""수도권 2.5단계, 환자 감당가능 수준 감소하면 하향 조정""[속보] 전국 사회적 거리두기 2단계 20일까지 2주간 연장[속보] 중대본 ""직업훈련기관도 추가로 집합금지""[속보] 박능후 ""최근 2주 발생 환자 중 감염 경로 불분명 20% 넘어""[속보] 수도권 사회적 거리두기 2.5단계 13일까지 연장  "
