,Press,Title,Text
35,한겨례,"스마트폰 블랙박스로, 사생활 보호 ‘코로나 방역시스템’ 개발","‘스마트폰 블랙박스’는 항공기 블랙박스처럼  스마트폰의 다양한 센서를 통해 이동 경로를 기록한다. ‘스마트폰 블랙박스’는 항공기 블랙박스를 본따, 한 교수팀이 만들어낸 개념이자, 이번 개발 시스템의 핵심이다.  카이스트 제공.  사생활 침해 우려를 해소한 코로나19 확산방지 기술이 국내 연구진에 의해 개발됐다.  한국과학기술원(카이스트)은 10일 이 대학 한동수 교수(전산학부 지능형서비스통합연구실) 연구진이 ‘스마트폰 블랙박스’를 기반으로 한 ‘코로나19 감염병 확산방지 시스템(웹, 앱)’을 개발했다고 밝혔다.  이 시스템은 스마트폰에 내장된 위성항법장치(GPS), 와이파이, 블루투스, 관성 센서(가속도센서, 자이로스코프) 등을 통해서 수집한 신호를 보관하는 ‘블랙박스’의 정보를 활용하는 게 특징이다. ‘스마트폰 블랙박스’는 항공기 블랙박스를 본따, 한 교수팀이 만들어낸 개념이자, 이번 개발 시스템의 핵심이다. 현재의 격리자 관리, 확진자 역학조사 시스템은 대상자의 진술과 신용카드 사용내역, 휴대전화 위치정보, CCTV 정보를 기반으로 이동경로를 추적하고 일부 정보를 공개해왔는데 광범한 정보 접근과 공개로 인한 사생활 침해 논란을 빚어왔다. 이는 또한 프라이버시보호에 민감한 유럽 각국이 한국의 방역시스템을 폄하하거나 도입하지 않는 명분이 되기도 했다.  한 교수 연구진이 개발한 스마트폰 블랙박스 기반의 방역정보 시스템은 기존 시스템에 비해 정확도가 높고 문자가 아닌 신호정보로 데이터가 처리되기 때문에 확진자의 사생활이 보호되고 각종 관련기관이 이용하기 편리하다. 또한 개인 스마트폰 블랙박스에 저장된 기록은 외부로 유출되지 않으며, 2주뒤 자동폐기 된다.스마트폰 블랙박스를 활용해 개발된 3종 시스템. 확진자 역학조사 시스템, 바이러스 노출체크 시스템,  격리자 관리 시스템. 카이스트 제공.   `코로나19 감염병 확산방지시스템'은 일반인을 위한 `감염원 노출 자가진단 시스템', 관리기관을 위한 `확진자 역학조사 시스템'과 `격리자 관리 시스템'으로 이뤄져 있다. 이 시스템엔 카이스트가 개발해온 실내 위치 인식시스템(KAILOS) 기능도 적용해 실내지도와 신호지도가 준비된 건물에서는 건물 내부에서도 확진자의 동선을 확인할 수 있다. 한동수 교수는 ""30여 종의 스마트폰 별로 센서가 다양해 기종별 테스트작업을 진행하고 있어 곧 시스템을 출시할 계획ˮ이라고 말했다. 카이스트 신성철 총장도 “이 시스템을 활용하면 방역 종사자들의 수고와 시간을 획기적으로 줄일 수 있고 사생활 침해 논란 없이 신속하고 정확한 역학조사가 가능해져 K-방역의 우수성을 국외에 과시하는 계기가 될 것ˮ이라고 말했다.  메르스 이후 개선된 국내의 감염병 방역시스템은 신용카드 정보, 휴대전화 위치정보 등 개인정보를 활용한 광범한 역학조사와 정보공개를 가능하게 해, 진단키트의 조기개발 등과 함께 ‘케이(K)방역’의 성과로 거론됐지만 사생활 침해 논란도 끊이지 않았다. 정부와 지자체는 지나치게 상세한 확진자 정보공개로 사생활 침해 문제가 생기자 나중에 지침을 개정해 대상자의 거주지와 불필요한 방문지 공개 등을 하기 않기로 바꾼 바 있다. 한편, 방송통신위원회는 10일 포털과 소셜미디어에 노출되고 있는 공개기한 지난 확진자 동선정보의 탐지‧삭제 업무를 강화해 2차피해를 막겠다는 정책을 발표했다. 잇따르고 있는 정보 삭제요청 창구도 한국인터넷진흥원(키사)으로 일원화하기로 했다.구본권 선임기자 starry9@hani.co.kr"
36,한겨례,코로나19 의료·방역 인력 절반 “근무지 감염 불안”,"11일 오후 서울 양천구 보건소 선별진료소에서 의료진이 얼음팩과 선풍기로 더위를 식히고 있다. 박종식 기자 anaki@hani.co.kr  코로나19 대응에 투입된 의료·방역 인력의 절반 이상이 “현 근무지가 감염으로부터 안전하지 않다”고 느끼는 것으로 나타났다. 또 10명 중에 6명 꼴로 코로나19 업무로 인한 ‘정서적 고갈’(번아웃)을 느끼고 있었다. 경기도 공공보건의료지원단과 서울대학교 보건대학원 유명순 교수팀은 11일 ‘1차 경기도 코로나19 의료·방역 대응팀 인식 조사’ 결과를 발표했다. 코로나 대응 인력의 안전·건강 상태를 파악하기 위한 조사는 이번이 처음이다. 지난달 18일부터 31일까지 이뤄진 조사에는 간호사(58.9%), 보건소 공무원(23.5%), 의사·보건직 등 간호사 외 의료진(13.7%) 등 1112명이 참여했다.  조사 결과 대응 인력의 50.1%가 ‘현 근무지가 안전하지 않다’고 답했다. 조사 대상 중 43.8%는 ‘감염 가능성이 크다’고도 보고 있었는데, 이는 비슷한 시기(지난달 18∼26일) 경기도 일반인 2589명을 대상으로 한 조사에서의 응답률(12.4%)보다 3.5배 높은 것이다. 선별진료소 검체 채취 인력이나 역학조사관 등 접촉·확진자 최초 대응인력의 체감 안전도(4점 척도 질문에 대답 평균 2.38)가 의료기관(민간 2.45, 공공 2.56)보다 낮다는 점도 파악됐다. 이는 “시설을 갖추고 훈련을 숙지한 의료기관 인력에 견줘 초기 현장 대응 인력들이 통제 불가 환경에 노출될 가능성이 크고 시간의 압박을 받기 때문”이라고 유 교수는 해석했다. 스트레스도 상당했다. 응답자의 16.3%가 ‘즉각 도움이 필요한 고도의 스트레스 상태’였고, 그보단 덜하지만 ‘재모니터링이 필요하다’고 판단된 경우가 73%에 달했다. 스트레스 유발 요인은 육체적 피로(45.3%), 민원 대응(44.4%), 경제적 보상 부재(41.4%) 순서로 꼽혔다.  응답자의 60% 이상은 정서적 고갈을 호소했다. 정서적 고갈(감정적 소진·번아웃) 정도를 묻는 7점(0∼6점) 척도의 9개 문항에서 ‘나는 너무 열심히 일하고 느낀다’에 대한 평균 점수가 4.2로 가장 높게 측정됐다. ‘하루의 일과가 끝날 때면 녹초가 된다’는 평균 4.1이었고 ‘아침에 오늘도 일을 나가야 한다는 생각을 하면 기운이 빠진다’는 3.82였다. 그밖에 ‘일 때문에 정신적으로 지쳐 있다고 느낀다’ ‘일 때문에 완전히 기진맥진한 상태에 있다고 느껴진다’ 등 모두 9개 문항에 대한 평균 점수는 3.41이었다. 유 교수팀은 관련 선행연구를 바탕으로 한 사람이 9개 문항에 매긴 점수를 합쳐 27을 넘어서면 ‘정서적 고갈이 있다’고 전제하고 분석하니, 응답자의 62.9%가 코로나19 업무로 인한 정서적 고갈 상태를 보였다고 설명했다. 그런데도 코로나19 대응 인력들은 높은 수준의 업무 지속 의지와 책임 의식을 보였다. 83.4%가 ‘코로나19가 계속되는 한 주어진 일을 계속하겠다’고 답했고, 77%가 ‘코로나19가 아무리 심각해도 맡은 일을 할 것’이라고 답했다. 유 교수는 “방역·의료 대응팀을 위해 정부 지원은 물론이고 사회적 연대감이 발휘될 때”라고 짚었다. 최하얀 기자 chy@hani.co.kr경기도 공공보건의료지원단과 서울대학교 보건대학원 유명순 교수팀이 공동으로 한 ‘1차 경기도 코로나19 의료·방역 대응팀 인식 조사’ 결과 중 하나. 간호사, 보건소 공무원, 의사·보건직 등 의료진 등 조사 대상 1112에게 동료에게 하고 싶은 말을 묻자 참여자(643명) ‘힘내’ ‘파이팅’ ‘모두’란 단어가 많이 쓰인 문장을 적어냈다. 자료 : 서울대 보건대학원"
37,한겨례,"부산시의회, 임시회 회기 대폭 단축…코로나19 방역 집중","전반기 부산시의회 본회의 모습. 부산시의회 제공부산시의회가 코로나19 재확산 대응에 온 힘을 기울이고 있는 부산시와 부산시교육청에 행정적 부담을 덜어주기 위해 임시회를 단축한다.부산시의회는 31일 “부산시와 부산시교육청이 강화된 사회적 거리두기 2단계 조처에 따라 방역에 집중할 수 있도록 하기 위해 290회 임시회를 애초 9월1~11일에서 9월8~11일로 줄인다”고 밝혔다. 임시회가 11일에서 4일로 축소됨에 따라 부산시의회는 부산시교육청의 3회 추가경정예산안과 행정사무감사 계획서 작성 등 긴급한 안건만 상정해 처리하고 조례안과 동의안 처리는 최소화할 방침이다. 또 5분 자유발언은 생략하거나 전자회의시스템을 활용해 공지·전달하기로 했다.부산시의회는 임시회 기간 강화된 방역지침도 마련했다. 각 상임위원회 회의실에 비말차단용 가림막을 설치하고 회의에 참석하는 의원과 집행부 전원이 마스크를 쓰고 질의·응답하도록 했다. 본회의장과 각 위원회 사무실에선 소독, 발열 체크, 손소독제 사용 등 코로나19 방역지침을 준수할 방침이다.신상해 부산시의회 의장은 “감염경로를 알 수 없는 확진 사례가 전국에서 발생하고 있고 부산도 현재 상황을 통제하지 못한다면 폭발적 확산으로 이어질 수 있는 중대한 고비인 만큼 지금은 전 행정력을 집중해 코로나19 재확산에 대응해야 할 때다”고 말했다.김광수 기자 kskim@hani.co.kr"
38,한겨례,제주 관광객 점차 증가…코로나19 방역 비상,"제주도에 관광객들이 늘면서 방역당국의 우려가 깊어지고 있다. 사진은 지난 4월28일 제주공항에 등장한 마스크를 쓴 돌하르방 모습. 제주도 제공코로나19로 크게 줄었던 제주 관광객이 점차 늘고 있다. 제주지역 관광업계는 반색하고 있지만 방역 당국은 비상이다.24일 제주도관광협회의 입도 통계를 보면, 지난 19일 3만6643명, 20일 3만5560명, 21일 3만5552명의 내국인 관광객이 제주도를 찾아 지난해 같은 기간에 견줘 90% 정도의 회복세를 보였다. 지난 2~4월 하루 평균 1만4천~1만6천여명 정도의 관광객이 제주를 찾은 것과 견주면 갑절 이상 늘어난 셈이다.도 관광협회가 집계한 24~30일 일주일 동안 업계 예약률을 보면 △호텔 62.6% △콘도 52.7% △렌터카 57.9% △전세버스 29.3% △골프장 61.8%로, 제주지역 관광시장이 점차 회복세를 보여줬다. 관광협회는 올해 여름 휴가철에 하루 평균 4만여 명의 관광객이 제주를 찾을 것으로 내다봤다. 외국으로 나가려던 내국인 관광객들이 제주도로 발길을 돌리고 있기 때문이다.제주지역 관광이 조금씩 회복세를 보이는 반면 방역당국의 고민은 깊어지고 있다. 도는 코로나19 여파로 문을 닫았던 도내 공공시설과 공영 관광지 등에 대해 지난 18일부터 시범 개방했다. 도는 방역을 철저히 하도록 하는 한편 관광객들에게도 거리두기 등 방역수칙을 지키도록 권고하고 있지만 제대로 지켜질지 의문이다.도는 “사설 관광지와 맛집 등에 하루에 한 번 이상 소독과 환기, 거리두기 등의 지침을 내렸다. 여행 중 발열·기침 등 의심 증상을 느껴 신고하면 검사·격리에 지원을 하겠지만 증상을 숨겼다가 확진 판정 받을 경우 소송 제기 등 책임을 묻겠다”고 밝혔다.허호준 기자 hojoon@hani.co.kr"
39,한겨례,미국 의회·해외 언론 “한국은 코로나19 방역 롤모델”,"12일 미국 뉴욕의 소매판매점 ‘트레이더 조’ 매장 내부가 어수선한 풍경을 보이는 가운데 한 남성이 진열대 선반 앞에 서 있다. 코로나19 불안이 점점 커지면서 뉴욕 시민들 사이에 생필품을 미리 서둘러 사 놓으려는 풍경이 연출되고 있다. 뉴욕/AP 연합뉴스  한국의 코로나19 검사 등 방역은 다른 나라의 ‘롤모델’이며, 글로벌 방역을 위한 관건이 될 것이라는 평가가 미국 정부와 외신에서 나오고 있다. 미 하원 정부감독개혁위원회가 코로나19 사태와 관련해 지난 11일 개최한 청문회에서 민주당 소속의 캐럴린 멀로니 위원장은 한국의 광범위한 빠른 검사 속도, 드라이브 스루 등 효율적인 검사체계 등을 지적하며 “한국은 하루에 1만5천명을 검사할 수 있다”며 “나는 정말 한국에 가서 이동식 검사소에서 검사받고 싶다”고 질병통제예방센터(CDC)를 추궁했다. 짐 쿠퍼 민주당 의원은 “그런 검사 장비를 한국에서 도입할 수 있는지”도 따져 물었다. 라자 크리슈나무시 의원은 코로나19 검사가 “한국은 인구 100만명당 4천명, 미국은 15명”이라며 “한국은 미국보다 300배나 공격적이다. 미국은 언제쯤 거기에 도달할 수 있나?”고 추궁했다. 마이크 펜스 부통령도 12일 <엔비시>(NBC)와의 회견에서 ‘미국이 한국의 검사 수에 못 미치는 이유가 뭐냐’는 질문에 ‘미국이 검사 문제를 해결하기 위해 노력해 왔고 진전을 보인다’며 얼버무렸다.  영국 <비비시>(BBC) 방송은 미국 조야에서 평가받고 있는 한국의 코로나19 방역이 다른 나라의 ‘롤모델’이라고 평가했다. <비비시> 방송은 12일 한국의 코로나19 이동검사소(드라이브 스루) 및 검사키트 제조 현장을 전하는 기사에서 “다른 나라들이 코로나바이러스 확산과 싸우는 상황에서 많은 사람을 검사하는 능력은 한국을 롤모델로 만들고 있다”고 평가했다. <비비시>는 “한국에서는 매일 거의 2만명이 검사를 받고 있어 세계 어떤 나라보다도 전체 인구 당 가장 높은 검사율을 보인다”며 “코로나바이러스 사망률도 0.7%로, 세계보건기구가 보고한 세계 평균 사망률의 3.4%보다 훨씬 낮다”고 전했다.  미국 등 다른 선진국에 비해 한국에서는 검사 키트가 부족하지 않고, 4개 회사가 이를 양산하며 일주일에 14만개의 코로나19 샘플을 확보한다고 평가했다. 특히, 한국의 검사 정확도는 98%로 가장 정확하다고 덧붙였다. <비비시>는 한국은 대량으로 확보한 검사 샘플 등으로 어떤 나라보다도 빠르게 백신 개발에 접근하고 있다고 소개하기도 했다. 한국이 이렇게 모범적인 방역을 펼치는 것은 지난 2015년 메르스 사태 때의 시행착오 등에 대한 반성에서 나온 것이라고도 비비시는 전했다.  <워싱턴 포스트>의 칼럼니스트 조시 로긴은 11일 ‘한국의 민주주의가 코로나바이러스에 이길 수 있다는 것을 보여준다’는 글을 게재했다. 이 글은 “민주주의가 공공의 보건을 유지하는 데 훨씬 적합하다”며 “바로 한국이 그것을 보여주고 있다”고 평가했다. 로긴은 “한국은 중국과 달리 수백만 인구를 억지로 집에 가두고 약자들을 노예 취급하며 정부의 조치를 비판하는 사람을 없애버리는 방법을 선택하지 않았다”며 “시민사회가 자발적으로 동참했고 정부는 확진자가 다수 발생한 도시인 대구를 감옥으로 만드는 대신 시민들을 대구에 가지 않도록 설득했다”고 설명했다. 한국의 방역이 시민들의 희생 없이 성공하고 있다는 것이다.  <로이터> 통신도 중국 다음으로 코로나19가 널리 퍼진 이탈리아와 한국이 다른 대응 방식을 택해 다른 결과를 얻고 있다는 분석 기사를 통해, 한국의 방역 대책이 다른 나라에 좋은 참고가 된다고 보도했다. 이탈리아는 광범위한 검사를 하다가 유증상 의심자로 검사 대상을 좁히는 한편 발병 지역을 폐쇄하는 쪽으로 움직였다. 반면 한국은 바이러스 검사를 전방위로 확대하는 정면 대응 방식을 택해, 이탈리아보다 호전된 상황으로 가고 있다고 <로이터>는 평가했다.  <로이터>는 한국은 압도적인 규모의 검사로 감염자를 조기에 발견해 적극적으로 대처할 수 있었다며 ‘공격적이고, 지속적인 검사가 바이러스와 싸우는 가장 강력한 수단’이라는 중요한 시사점을 제공했다고 전문가들을 인용해 전했다. 미국 '세계발전센터'의 제러미 코닌딕 선임연구원도 광범위한 검사를 통해 발병 규모를 더 잘 파악할 수 있다며 한국의 대응 방식을 높게 평가했다.정의길 선임기자 Egil@hani.co.kr"
40,한겨례,한국 코로나19 방역모델 국제사회와 적극 공유한다,"경기도 고양시의 차량이동 선별진료소. 고양/김정효 기자 hyopd@hani.co.kr정부가 성공 모델로 평가받는 국내 코로나19 대응 경험을 국제사회와 공유하기 위해 온라인 세미나를 연속 개최하기로 했다.정부는 27일 이태호 외교부 2차관 주재로 ‘코로나19 대응 국제 방역협력 총괄 태스크포스(TF)’ 1차 회의를 열어 운영계획안과 ‘K-방역’(한국의 방역모델) 웹세미나 시행 계획안을 협의했다. 외교부는 “개방성과 투명성, 민주성에 기반을 둔 한국의 방역 경험을 웹세미나, 영상회의, 정책자료 등을 통해 국제 사회와 적극 공유하기로 했다”고 밝혔다. 정부는 위기대응 전략에서부터 진단, 격리, 역학조사, 치료, 임상경험, 환자관리, 출입국관리 등 방역 정책 전반에 대한 주제별 웹세미나를 향후 3개월간 진행하기로 했다. 직접적인 방역뿐 아니라 경제, 교육, 선거 등 코로나19로 영향받은 관련 분야 정책도 소개한다.다음 달 4일 1차 웹세미나인 ‘보건 및 방역전략 총괄’을 시작으로 1∼2주 단위로 개최할 계획이다. 티에프에는 국무조정실, 기획재정부, 교육부, 외교부, 법무부 등 12개 부처와 한국보건산업진흥원, 국립중앙의료원 등 5개 기관이 참여한다. 정부는 향후 격주로 회의를 열어 진행 상황을 점검할 예정이다.김소연 기자 dandy@hani.co.kr"
41,한겨례,전세계 ‘코로나 방역’ 실패…보건취약국 ‘대폭발’ 우려,"27일 바티칸시티의 텅 빈 성 베드로 광장에서, 로마에 역병이 창궐하던 1552년 당시 로마 주변에 살던 시민들이 전염병을 멈추는 기적을 바라며 운반해온 것으로 알려진 십자가상(왼쪽)을 축으로 그 건너편에 프란치스코 교황(흰옷 차림)이 천막 아래서 ‘우르비 에트 오르비’(라틴어로 ‘로마 도시와 전 세계에’라는 뜻으로, 교황의 공식 축복과 강론)를 하고 있다. 바티칸/AP 연합뉴스지난해 12월1일 중국 우한에서 정체 모를 ‘폐렴’이 처음 발발한 지 꼭 4개월(12월31일 세계보건기구(WHO)에 발생을 공식 통보한 날짜로는 3개월)이 지났다. 80~100나노미터(nm·1천만분의 1센티미터)의 초미세 입자로 2만9800개의 유전자 염기서열로 구성돼 있는 코로나바이러스 감염자가 200개국에 걸쳐 발생한 가운데 전세계 인구의 3분의 1가량인 약 30억명이 도시 봉쇄와 자택 격리 상태에 있다. 바이러스 청정 국가를 찾아볼 수 없을 정도로 ‘글로벌 방역 대실패’로 판명된 현재, 세계인 66만명이 감염됐고 3만명이 사망했다. 건강을 회복한 사람도 13만명에 이르지만, 하루에만 7만명가량의 세계시민이 새로 감염되고 있다.<로이터> 통신이 각국 정부와 세계보건기구 통계를 기초로 집계한 것을 보면, 29일 현재 감염자는 세계 200개국에 걸쳐 총 66만2700명(사망 3만751명)이다. 실시간 세계인구자료를 제공하는 ‘월드오미터’에 따르면 29일 현재 전세계 인구는 약 77억7400만명이다. 즉 감염자는 0.008%다. 하지만 28일 하루에만 세계에서 신규 확진자가 6만8734명(사망 3417명) 발생했다. 통신은 “대다수 국가에서 감염자 진단이 응급치료를 요구하는 증세를 보이는 사람에게만 우선 이뤄지고 있다는 점을 고려할 때 실제 감염자는 이보다 훨씬 많을 공산이 크다”고 전했다. 각국의 잇단 육로·항공 봉쇄조처는 이제 별로 특이할 것 없는 ‘정상 상황’이 된 지 오래다. 파리·로마·마드리드·뉴욕 등지의 텅 빈 도심 거리도 익숙한 지구촌 풍경이 됐다. 전시체제를 방불케 할 정도로 군대가 도심 거리에 배치돼 ‘외출금지령’ 위반자들을 색출·검거하고 있다.특히 사망자의 3분의 2가 유럽인인데다 과거의 유행 전염병에 견줘 주요 선진·신흥 경제대국 중심으로 확산세가 뚜렷하다. 한국보다 감염자가 많은 나라는 미국·이탈리아·중국·스페인·독일(5만3340명)·이란(3만5408명)·프랑스(3만7575명)·영국(1만7천명)·스위스(1만3377명)·네덜란드(9762명) 등 10개국이다.대륙별로, 인구 7억4천만명 유럽이 글로벌 감염에서 절반 이상(35만1877명·인구 대비 0.04%·사망 2만1334명)을 차지한다. 실비오 브루사페로 이탈리아 국립보건고등연구소(ISS) 소장이 28일 “아직 (전염의) 정점에 이르지 못했다. 며칠 안에 정점에 도달할 것”이라고 내다봤으나, 감소 추세로 언제 돌아설지 아직 알 수 없는 상황이다. 인구 5억8천만명인 북미(미국 및 캐나다)가 12만981명(인구 대비 0.02%·사망 1950명), 인구 44억6천만명인 아시아는 10만3943명(0.002%·사망 3742명), 중동은 4만3414명(사망 2592명)에 이른다. 남미·중미 지역은 1만2315명(사망 242명), 아프리카 4103명(사망 128명), 오세아니아 4145명(사망 15명)이다. 유럽과 아시아를 잇는 터키도 7402명(사망 108명)으로 비상이 걸렸다. 사망자가 중국을 넘어선 나라는 이탈리아(9만2471명·사망 1만23명)와 스페인(7만2248명·사망 5690명)이다. 미국(11만5547명·사망 1891명)은 5일 만에(24일 4만1511명) 자그마치 3배가량 많아졌다. ‘팬데믹’ 지속 기간이나, ‘글로벌 정점’에 언제 도달할 것인지를 둘러싼 확산경로 전망은 지금 막 ‘대폭발 초기 국면’에 들어서 있는 40억명가량(인도 14억명, 아프리카 12억명, 남미 4억2천만명, 동남아 5억6천만명, 러시아 1억5천만명 등)이 남아 있어 예단을 불허한다. 전세계가 봄여름에 접어들면서 기후가 바이러스를 누그러뜨릴 ‘자연적 변수’로 등장할 것인지 촉각이 쏠리는 가운데 세계 인구 60% 이상이 집단감염돼 글로벌 면역·항체가 생길 시점까지 “오직 기다리는 일만 남았다”는 비관론도 서서히 대두한다. <아에프페>(AFP) 통신은 “아프리카·남미 등 보건에 취약한 저소득 지역·국가들에서 수백만명의 사망자가 나올 수 있다고 국제 구호기구들이 우려하고 있다”고 전했다. 조계완 기자 kyewan@hani.co.kr"
