,Press,Title,Text
43,한국경제TV,"의료 취약지역 응급실 의사들도 ""공공의대로 해결 안된다""","사진=연합뉴스                        ""의료 취약 지역에 부족한 의사는 응급상황에 심장수술을 하고 절단된 신체 조직을 연결하는 고도의 수련이 필요한 의료진이다. 공공의대 정책은 취약지 의사를 늘릴수는 있지만 고도의 의료기술이 필요한 의료진을 양성하는 데에는 한계가 있다.""목포 한국병원 등 전라남도 서부지역에 근무하는 응급실 의사들이 낸 성명이다. 김재혁 목포한국병원 의사 등 의료진들은 ""진료 현장을 끝까지 지키고 싶다""며 ""진료 현장에서 환자에게 최선을 다할 수 있도록 정부가 불합리한 의료 정책을 중지하고 의사들에 대한 탄압을 중단하라""고 촉구했다.이들은 열악한 의료 환경에서도 환자를 치료하는 닥터헬기에 타고 재난현장에 발벗고 뛰어 나가는 의사들이라고 자신들을 소개했다. 환자를 위해 희생하고 상태가 좋아지는 환자를 보며 같이 즐거워지는 의사들이라고도 했다. 이들은 ""누구보다 취약지 의료환경이 개선되길 바라는 의사들""이라며 ""올바르지 못한 의료정책이 미칠 악영향이 두렵다""고 했다.   관련기사 배현진 ""정부가 의사들 인질범 매도…공공의대 중단하라""안철수 ""공공의대 강행하면 '돌팔이 천지' 될 것""의사 국시 D-1…코로나·응시거부 속 그대로 진행될까 전공의 ""파업 지속""…의료 대란 불가피정부 ""의대정원 원점 재논의""에도…전공의 ""파업 지속""젊은 의사들, 파업 끝내 철회하지 않은 까닭은통합당 ""의사파업은 정부 때문…방역·경제 모두 놓쳐"" [종합]대구 '3월 악몽' 재연?…30명 중 29명 교회發 집단감염'의료 공백'에 분노한 환자들 ""파업참여 병원 불매""정부 고발 조치에 결국 '무기한 총파업' 카드 꺼내든 의협  취약지역에 더 많은 의사가 있으면 장점이 분명하지만 이들 의사는 생명을 살리는 의사가 돼야 한다고 했다. ""감기약 혈압약 등을 처방하는 1차 진료의사 역할은 개원의 공중보건의 등이 충분히 감당하고 있다""는 이유에서다.지금의 의료시스템 만으로는 중증환자를 잘 치료하는 의사를 의료 취약지로 유인하는 것이 어렵다고도 했다. 공공의대에서 배출된 인력의 근무지역을 제한하고 강제하더라도 중중 환자 의료 환경을 개선하는 데에는 한계가 있다는 것이다. 이 때문에 이들은 ""정부가 발표한 공공의대 정책을 만드는 과정에 의료 취약지역에서 실제 활동하는 의사들의 의견이 반영됐는지 의문이 들지 않을 수 없다""고 했다. 이들은 ""중증 환자에 대한 치료는 많은 수의 의사로 해결할 수 없다""며 ""소요되는 인력과 예산 등을 감안한다면 반드시 재고돼야 할 정책""이라고 했다.다음은 성명 전문저희는 대한민국에서 가장 의료가 취약한 지역 응급실에서 근무를 하고 있는 의사들입니다.진료실에서 환자와 마주하고 있어야 할 의사들이 진료실을 떠나고 있는 작금의 사태에 대해서 개탄스러움을 금할 수 없습니다. 또한 의사들의 파업으로 인하여 고통을 겪고 있는 지역주민들에게 진심으로 죄송한 마음을 표합니다.현재 정부가 발표한 공공의대 정책은 의료 취약지역을 보완하기 위해 발표한 정책입니다. 하지만 이러한 정책을 만드는 과정 중에서 의료 취약지역에서 실제로 활동하고 있는 의사들의 의견이 반영되었는지 의문이 들지 않을 수 없습니다.공공의대를 통해 취약지역에 의사를 늘리려는 의도에 대해서는 충분히 공감하나, 의료 취약지역에 부족한 것은 감기약, 혈압약, 당뇨약을 처방하는 일차 진료의사가 아닙니다. 이미 적지 않은 개원의, 공중보건의들이 이러한 역할은 충분히 감당하고 있습니다. 의료 취약지역에 부족한 것은 응급 상황에서 심장 수술을 하고, 막힌 혈관을 뚫고, 절단된 신체 조직을 연결하는 고도의 수련이 필요한 의료진들입니다.공공의대 정책은 취약지역에 의사들의 숫자는 늘릴 수 있으나, 고도의 의료기술이 필요한 의료진을 양성하는데에는 분명한 한계가 있을 수 밖에 없습니다. 또한 고난이도의 수술과 시술 등을 시행하기위해서는 환자에 대한 책임이 뒤따를 수 밖에 없는데, 이러한 책임을 감수하고서 환자들에게 의료행위를 하기위해서는 고귀한 사명감과 선의가 동반되어야만 할 수 있는 일입니다.그러나 이러한 사명감과 선의만으로 중증의 환자들을 치료하는 것이 쉽지 않은 것이 우리의 의료시스템입니다. 현재의 의료시스템상으로는 중증 환자를 잘 치료할 수 있는 의사들을 의료 취약지로 유인하는 것이 어렵습니다. 설령 공공의대를 통해서 사명감과 선의를 충분히 교육받은 학생들이 배출된다하더라도, 그들이 의료취약지에서 중증 환자를 진료하기 위해서는 현재의 의료시스템상 한계가 있는 상태입니다.취약지역에 더욱 많은 수의 의사들이 있으면 장점이 분명 있습니다. 그러나, 의료는 편안함을 제공하는 것보다는 죽어가는 사람을 살리는 것에 무게 중심을 두어야 합니다. 중증환자에 대한 치료는 많은 수의 의사로 해결할 수 없습니다. 근무 지역을 설정하고 진료를 강제한다고 한들, 중증 환자에 대한 의료 환경이 개선되는 것은 한계가 명확합니다. 거기에 소요되는 인력과 예산 등을 감안한다면, 이는 반드시 재고되어야 할 정책임에 틀림없다고 현장에서 근무하고 있는 저희들은 주장합니다.저희 전남 서부지역 응급실 의사들은 열악한 의료 환경에서도 환자에 대한 최우선의 가치를 두고 닥터헬기를 탑승하고, 재난현장에 발벗고 뛰어나가고 있으며, 응급실 진료에 최선을 다해오고 있습니다. 환자를 위해 희생하고, 상태가 좋아지는 환자들을 보며 같이 즐거워지는 것이 저희 의사들입니다. 우리는 누구보다 의료 취약지의 현실을 잘 알고 있는 의사들입니다.우리는 누구보다 취약지의 의료환경이 개선되길 바라는 의사들입니다. 허나 올바르지 못한 의료정책이 미칠 악영향이 두렵습니다. 우리는 진료 현장을 끝까지 지키고 싶습니다. 우리가 진료 현장에서 환자에게 최선을 다할 수 있도록 정부는 불합리한 의료 정책을 중지하고, 의사들에 대한 탄압을 중단하기를 촉구하는 바입니다.전남 서부지역 응급실 의사회목포한국병원 김재혁, 목포한국병원 장병학, 목포한국병원 노종갑, 해남종합병원 김동현, 목포한국병원 김형주, 목포한국병원 김우형, 목포한국병원 노성종, 목포한국병원 김성준, 목포한국병원 정종현, 강진의료원 정금철, 목포한국병원 박준홍, 무안종합병원 윤대흥, 목포한국병원 민병철, 목포한국병원 한조은, 무안종합병원 최웅지, 목포한국병원 박영훈, 목포한국병원 추대혁, 진도한국병원 신윤호, 목포한국병원 박현재, 목포중앙병원 김용권, 무안종합병원 김동환, 목포한국병원 주정민, 목포중앙병원 심재철, 강진의료원 박성혁, 완도대성병원 임계홍이지현 기자 bluesky@hankyung.com"
44,한국경제TV,"전공의 ""파업 지속""…의료 대란 불가피","인턴 레지던트 등 전공의들이 무기한 집단휴진을 계속하기로 했다. 일부 대학병원에서는 교수들도 파업에 참여하는 방안을 논의하고 있다. 대학병원 등의 인력 공백이 길어지면서 환자들은 불편을 호소했다. 대한전공의협의회는 지난 21일부터 이어온 무기한 집단휴진을 계속하기로 했다고 30일 발표했다. 전공의들은 28~29일 한정애 국회 보건복지위원장, 국립대병원협의회, 사립대의료원협의회 등 의료계 원로 등과 잇달아 만나 집단휴진 중단 방안을 논의했다. 파국으로 치닫는 정부와 의료계 간 갈등이 봉합될 수 있다는 기대가 커졌다. 하지만 전공의들은 밤샘 회의 끝에 파업을 이어가기로 했다. 박지현 전공의협의회장은 “의료정책에서 전문가가 존중받는 분위기를 조성하기 위한 것”이라고 했다.대한의사협회는 다음달 7일부터 무기한 집단휴진하겠다고 했다. 의대 교수들도 잇달아 파업 참여 의사를 밝히면서 의료대란이 장기화할 수 있다는 전망이 나왔다.  관련기사 대전협 비대위 ""의결 과정에 절차상 문제없었다""대전협 비대위 일부 사퇴…""비대위 다수가 파업 중단 원했다""무기한 집단휴진에 진료 축소…""파업병원 안 가겠다"" 정부 ""의대정원 원점 재논의""에도…전공의 ""파업 지속""젊은 의사들, 파업 끝내 철회하지 않은 까닭은정총리 ""대전협, 고통받는 환자 외면…법에 따라 대응""한희철 의대·의전원협회 이사장 ""정부·전공의 설득하겠다""""이 정도면 됐습니다…파업 중단합시다"" 외친 한 전공의'의료 공백'에 분노한 환자들 ""파업참여 병원 불매""대전협 재투표 왜…""파업 중단 과반 안 넘었기 때문""  이지현 기자 bluesky@hankyung.com"
45,한국경제TV,'NO재팬' 따라하기?…'의료 파업 보이콧' 병원 불매 운동 등장,"의사 집단휴진 마지막날인 지난 28일 서울 연건동 서울대병원에서 전문의들이 릴레이시위와 한 시민이 일인시위를 하고 있다. /사진=강은구 기자 egkang@hankyung.com                        의료계 집단휴진에 항의하는 이들이 '파업 병원 보이콧' 운동에 돌입했다. 이들은 NO재팬 마크를 본 따, 'O'자의 심장 이미지를 넣은 후 '파업병원 가지 않습니다'라고 적힌 마크를 제작해 배포 중이다.29일 온라인상에는 '파업 병원 보이콧'이라는 제목의 페이지가 개설돼 운영 중이다. 해당 페이지 게시자는 지난 27일 ""의사 총파업 첫날, 전국 동네병원 3549곳이 휴업을 하고 휴진율이 10.8%라고 한다""면서 ""그래도 양심 있는 의사분이 많아서 다행이다""라고 적었다.이어 ""하지만 (의사들이) 환자의 목숨보다 자신의 수입, 밥그릇 챙기기에만 급급해 정부의 정책에도 반발하고 협박하고 있다""며 ""절박한 환자들을 볼모로 진료 거부하는 무책임하고 이기적인 의사들을 절대로 용납해서 안 된다""고 지적했다.  관련기사 업무개시명령 확대했지만…의사들 거부 땐 '무용지물' 정부 말 안따르면 면허정지?…의사들 ""명령고지서 반송"" 맞불한국GM 노조, 임단협 접고 파업하나…다음주 찬반투표 정부 ""오늘 전국 동네병원 2926곳 문 닫아…휴진율 8.9%""""고위험 산모, 출산 어쩌나""…응급실 밖까지 환자 줄섰다KAMC ""정부 졸속정책 멈추고 의사 국가고시 연기하라""전공의·전임의 '업무개시명령'…실제 의사들에 미칠 법적 효력은?[속보] 정부 ""전공의·전임의 조속히 복귀해 본분 지켜달라""안철수 ""정부가 의사파업 사태 악화시켜…하필 왜 지금이냐""癌수술 한달 넘게 밀리고, 응급실선 퇴짜…""환자 목숨 볼모로 삼나""  해당 홈페이지에는 다운로드 받을 수 있는 보이콧 호스피탈 마크 이미지와 함께 게시판이 운영되고 있다.                            29일 온라인상에는 '파업 병원 보이콧'이라는 제목의 페이지가 개설돼 운영 중이다. /사진=보이콧 호스피탈 홈페이지 갈무리                        이 게시판에는 불법 파업을 하고 있는 병원이 업로드되고 있다.홈페이지 관리자는 ""진료 명령을 위반해 국민으로서 진료받을 권리를 빼앗고, 불법으로 파업하는 병원을 아래 게시판에 제보해달라""고 전했다.그는 ""파업을 찬성하는 분들의 의견도 쓸 수 있도록 돼 있다""면서 ""여기 찾아주시는 분들이 파업에 대해 좀 더 이해할 수 있도록 도움을 주시고 각자의 생각을 공유했으면 한다""고 당부했다.대한의사협회(의협)는 이날 오전 제2차 전국 의사 총파업 일정을 마쳤다. 파업 기간 중 개원의들의 참여율이 낮아 1차 진료에는 큰 문제가 없었지만 전공의들이 대거 현장을 떠난 대형병원에서는 '의료 대란' 수준의 혼란이 발생했다.의협이 오는 9월7일부로 무기한 전국의사 총파업에 돌입하겠다는 뜻을 밝혔다. 이에 의사와 환자, 정부 간 갈등은 당분간 계속될 것으로 보인다.조준혁 한경닷컴 기자 presscho@hankyung.com"
46,한국경제TV,"정부 ""사직서 제출도 진료 중단""…의료계 ""우리가 노예냐""","집단휴진 총파업에 나선 대한의사협회 회원들이 8월 14일 오후 서울 영등포구 여의대로에서 열린 '4대 악(惡) 의료 정책 저지를 위한 전국의사총파업 궐기대회'에서 의과대학 정원 확대, 공공의대 설립, 한방 첩약 급여화, 비대면 진료 육성 등에 반대하며 손 피켓을 들고 있다. 사진=뉴스1                        보건복지부가 집단휴진에 나선 인턴, 레지던트 등 전공의들의 사직서 제출도 진료 중단으로 간주하겠다고 밝혔다. 이에 의료계는 ""사직서를 내는 것은 직업선택의 자유 영역""이라며 ""의료진이 노예냐""고 반발했다. 윤태호 보건복지부 공공보건정책관은 26일 중앙재난안전대책본부 정례 브리핑에서 '전공의들이 사직서를 낼 경우 대책이 있냐'는 질문에 ""사직서를 제출하는 행위 자체가 분명히 의료현장에서 부담으로 작용할 수 있다고 판단한다""며 ""집단적인 파업의 한 일환으로서 제시되는 사직서의 경우에는 여전히 의료법 제59조 2항에 따른 정당한 사유 없이 진료를 중단하는 것에 해당한다고 볼 여지가 분명히 있고, 업무개시명령을 발령할 수 있다는 판단이 있다""고 했다.앞서 보건복지부는 공공의대 추진 등에 반발하며 전공의들이 집단휴진에 나서자 업무개시명령을 내렸다.   관련기사 [속보] 복지부 차관 ""시민단체가 공공의대 학생 추천, 사실 아냐""시민단체가 의사도 뽑나? 또 '공정' 건드린 정부[종합]시민단체가 공공의대생 뽑는다니…""현대판 음서제"" ""현대판 음서제 아니냐""…논란 키운 '공공의대 선발' 해명안철수 ""공공의대 입학생 시민단체 추천? 대놓고 불공정사회""공공의대생 추천 누가? 시도지사→시민단체→돌고돌아 '미정'[종합]""공공의대생을 왜 시민단체·시도지사가 추천하죠?""2차 전국의사파업 D-1…응급실·수술 어쩌나코로나 대유행 조짐인데…전공의 21일부터 무기한 파업 예고[현장+] '의료대란'은 없었다…""평소와 다를 것 없는 하루""  이 명령을 정당한 이유 없이 따르지 않으면 면허정지 처분이나 3년 이하의 징역 또는 3000만원 이하의 벌금형을 받을 수 있다. 만약 의료법 위반으로 금고 이상의 처분을 받으면 의료인 결격 사유로 인정돼 면허까지 취소될 수 있다.복지부는 이날 수도권 수련병원의 응급실과 중환자실부터 현장 조사를 통해 근무 여부를 확인할 예정이다.이후 수도권 수련병원의 수술·분만·투석실을 시작으로 수도권의 응급·중환자실, 비수도권의 수술·분만·투석실 등 필수 진료 부문을 대상으로 순차적으로 개별적으로 업무개시 명령을 발령할 계획이다.박능후 보건복지부 장관은 ""응급실과 중환자실에서 촌각을 다투는 환자의 생명을 위협하는 진료공백을 방치할 수 없다""며 이 같은 조치를 취한 이유를 설명했다.이에 대해 의료계에선 ""의료진은 사직서도 마음대로 못 쓰나""라며 ""자유민주주의 국가가 맞느냐""고 반발하고 있다. 한편 이들은 의대 정원 확대와 공공의료대학 설립 계획, 한방 첩약 급여화 시범사업과 비대면 진료 육성책 등의 철회를 요구하고 있다. 김명일 한경닷컴 기자 mi737@hankyung.com"
47,한국경제TV,"감염학회 ""코로나19 상황 엄중…거리두기 3단계 격상 불가피""","(사진=뉴스1)                        대한감염학회 등 유관학회가 신종 코로나바이러스 감염증(코로나19) 상황이 엄중하다며 사회적 거리두기 3단계 격상이 불가피하다고 주장했다.학회는 24일 성명을 통해 ""지난 23일 0시를 기준으로 전국적인 사회적 거리두기 2단계가 됐지만 현재 유행 상황에 대응하기에는 역부족""이라며 이같이 밝혔다.학회는 ""지난 2주간 국내에서 발생한 코로나19 신규 환자가 2000명이 넘는다""며 ""이번 유행은 우리가 경험해 온 것과는 다른 규모의 피해를 남길 가능성이 높다""고 진단했다.  관련기사 박능후 ""코로나19 방역업무 방해, 응분의 조치 취할 것""부산교육청, 2학기 대비 방역물품·인터넷 통신비 지원장례 목적으로 입국한 며느리·사위도 자가격리 '면제' 대구 코로나19 추가 확진 '0명'…19일 이후 닷새 만中매체 ""한국, 코로나 확산 갈림길…방역태도 느슨해진 탓""예비부부 코로나로 고민인데…청담동 스몰웨딩업체, 계약금 '먹튀'사랑제일교회 서울 양성률 21.7%…평균의 34배코스피 2600까지 간다…외국계IB 목표치 잇따라 올려[이슈+][속보] 태안서 70대 남성 코로나 확진…광화문집회 참석자 접촉기독교계에 편지 쓴 이재명 ""이웃 향한 사랑이 예수님 가르침""  학회는 ""병상이 급속도로 포화하는 등 의료체계도 감당하기 어려운 한계에 이르렀다""며 ""방역 조치는 조기에 적용돼야 충분한 효과를 거둘 수 있다""며 정부의 결단을 촉구했다.그러면서 코로나19 유행이 중차대한 만큼 정부와 의료계가 힘을 모아야 할 때라고 강조했다.학회는 ""정부는 4대 의료정책 추진을 중단하고 의료계와 원점에서 재논의할 것을 약속해달라""며 ""정부와 보건의료단체 간 상식적인 대화 채널을 만들고 최근 이슈가 된 의료정책 추진과 관련해 합의 도출을 위한 로드맵을 마련해달라""고 요청했다.국민들에게도 코로나19 위기 극복에 적극적으로 동참해달라고 했다.학회는 ""가급적 대면 활동을 최소화하고 불가피한 모임 속에서 사회적 거리두기와 마스크 착용을 꼭 실천해 달라""며 ""올바른 방법으로 마스크를 착용하고 손 위생도 꼭 지켜달라""고 당부했다.이날 성명은 대한감염학회, 대한결핵및호흡기학회, 대한소아감염학회, 대한응급의학회, 대한의료관련감염관리학회, 대한임상미생물학회, 대한중환자의학회, 대한항균요법학회, 한국역학회가 공동 발표했다.한경닷컴 뉴스룸 open@hankyung.com"
48,한국경제TV,"안철수 ""정부, 코로나 전시 상황에 장수들 등뒤에서 짱돌 던져""","안철수 국민의당 대표가 지난 20일 서울 여의도 국회에서 열린 제37차 최고위원회에서 발언을 하고 있다. /사진=뉴스1                        안철수 국민의당 대표(사진)는 24일 최근 우려를 낳고 있는 의사 총파업과 관련해 "" 발표 시기의 부적절성과 과정의 문제점을 지적하지 않을 수 없다""고 지적했다.안철수 대표는 이날 서울 여의도 국회에서 열린 최고위원회의에 참석해 ""신종 코로나바이러스 감염증(코로나19) 위기 속에 혼신의 힘을 다하는 의사들을 독려해도 모자랄 판에, 의사들과 소통 노력도 없이 공청회도 없이 정책을 밀어붙이고 있는 정부가 문제""라며 이같이 말했다.안철수 대표는 ""위기 속에서 국정을 책임진 제대로 된 정부 여당이라면 방역의 최전선을 책임진 사람들이 자기의 직무에 집중할 수 있는 환경을 만들고 지원하는 것을 최우선 과제로 삼아야 한다""라며 ""정부가 말하는 대로, 지금은 코로나 전시 상황이기 때문이다. 그런데 문재인 정부는 완전히 그 반대의 모습을 보여주고 있다""고 강조했다.  관련기사 '라임 의혹' 기동민 감싼 與…통합 ""정청래, 무식하고 무례"" [여의도 브리핑]안철수·진중권, 유튜브 대담…""文 행방불명, 朴과 다른점은?""의료자원 '한계상황'…서울·경기 병상가동 80% 넘어 '대구 봉사' 안철수 ""文, 코로나 방역 이용한 삼류정치 중단해라""김부겸 ""코로나 비상시국회의 제안…종교·의료계 힘모으자""안철수·진중권 ""개혁 정권? 자기들이 적폐"" 직격탄안철수·진중권 ""민주당에서 '적폐청산' 싹 사라진 이유?""안철수·진중권 ""적폐청산 멈춘 이유? 자기들이 적폐라서""안철수 ""文 기념사, 안이하고 평범해서 김원웅 발언이 더 부각""보수단체 광복절집회와 통합당 엮어 비판한 與 [여의도 브리핑]  코로나 와중에 의료 정책 밀어붙이기...전투중에 장수들에 짱돌 던진 셈 이어 ""10년 이상이 지나야 효과를 판단할 수 있는 정책을 꼭 지금, 이 시점에서 밀어붙이는 게 국민에게 도움이 되는 일인가""라며 ""전투가 한창인 상황에서, 장수들 등 뒤에서 도와주기는커녕 짱돌을 던지는 것 아닌가""라고 덧붙였다.그는 ""과정도 문제투성이다. 국가 의료체계의 큰 변화를 가져오는 정책을 제대로 된 공청회나 당사자들의 충분한 의견수렴도 없이 밀어붙이고, 반발하면 면허정지니 행정명령이니 윽박지르는 정부의 모습을 보면서, 꼭 이렇게 해야만 하냐고 묻는다""라며 ""이것이 전형적인 억압 행정이고 불통 행정 아닌가""라고 전했다.그는 또 ""직접 30도가 넘는 무더위 속에 방호복을 입고 바이러스와 싸울 수 없다면, 지금 이 시간에도 코로나19 최전선에서 싸우는 의료진을 자극하고, 상황 해결에 도움이 되지 않는 말은 꺼내지 말아야 한다""라며 ""정부가 의대 정원을 늘리려는 이유를 이해하지만, 지금도 지방 의대 정원의 상당 부분이 수도권 학생으로 채워지는 상황에서 지방 중심으로 의대 정원을 증원한다고 10년간 지방 근무를 강제한다고 문제가 해결되지 않는다""고 했다.안철수 대표는 ""근본적인 해결책 제시 없이 왜 의사들이 수도권과 대도시에만 있느냐고, 왜 성형외과나 피부과로만 몰리느냐고 백날 이야기해 봤자 바뀌는 것은 아무것도 없을 것""이라며 ""의대 정원 증원 문제를 포함한 종합적인 의료체제 개편 문제는 코로나19 종식 이후에 공론화를 하면서 논의해도 늦지 않는다""고 목소리를 높였다.의료계를 향해선 ""가장 중요한 것은 국민들의 공감을 얻는 일""이라며 ""파업을 철회하고, 왜 정부의 정책이 올바른 해결책이 아닌지 설명하고, 취약지역의 국공립병원 설립과 합리적인 의료수가 등에 대해 진정한 대안을 제시하면, 국민들도 손을 들어주실 것""이라고 호소했다.문재인 대통령을 향해선 ""코로나19 재확산이라는 위기 앞에서 의사 총파업 문제 해결을 위해 대통령께서 직접 나설 의향은 없는가""라며 ""지금은 대한민국에 주어진 가장 큰 과제는 코로나19 극복이고 이를 위한 의료계의 파업 철회가 절실하다""고 했다.조준혁 한경닷컴 기자 presscho@hankyung.com"
