,Press,Title,Text
11,한국경제TV,"한국노총·보건노조 ""여당-의협 합의는 공공의료 강화 포기""","보건의료노조 등 시민단체들이 4일 청와대 분수대 앞에서 여당과 의협 합의를 규탄하고 있다. / 사진=연합뉴스                        한국노동조합총연맹(한국노총)과 전국보건의료산업노동조합(보건의료노조)은 4일 더불어민주당과 대한의사협회(의협)의 합의를 두고 ""공공의료 강화를 포기한 것""이라며 일제히 비판했다.한국노총은 이날 성명을 내고 정부·여당과 의협이 의대 정원 확대, 공공의대 신설 등 의료정책 추진을 중단하고 원점 재논의하는 대신 집단휴진을 철회하기로 한 합의에 대해 ""사실상 공공의료 강화에 대한 포기 선언""이라고 규탄했다.한국노총은 의사 인력 확충, 공공의대 설립 방안이 지난 7월 체결된 코로나19 위기 극복 노사정 협약에 포함된 내용이라면서 ""사회적 대화의 의미를 훼손한 행위""라고 주장했다.  관련기사 최대집, 전공의 반발 움직임에 ""더 이상 집단행동 안 된다""최대집 ""투쟁 자체가 목적 아냐…이제는 진료 현장 복귀해야""민주당의 백기투항?…""의대 증원·공공의대 원점부터 재논의"" [속보] 정부·의협 합의도 타결…오전 11시 합의문 서명집단휴진 끝났다…의대 정원확대 추진 중단 합의 [전문]포퓰리즘 광풍에도…경제관료들은 ""예스""""허준 스승도 공공의대 추천서 불태웠을 것""…젊은 의사들 '패러디 열전'복지부 ""공공의대도 보통 입시처럼 시험·학점·면접으로 선발""""전교1등만 의사?"" 의료정책연구소 사과 ""쉽게 풀어쓰려다…""정치권 특위 제안에…의사협, 3일 협상안 마련  이어 ""자신들의 이익을 관철하기 위해 환자를 볼모로 삼아 집단휴진을 진행한 의협을 어느 국민이 믿을 수 있겠는가""라면서 ""환자를 볼모로 잡는 의사는 더 이상 의사가 아니며 집단 이기주의에 발목이 잡힌 정부는 더 이상 국민을 위한 정부가 아니다""라고 성토했다.보건의료노조도 같은날 청와대 앞 분수대에서 시민단체들과 공동 기자회견을 열어 ""시민의 건강과 안전에 직결된 공공의료 정책을 논의하며 시민을 배제하고 이익단체인 의사단체의 요구를 들어줬다""고 지적했다.보건의료노조는 ""의사단체가 시민 안전을 내려놓고 자신들의 기득권을 위해 집단휴진을 이어간 비윤리적 행위도 모자라 의료 공공성 논의까지 좌초시켰다""면서 ""공공의료 강화 없이 감염병을 성공적으로 방역하고 지역 간 의료 불평등을 해소하는 건 불가능하다""고 역설했다.한경닷컴 뉴스룸 open@hankyung.com"
12,한국경제TV,"의료계, 대정부 단일 요구안 마련…'원점 재논의' 포함 됐나","서울 용산구 대한의사협회 회의장 앞에서 김대하 대변인이 취재진의 질문에 답하고 있다.(사진=연합뉴스)                        개원의, 전공의, 전임의, 의대생들을 모두 포함한 의료계가 대정부 단일 요구안을 마련했다.의료계는 3일 오후 범의료계 4대악 저지투쟁 특별위원회(범투위)에서 대정부 단일 요구안을 공식적으로 의결했다.요구안의 내용은 공개되지 않았으나 파업 중단 조건으로 일관되게 주장해 온 정부 정책의 '원점 재논의' 등이 포함됐을 것으로 예상된다.  관련기사 [속보] 의료계, 단일 합의안 도출…""요구안으로 국회·정부와 대화""정부·의료계 갈등 완화될까…정부 ""합의안 최대한 존중"" [종합][속보] 정부 ""'원점 재논의' 등 여당·의료계 합의안 최대한 존중"" '전교1등 의사 vs 공공의대 의사' 누구 선택할 거냐는 의협[속보]정부 ""국회-의료계 논의 결과 기다려…합의 결과 존중""[속보]""정부·국회·의료계 약속 믿고 전공의들은 복귀해달라""[속보] 김태년 ""공공의료, 국회 특위 서두르겠다…의료계와 협의""한정애 국회 복지위원장 ""의료정책 일방강행 않겠다…의사들 돌아와달라""안철수 ""공공의대 강행하면 '돌팔이 천지' 될 것""'의사 파업'에 여권 맹공…""전두환 밑에선 파업 생각 못했을 것""  국회에서도 '원점 재논의'를 시사한 상황이어서 향후 논의가 급물살을 탈 수 있다. 앞서 더불어민주당 한정애 정책위의장은 의료계가 반대하는 정책을 '제로 상태'에서 논의할 수 있다고 밝힌 바 있다.현재 의료계에서는 의대 정원 확대, 공공의대 신설, 첩약 급여화, 비대면 진료 육성 등을 반대하고 원점에서 재논의할 것을 요구하고 있다.그동안 의정 간에는 의료계 원로까지 나서 중재하며 여러차례에 걸쳐 대화와 협상이 오갔지만 결실을 맺진 못했다.이번 단일협상안은 그간 의료계 내부에서 집단행동에 가장 적극적으로 참여해온 전공의 등 젊은 의사들의 목소리를 수용했기에 더욱 기대감을 모으고 있다.의료계는 이른 시일안에 단일안을 들고 정부·여당과 협상에 나설 방침이다.정부도 의료계와 여당 간 합의를 존중하겠다고 밝힌 만큼 협상이 원만하게 진행된다면 조만간 의료공백 상황도 해소될 것으로 보인다.반면 정부가 의료계의 단일 요구안을 받아들이지 않으면 의협은 7일 예고한 3차 전국의사 무기한 총파업에 들어가는 등 의정갈등이 계속될 것으로 우려된다.한경닷컴 뉴스룸 open@hankyung.com"
13,한국경제TV,"정치권 특위 제안에…의사협, 3일 협상안 마련","전공의 파업 13일째를 맞은 2일 정치권이 정부와 의료계 간 갈등 중재에 발빠르게 나서고 있다. 정치권이 공공의대 설립 등을 포함해 의료정책 현안을 폭넓게 논의하겠다는 입장을 보이면서 정부 내부에서도 기류 변화가 감지되고 있다.김태년 더불어민주당 원내대표는 이날 최고위원회의에서 “야당과 신속하게 논의해 국회 특위 구성을 서두르겠다”며 “특위에서 의료계가 요구하는 여러 개선책에 대한 충분한 의견을 듣고 좋은 정책을 만들 것”이라고 했다.특위엔 여야 의원은 물론 전문가와 대한의사협회 등 의료계 단체가 참여하도록 할 계획이다. 민주당은 국민의힘도 여야정 협의체 구성을 제안한 만큼 국회 특위 구성에 반대할 이유가 없다고 보고 있다.  관련기사 ""전교1등만 의사?"" 의료정책연구소 사과 ""쉽게 풀어쓰려다…""""어느덧 의새"", ""제2의 전광훈""…의사에 '맹공' 퍼붓는 與 인사들 ""환자 내팽개치고 나갔다?""…젊은 의사들 향한 비난보다 더 필요한 것 간호사 격려한 文 대통령, 의사 파업 에둘러 비판?文 대통령 ""파업 속 현장지키는 간호사들께 감사""…인력확충 등 약속국립법무병원 공무원 의사 11명 '사표'…""잘못된 의료정책""[속보]""정부·국회·의료계 약속 믿고 전공의들은 복귀해달라""""어린이집 입소 우선 순위 확대"" 영유아보육법 시행규칙 일부 개정정총리 ""전공의 업무 복귀 늦을수록 환자 고통 늘어…돌아오라""與 ""의료정책 원점 재검토""…의사파업 돌파구 여나  주호영 국민의힘 원내대표는 지난달 31일 기자간담회에서 “국회 내에 의료계와 여야정 협의체를 구성하고 원점에서 재논의하자”며 “의료계 목소리가 반영되도록 의협은 물론 전공의협의회, 의학전문대협회 등 관련 의료단체의 참여가 보장돼야 한다”고 제안했다.국회 보건복지위원회 여당 간사인 김성주 민주당 의원은 이날 보도자료를 내고 공공의대 설립 추진 배경을 설명했다. 김 의원은 “공공의대로 불리고 있는 최근 현안은 학부 과정이 아니라 석·박사 과정의 공공보건의료대학원”이라며 “대학원 선발에 특정인이나 특정 단체는 개입할 수 없고 국립대 특채 논란도 법안 심사 과정에서 조문을 명확히 해 오해가 없도록 하겠다”는 뜻을 밝혔다.중재 역할을 맡고 있는 한정애 민주당 정책위 의장은 전날 최대집 의협 회장과 만나 “‘제로’ 상태에서 논의하자”며 한발 물러서 의료계에 퇴로를 열어줬다. 한 의장은 이날 “지역 불균형 해소, 필수의료 강화, 공공의료 확충 등 세 가지 대전제를 기본 목표로 둔다면 나머지는 방법상 문제”라고 말했다. 정치권이 특위 등 협의체 구성을 통한 문제 해결을 제안함에 따라 의료계의 수용 여부에 관심이 쏠리고 있다. 대한의사협회는 3일 회의를 열고 협상안을 마련할 것으로 알려졌다.박상익/고은이 기자 dirn@hankyung.com"
14,한국경제TV,'전교1등 의사 vs 공공의대 의사' 누구 선택할 거냐는 의협,"당신의 생사를 판가름 지을 중요한 진단을 받아야 할 때, 의사를 고를 수 있다면 둘 중 누구를 선택하겠습니까?Ⓐ 매년 전교 1등을 놓치지 않기 위해 학창시절 공부에 매진한 의사Ⓑ 성적은 한참 모자라지만 그래도 의사가 되고 싶어 추천제로 입학한 공공의대 의사‘의사 총파업’을 주도한 대한의사협회(의협) 산하 의료정책연구소가 정부의 국립공공보건의료대학(공공의대) 설립 추진을 비판하기 위해 제작한 게시물 내용이다.의료정책연구소는 지난 1일 페이스북 페이지에 ‘정부와 언론에서는 알려주지 않는 사실 : 의사파업을 반대하시는 분들만 풀어보세요’ 제목의 카드뉴스 형태 게시물을 올렸다.공공의대 설립을 비롯해 의과대학 정원 확대, 한방 첩약 급여화, 비대면 원격의료 등 정부 정책에 대해 문제를 내고 2가지 보기를 제시하는 형식을 택했다.  관련기사 복지부 ""공공의대도 보통 입시처럼 시험·학점·면접으로 선발""""전교1등만 의사?"" 의료정책연구소 사과 ""쉽게 풀어쓰려다…""""어느덧 의새"", ""제2의 전광훈""…의사에 '맹공' 퍼붓는 與 인사들  ""환자 내팽개치고 나갔다?""…젊은 의사들 향한 비난보다 더 필요한 것文 ""코로나19에 힘쓴 의료진은 간호사""…통합당 ""갈라치기""""공공의대는 선거용…정세균 총리가 전화 걸어 압박했다""간호사 격려한 文 대통령, 의사 파업 에둘러 비판?[속보]정부 ""국회-의료계 논의 결과 기다려…합의 결과 존중""[속보]""정부·국회·의료계 약속 믿고 전공의들은 복귀해달라""[속보] 김태년 ""공공의료, 국회 특위 서두르겠다…의료계와 협의""  또 다른 문항에서도 “두 학생 중 의사가 되어 각각 다른 진단을 여러분께 내렸다면 다음 중 누구의 의견을 따르시겠습니까?”라고 물은 뒤 ‘Ⓐ 수능 성적으로 합격한 일반의대 학생’과 ‘Ⓑ 시민단체장의 추천을 받아 시험을 치르지 않고 입학한 공공의대 학생’ 두 가지 보기를 선택지로 제시했다.이어 보건복지부의 공공의대 관련 카드뉴스 내용을 갈무리한 뒤 “정말 객관적이고 합리적으로 선발이 가능할까요? 공공의대가 ‘현대판 음서제’라 욕 먹는 이유입니다”라고 언급했다.추천제 방식이 특권층 자녀가 손쉽게 의사가 되는 길을 열어줄 뿐 아니라 실력 없는 의사를 양산할 것이란 주장인 셈. 그러나 김강립 보건복지부 차관은 앞서 공공의대 학생 선발을 시민단체가 추천하는 것은 “사실과 다르다”고 해명했다. 다만 오해를 불러일으킨 점에 대해선 사과한 바 있다.의료정책연구소는 또 “절대 밥그릇 싸움이 아니기에 아직 학생인 의대생들이 반대하는 것”이라며 “정당한 주장이기에 전공의, 전문의, 개원의, 심지어 (의대) 교수님들까지 하나 된 목소리로 반대하는 것이다”라고 주장했다.의료계 주장의 정당성과는 별개로 편협한 인식에 논란이 일자 해당 게시물은 2일 현재 의료정책연구소 페이스북 페이지에서 사라졌다.의료정책연구소는 의협이 의약분업 사태를 계기로 2002년 설립한 보건의료정책연구기관으로, 홈페이지에 “정부가 일방적으로 주도하는 정책 환경에 대응해 의료계의 능동적 대안 제시와 정책 형성을 모색한다”고 소개했다.김봉구 한경닷컴 기자 kbk9@hankyung.com"
15,한국경제TV,"[속보] 정부 ""의료계의 반복적인 정책철회 요구 이해되지 않아""","                        [속보] 정부 ""의료계의 반복적인 정책철회 요구 이해되지 않아""  관련기사 [속보] 서울 동작구 카드발급 업체서 16명 무더기 확진[속보] 서울시 ""단기 전세버스 탑승객 명단 남겨라"" 행정명령[속보] 서울 코로나19 신규 확진자 이틀 연속 두자릿수…94명 증가 [속보] 경기 화성서 코로나19 확진자 2명 추가 발생[속보] 文 ""BTS, K팝 새역사 썼다…코로나로 힘든 국민께 큰 위로""[속보] 서울시교육청, 우촌초 운영 일광학원 이사 전원 해임[속보] 중국 코로나 신규확진 10명…16일째 국내감염 없어[속보] 검찰 '삼성 불법승계의혹' 수사결과 오늘 오후 발표…이재용 기소유력[속보] 검찰 오후 2시 삼성합병 의혹 수사결과 발표[속보] ""교회에서 또""…인천 계양구 한 교회서 4명 확진  한경닷컴 뉴스룸 open@hankyung.com"
16,한국경제TV,"'의료 공백'에 분노한 환자들 ""파업참여 병원 불매""","< 환자들의 호소 > 한국환자단체연합회, 한국백혈병환우회, 한국GIST환우회 등 8개 환자단체가 지난 29일 서울 연건동 서울대병원 정문 앞에서 의사들의 파업 중단을 촉구하는 기자회견을 열고 있다. 환자단체들은 “환자의 생명을 위협하는 의사의 집단행동을 중단하라”고 했다.   연합뉴스                         “환자 곁을 떠난 의사들이 환자 곁으로 돌아오는데 그 어떤 이유도, 그 어떤 조건도, 그 어떤 명분도 필요하지 않다.”전공의와 전임의 집단파업으로 암 환자 등 중증 환자들까지 제때 수술받지 못하는 사태가 속출하자 한국환자단체연합회, 한국백혈병환우회, 한국GIST환우회 등 8개 환자단체는 지난 29일 서울대병원 앞에서 이같이 촉구했다. 하지만 전공의와 전임의들이 30일 정부와 국회, 의료계 등의 요청에도 무기한 파업을 철회하지 않기로 하면서 의료 대란이 본격화될 것이라는 우려를 낳고 있다. 대학병원, 외래 진료 속속 축소30일 의료계에 따르면 서울대병원은 내과에 이어 소아과 등도 외래 진료 축소를 검토하고 있다. 서울대병원 내과는 31일부터 1주일 동안 외래 진료와 시술 등을 축소하기로 했다. 내과 교수들의 업무 부담이 가중되면서다. 일손이 달리는 소아과 등도 외래 진료 축소를 고민하고 있다. 서울성모병원 내과에서도 진료 축소 등을 논의 중이다.하루에 8500건가량의 외래 진료를 처리하는 삼성서울병원도 전공의, 전임의 파업 영향으로 외래 진료가 20% 이상 줄었다. 삼성서울병원을 비롯한 다른 병원들도 이달 초 의사들의 집단행동과 신종 코로나바이러스 감염증(코로나19) 재확산으로 외래 진료를 10%가량 조정한 상태다.  관련기사 대전협 비대위 ""의결 과정에 절차상 문제없었다""대전협 비대위 일부 사퇴…""비대위 다수가 파업 중단 원했다""무기한 집단휴진에 진료 축소…""파업병원 안 가겠다"" 전공의 ""파업 지속""…의료 대란 불가피정부 ""의대정원 원점 재논의""에도…전공의 ""파업 지속""젊은 의사들, 파업 끝내 철회하지 않은 까닭은정총리 ""대전협, 고통받는 환자 외면…법에 따라 대응""한희철 의대·의전원협회 이사장 ""정부·전공의 설득하겠다""""이 정도면 됐습니다…파업 중단합시다"" 외친 한 전공의대전협 재투표 왜…""파업 중단 과반 안 넘었기 때문""  대형 병원은 전공의, 전임의가 빠지면서 교수들이 야간당직을 서기 시작했다. 당직 다음 날은 진료나 수술이 불가능하고 당직 주기가 짧아질수록 피로 누적이 심해진다. 이에 따라 외래 진료를 축소할 수밖에 없다는 것이 병원 관계자들의 설명이다. 서울 주요 대학병원의 수술 건수도 절반 정도 줄었다. 전공의들 사이에서도 내분                            전공의, 전임의, 개원의 파업을 비판하는 사람들은 홈페이지를 만들어 파업에 참여한 병의원 명단을 공유하는 등 불매운동 움직임에 나서고 있다. 이곳에는 지난 26~28일 2차 총파업에 참여한 병의원 이름이 일부 올라왔다. 한 네티즌은 전공의들이 파업에 참여하는 대형 병원의 책임이 개인병원보다 크다는 글을 올리기도 했다.보건의료노조 간호협회 등 의료계 내부에서도 의사들의 불법 파업을 비난하는 목소리가 나오고 있는 가운데 전공의들 사이에서도 내분이 일고 있다.대한전공의협의회 비상대책위원회에 참여한 일부 전공의는 “비대위 다수는 파업 중단을 원했지만 박지현 전공의협 비대위 회장이 독단적으로 절차상 불필요한 일선 전공의 대표모임인 임시전국대표자비상대책회의에 표결을 부쳤다”고 주장했다. 이들은 “일선 전공의들은 정보도, 맥락도 없이 궁지에 몰려 뭉쳐야 한다는 의식으로 과열된 상태였다”며 “정당하지 못한 의사결정 과정, 파업의 결과로 초래될 피해에 대한 책임은 박 회장이 져야 한다”고 했다.페이스북의 ‘일하는 전공의’ 계정에 글을 올린 한 전공의는 “‘젊은 의사 단체행동’이란 이름으로 시작한 행동이 의대생, 전임의, 교수, 일선 의사 등을 움직여 한목소리로 올바른 의료정책 수립을 외치도록 한 것은 대단히 고무적인 일”이라면서도 “정부와 대한전공의협의회, 대한의사협회는 조속한 합의를 통해 파업을 마무리해달라”고 말했다. 정부 “환자 고통 외면한 결정”정부는 전공의 파업에 강경 자세를 보이고 있다. 정세균 국무총리는 30일 중앙재난안전대책본부 회의에서 “생사의 갈림길에서 고통받는 환자들을 외면한 결정”이라며 “정부가 진정성을 갖고 대화를 시도했음에도 이런 결정이 내려져 깊은 유감을 표한다”고 했다.정부는 생명과 직결되는 응급실과 중환자실 담당 의료진부터 법적 절차에 나설 방침임을 내비쳤다. 손영래 중앙사고수습본부 전략기획반장은 “정부는 어떤 경우라도 국민 생명과 안전을 최우선으로 보호해야 하는 의무가 있다”며 “진료 거부에 따른 환자들의 인명 피해가 발생하는 상황에서 왜 전공의들은 고용이나 신분상 어떤 피해도 봐선 안 된다는 것인지 추가적인 설명이 필요하다고 생각한다”고 했다.보건복지부도 “국민 생명과 안전을 고려하지 않은, 정당치 않은 결정”이라며 “코로나19로 엄중한 상황에 의사로서 소명을 다할 수 있도록 진료현장으로 즉시 복귀해달라”고 했다.박상익 기자 dirn@hankyung.com"
17,한국경제TV,"[속보] 정부 ""의료계와 4대 정책에 대해 열린 자세로 대화하겠다""","                        정부 ""의료계와 4대 정책에 대해 열린 자세로 대화하겠다""  관련기사 [속보] 사랑제일교회, 서울 양성률 22%[속보] 서울시 ""모든 8·15집회 참가자 검사…비용 무료, 익명도 가능""[속보] 평택서 광화문집회 다녀온 조부모 통해 손자 확진 [속보] 창원시, 지역 내 827개 모든 어린이집 휴원[속보] 서울 97명-경기 85명-인천 20명-대전·충북 각 10명-충남 8명 등[속보] '코로나19' 266명 신규확진…나흘만에 200명대로[속보]광명남초교 돌봄교사 코로나 확진…367명 전수 조사[속보] 간호사 등 확진 천안 순천향대병원 직원 5명 추가 확진[속보] 코스닥, 외국인 '사자'에 장중 800선 회복[속보] '광복절 집회 투입' 경찰 2명 추가 확진…총 7명째  한경닷컴 뉴스룸 open@hankyung.com"
18,한국경제TV,"의료계 편 든 주호영 ""전공의 파업은 의논 없었던 정부 탓""","                        주호영 미래통합당 원내대표가 21일 ""전공의들의 파업은 정부와 보건당국이 의대 정원 확대하는 정책을 당사자와 의논없이 일방적으로 해서 그런 것""이라고 했다. 그러면서 ""정부는 지금이라도 의료계와 국민 말 들어라""고 촉구했다. 주 원내대표는 이날 시도당위원장 회의에서 ""우리 국민 1인당 의사 수가 경제협력개발기구(OECD)에 비해 적다고 하지만, 사실 의료수가가 제대로 반영 안돼 정작 중요파트 의사가 부족하고 성형 등 편한 쪽으로 가는 문제도 있다""며 ""이게 의사 수가 부족해 그런 건지 아니면 정부의 의료배치 실패에 기인한 건지 정부는 의료계에 귀를 기울여라""고 주장했다. 주 원내대표는 전공의들의 파업에 대해서도 ""K-방역에 의료진의 헌신이 있었는데, 시기에 맞지않게 뜬금없이 (의대 정원 확대 안건을) 꺼낸 정부 책임이 가장 크다""고 밝혔다. 이날 수도권 주요 대학병원들의 인턴과 레지던트 등은 전공의 무기한 파업에 돌입했다. 전공의들의 무기한 파업은 의약분업 사태인 2000년 이후 20년 만의 일이다. 현재 의사협회는 '4대악 의료정책(의대정원 확대, 첩약 급여화, 공공의대 신설, 원격의료 추진)'을 저지하기 위한 집단행동에 나서고 있다.   관련기사 '의약분업' 이후 20년만…오늘부터 전공의 순차 파업 시작박주민 ""코로나 확산 통합당 책임있어""…주호영 ""엮지마라""김종인 ""'5.18 사과'는 시작…역사매듭 풀고 미래로 갈 것"" 정부와 협상 결렬…의협 ""집단 휴업 강행""한희철 KAMC 이사장 ""기초의학 토대 없이 노벨의학상 꿈 못 꿔""박능후 복지부 장관, 파업 예고한 최대집 의협 회장과 회동총파업 앞둔 의협, 긴급 회동 제안…복지부 ""환영""'텃밭' 대구 찍고 '불모지' 광주로…김종인 외연확대 '광폭 행보'주호영 ""뭘 사과? 우리가 주최했나…억지로 엮지마""김부겸 ""코로나 비상시국회의 제안…종교·의료계 힘모으자""  고은이 기자 koko@hankyung.com"
