,Press,Title,Text
20,한겨례,‘코로나 방역 방해’ 신천지 간부 7명 기소…이만희는 조사 중,"신천지예수교 증거장막성전(신천지)에 대한 수사를 진행 중인 검찰이 지난 5월22일 오전 신천지 과천 총회본부 안으로 압수수색을 위해 들어가고 있다. <연합뉴스>수원지검 형사6부(부장 박승대)는 정부의 코로나19 방역 활동을 방해한 혐의(감염병예방법 위반, 위계에 의한 공무집행 방해, 증거인멸 및 교사 등)로 신천지예수교 증거장막성전(신천지) 과천 총회본부 소속 총무 ㄱ씨 등 3명을 구속기소하고, 4명을 불구속기소 했다고 28일 밝혔다.ㄱ씨 등은 신천지 대구교회를 중심으로 코로나19가 확산하던 지난 2월 방역 당국에 신도명단과 집회장소를 축소해 보고하는 등 허위의 자료를 제출하고, 검찰 수사에 대비해 관련 자료를 폐기하는 등 증거를 인멸한 혐의를 받고 있다. 또 확진자와 함께 예배를 본 신도명단, 중국 우한 교회 신도의 국내 행적 등을 고의로 누락한 혐의도 받는다.앞서 검찰은 지난 6일 ㄱ씨 등 혐의가 중한 5명의 구속영장을 청구했고, 그 결과 3명을 구속했다. 다른 2명은 영장이 기각됐다. 이후 검찰은 보강조사를 거쳐 지난 27일 ㄱ씨 등 7명을 모두 기소했다.그러나 지난 17일과 23일 검찰에 소환돼 조사를 받은 이만희(89) 총회장은 기소 대상에 포함되지 않았다. 검찰은 “이 총회장에 대한 조사내용을 정리하고 검토하는 단계다. 그에 대한 구속영장 청구와 추가 소환조사 여부는 아직 결정된 바 없다”고 말했다.한편, 검찰은 지난 2월27일 전국신천지피해자연대(전피연)로부터 이 총회장에 대한 고발장을 접수해 고발인 조사를 진행하고, 신천지가 제출한 자료와 방역 당국이 확보한 자료 간의 불일치 사례를 확인하는 등 수사를 벌여왔다. 이어 지난 5월22일에는 과천 총회본부와 가평 평화의 궁전 등 신천지 관련 시설에 대해 대대적인 압수수색을 했다.김기성 기자 player009@hani.co.kr"
21,한겨례,‘관광객 맞되 코로나19 방역도…’ 머리 아픈 지자체들,"본격적인 여름 휴가철을 앞두고 관광객을 기다리는 부산 해운대해수욕장. 김영동 기자 ydkim@hani.co.kr본격적인 여름 휴가철을 앞두고 지방자치단체마다 속내가 복잡하다. 코로나19 사태 탓에 국외 관광길이 막힌 터라 국내 관광객 수가 예년보다 많을 것으로 예상하는데, 오는 관광객을 반기자니 코로나19 확산이 걱정이고 막자니 지역경제에 타격이기 때문이다.원희룡 제주도지사는 지난 1일 “제주는 70만 도민들의 생활 터전이며 국민 모두의 힐링을 위한 곳이지, 코로나19 도피처가 아니다. 여행객들은 모두 마스크를 착용하고 예방수칙을 반드시 준수해달라”는 내용의 담화문을 발표했다. 코로나19 탓에 외국으로 나가지 못하는 해외관광 수요가 제주도에 집중될 것으로 예상하고 내놓은 조처다. 서귀포시 중문관광단지의 특급호텔들은 코로나19 방역과 안전을 고려해 예약률을 80%대로 조절하고 있는데, 평일과 주말 가리지 않고 모두 이 수준의 예약률을 보인다. 제주도는 많은 사람이 모이는 해수욕장과 뷔페식당 등에는 방역지침을 마련해 관광객들에게 이를 지킬 것을 당부하고 있다.해운대와 송정 등 대규모 해수욕장이 있는 부산 해운대구는 해수욕장에서 마스크 쓰기를 의무화했다. 마스크 미착용자에겐 1차 경고한 뒤, 이행하지 않으면 즉시 벌금을 물린다. 또 해수욕장에서 술을 마시거나 음식을 먹지 못하도록 하고, 이를 어기면 최고 300만원의 벌금을 부과한다. 해운대해수욕장 파라솔 개수도 예년 4200여개에서 올해는 1800개로 줄였다. 광안리해수욕장이 있는 부산 수영구는 다음달 15일까지 해수욕장 인근 민락수변공원의 출입을 자정까지만 허용한다.강원도 평창군은 코로나19 확산에 맞춰 단체관광에서 개별관광으로 관광객 유치 방향을 확 바꿨다. 예전에는 관광객을 25명 이상 데려온 여행사에만 지원 혜택을 줬는데, 관광객 수 기준을 없애고 관광버스는 1대당 승객을 22명 이하로 태워야만 지원 혜택을 줘 승객들의 좌석별 거리두기를 유도하고 있다. 시티투어 코스도 평창바위공원과 평화길, 평창돌문화체험관, 청옥산 육백마지기 등 사람들의 접촉을 최소화하는 자연자원 위주로 바꿨다. 울산도 숙박비 지원 대상 관광객 수를 15명 이상에서 4명 이상으로 확대해 가족모임이나 소규모 친목모임 여행객에도 혜택이 돌아가도록 했다.전북도는 안전한 여행을 위해 다른 지역에서 전북을 찾은 가족 단위 관광객에게 숙박비 일부를 지원하고, 손소독제·물비누·마스크 등을 담은 ‘안전여행 꾸러미’를 제공한다. 충북 청주시는 사람들의 접촉이 적은 농촌체험마을을 방문하는 관광객에게 경비 일부를 지원한다.평창군 문화관광과 담당자는 “코로나19 사태 장기화로 관광산업 비중이 큰 지방정부의 고민이 많다. 고강도 생활 속 거리두기를 추진해 코로나19를 빨리 극복해야 하지만, 지역경제 회생을 위한 관광객 유치도 포기할 수 없는 과제”라고 말했다. 최상원 기자, 전국종합 csw@hani.co.kr"
22,한겨례,코로나19 방역 수위 높이는 동남아,"16일 마스크를 쓴 남성이 말레이시아 수도 쿠알라룸푸르의 스리 페탈링 이슬람 사원 앞을 지나고 있다. AP 연합뉴스  코로나19 확산의 주 무대가 유럽과 미국으로 옮겨간 가운데 확진자가 지속적으로 늘고 있는 동남아시아 각국도 방역 수위를 점차 높이고 있다. 무슬림 국가인 말레이시아에선 집단 감염 가능성을 차단하기 위해 이슬람 사원(모스크)을 단기간 폐쇄하기로 결정했다. <스트레이츠 타임스>는 16일 “말레이시아 이슬람개발부가 향후 열흘간 모든 이슬람 사원의 문을 닫고, 이 기간에 금요성일 예배를 포함한 모든 종교활동도 중단하라고 권고했다”고 전했다.  말레이시아 당국의 이같은 조치는 지난 15일 하루 신규 확진자가 190명이나 나오면서, 전체 확진자가 428명까지 급격히 늘어난 데 따른 것이다. 특히 지난 2월27일~3월1일 수도 쿠알라룸푸르에서 열린 대규모 이슬람 종교행사 참석자 가운데 코로나19 확진자가 급격히 늘고 있어 우려를 키우고 있다. 당시 행사엔 1만6천여명이 참석했는데, 현지 방역당국이 15일까지 신원을 확인한 것은 5천여명에 그친 것으로 전해졌다. 전날에만 14명이 추가로 확진 판정을 받은 인근 싱가포르에선 전국민을 대상으로 ‘30일 여행 자제령’을 내렸다. 전날 확진자 14명 가운데 인도네시아·태국·독일·스페인 등을 방문했던 ‘해외 감염자’ 9명이 포함된 데 따른 조처다. 싱가포르는 이날부터 지난 2주 안에 아세안(동남아시아국가연합) 9개 회원국과 일본, 스위스, 영국 등지를 방문한 이들은 싱가포르 입국 이후 14일간 자가격리에 들어가도록 했다. 인근 브루나이에서도 이날부터 외국인을 포함해 자국 내 거주하는 모든 인구에 대한 출국 금지령을 내렸다고 <더스쿠프> 등 현지 매체가 전했다. 출국 금지 기간은 명시되지 않았으며, 긴급한 이유로 출국이 필요한 사람은 총리실의 사전 승인을 받아야 한다. 인구가 44만여명에 불과한 브루나이에선 지난 9일 코로나19 첫 확진자가 나왔다. 베이징/정인환 특파원 inhwan@hani.co.kr"
23,한겨례,방역대책본부 “코로나 방역 위해 단체 산행 등 자제 당부”,"정세균 국무총리가 9일 서울시청에서 열린 신종 코로나19 대응 중앙재난안전대책본부 회의에 참석하기 위해 이동하고 있다. 연합뉴스  코로나19 신규 확진자가 10일 72명 발생해 사흘 연속 두자릿수를 유지하고 있는 가운데 방역당국이 “연휴 기간 동안 종교행사·가족 및 각종 소모임 등을 통한 추가 전파 위험에 대해서도 각별히 주의를 기울여야 하며, 가을맞이 산행이나 야외활동을 할 경우에도 방역수칙은 꼭 준수해 달라”고 당부했다.   질병관리청 중앙방역대책본부는 이날 정례 브리핑을 통해 서울 강남구 승광빌딩 관련 확진자가 3명 늘어 총 8명이 됐으며, 서울 도봉구의 다나병원 관련 격리자 중 7명이 추가 확진되어 현재 누적 확진자 58명을 기록했다고 밝혔다. 이어 경기 의정부시 마스터플러스 병원에서도 격리 중인 12명이 추가 확진되어 현재까지 누적 확진자가 49명인 것으로 집계됐다. 방역대책본부는 “최근 방문판매·유흥시설·대면 예배 등 관련 행정조치 위반 사례 12건, 마스크 미착용 및 거리두기와 명부 미작성 등 방역수칙 위반 사례가 209건이 있었다”며 “수도권의 경우 피씨(PC) 방 집합금지 완화 이후 흡연실 개방, 음식 판매, 마스크 미착용, 좌석 붙여앉기 등 방역수칙을 준수하지 않은 신고 사례가 급증했다”고 밝혔다. 이어 “종교시설의 예배·미사·법회를 포함한 모든 활동을 비대면으로 진행하고 안전한 산행을 위해 단체 산행은 자제하고 동행 인원을 최소화해달라”고 거듭 강조했다. 정환봉 기자 bonge@hani.co.kr"
24,한겨례,이인영 통일장관 “북과 언제 어디서든 코로나19 방역 협력”,"이인영 통일부 장관이 30일 오전 서울 동작구 국립서울현충원 현충탑을 찾아 분향하고 있다. 연합뉴스이인영 통일부 장관은 30일 “기회가 된다면 개성뿐 아니라 언제 어디서든 코로나 방역과 관련해 협력할 일이 있다면 해야 한다고 생각한다”고 밝혔다.이인영 장관은 이날 아침 서울 동작구 국립현충원을 참배한 뒤 북한의 코로나19 상황과 관련한 기자들의 질문에 “개성을 중심으로 격리 등 심각한 상황으로 인식하고 예의주시하고 있는데, 무엇보다 북한 주민의 건강이 나빠질 것을 우려하고, 일상생활이 힘들고 어려워지지 않을까 걱정한다”며 “우리의 정성스럽고 따뜻한 마음을 담아서 위로의 뜻을 전하고 싶다”고 말했다. 이인영 통일부 장관이 30일 아침 서울 동작구 국립현충원을 찾아 참배하고 방명록에 “평화와 공존으로 통일과 번영의 길을 열겠습니다”라고 적었다. 통일부 제공이 장관은 현충원 방명록에 “평화와 공존으로 통일과 번영의 길을 열겠습니다”라고 적었다. 이제훈 선임기자 nomad@hani.co.kr"
25,한겨례,"[속보]검찰, 코로나19 ‘방역방해’ 신천지 이만희 총회장 구속영장 청구","지난 3월2일 경기도 가평군 신천지예수교 증거장막성전(신천지) 평화의 궁전에서 열린 기자회견장에 모습을 나타낸 이만희 총회장. 공동취재사진단검찰이 정부의 코로나19 방역 활동을 방해한 혐의로 이만희(89) 신천지예수교 증거장막성전(신천지) 총회장의 구속영장을 청구했다. 신천지 자금 56억원을 횡령한 혐의도 적용됐다.  수원지검 형사6부(부장 박승대)는 “이 총회장이 방역당국에 신도명단과 시설 현황을 누락하거나 허위로 제출하고 신천지 자금 56억원가량을 횡령한 사실을 확인했다”며 감염병예방법 위반과 위계에 의한 공무집행방해, 특정경제범죄가중처벌법(횡령), 업무방해 등 혐의로 이 총회장의 구속영장을 청구했다고 28일 밝혔다. 검찰은 지난 17일과 23일 이 총회장을 소환해 코로나19가 확산하던 2월 방역당국에 신도명단과 집회장소를 축소해 보고하는 등 허위의 자료를 제출하고, 검찰 수사에 대비해 관련 자료를 폐기하는 등 증거를 인멸하도록 지시했는지 여부 등을 조사했다. 또한, 100억원대 부동산 형성 과정과 헌금을 빼돌린 의혹 등과 관련해서도 강도 높은 조사를 벌인 바 있다. 검찰은 이 총회장이 공공시설에 무단 진입해 ‘만국회의’ 행사를 수차례 강행한 혐의도 구속영장 범죄사실에 포함시켰다. 이 총회장이 2015년부터 지난해까지 신천지 신도 수천여명을 동원, 경기도 수원과 안산 등에 있는 경기장에 무단으로 진입해 종교행사를 연 게 형사처벌 대상으로 판단한 셈이다. 앞서 전국신천지피해자연대(전피연)는 지난 2월 말 감염병예방법 위반과 특정경제범죄가중처벌법상 횡령·배임 혐의로 이 총회장을 검찰에 고발했다. 이에 수원지검은 그동안 전피연 관계자를 불러 고발인 조사를 진행하고, 신천지가 제출한 신도명단과 집회장소가 방역당국이 확보한 자료와 불일치하는 사례를 확인하는 등 수사를 벌여왔다. 지난 5월22일에는 신천지 과천 총회본부와 가평 평화의 궁전, 부산과 광주, 대전 등지 신천지 관련 시설 여러 곳을 동시다발로 압수수색했다. 검찰은 이날 코로나19 방역활동을 방해한 혐의로 신천지 과천 총회본부 소속 총무 등 3명을 구속기소하고, 4명을 불구속기소했다.김기성 기자 player009@hani.co.kr"
26,한겨례,"[사설] 산발적 집단감염 확산, 고비 맞은 ‘코로나 방역’","코로나19 집단감염이 발생한 서울 구로구의 콜센터 인근의 신도림역에서 11일 오후 마스크를 쓴 시민들이 걸어가고 있다. 이정아 기자 leej@hani.co.kr서울 구로구 콜센터발 코로나19 확진자가 11일 저녁 현재 100명 가까이로 늘었다. 이번 집단감염의 추가 전파 차단이 수도권의 광범위한 전파를 막는 분수령이 될 것으로 보인다. 특히 콜센터처럼 밀집한 고위험 사업장에 대해 좀더 강력하고 실효성 있는 대책이 시급히 시행되어야 한다.콜센터 직원들은 지난달 28일께부터 인후통 등 증상이 나타났으나 근무를 계속했고 지난 8일 첫 확진자가 나온 뒤에야 자가격리 등 본격 조처를 하기 시작했다고 한다. 대구의 다른 콜센터에서도 지난달 26일 한 사원이 고열 증상을 호소했지만 담당 매니저가 체온을 측정한 뒤 1시간 넘게 근무를 시켰다는 주장이 제기됐다. 신천지 대구교회의 슈퍼전파 사건 이후 밀집된 장소에 대한 경각심이 높아졌던 걸 생각하면, 기업이 너무 안이했던 것 아니냐는 지적을 피하기 어렵다. 영업 실적을 채우지 못하면 인센티브가 깎이는 등 열악한 노동조건이 감염병 확산을 불러왔을 가능성이 있다. 정부의 구체적 지침이 없었던 것도 아쉽다. 전국에 콜센터만 700~1000개 정도로 추정된다. 노래방이나 피시방, 스포츠센터 등도 콜센터 못지않은 고위험 사업장이다. 방역당국은 이날 밀집사업장에 재택·유연근무 도입이나 좌석 간격 조정 등 감염관리 지침을 곧 마련하겠다고 밝히면서, 유증상자가 출근을 하지 않을 경우 불이익이 없도록 해달라고 강조했다. 이런 가이드라인이 제대로 작동하게 하려면 기업에 세제 혜택 등의 유인 대책 또한 필요하다는 지적에 대해서도 정부는 적극 검토하기 바란다.이번 집단감염은 확진자들의 주거지가 수도권에 흩어져 있고 이동경로도 넓어 더더욱 대응이 까다롭다. 신도림역은 하루 11만명, 구로역은 2만명이 이용하는 교통 요지다. 다행히 서울시와 경기도·인천시가 협조체제를 구축하기로 했다니 역학조사부터 서두르기 바란다. 주변을 자주 이용하는 시민들은 발열 등 증상이 있으면 적극적으로 신고하는 등 협조가 필요하다. 전문가들은 대중교통에서 감염될 가능성은 밀집시설에 비해 낮다고 본다. 지나친 공포보다 손 씻기, 얼굴 만지지 않기 같은 개인예방법을 더 철저히 실천할 때다.정은경 질병관리본부장이 이날 “지역사회 감염 우려가 커질 경우 더 전격적이고 강력한 조치가 필요할 수 있다”고 말했듯, 대구·경북 이외 지역에서 산발적 집단감염이 잇따르고 있는 지금이 감염병 확산의 고비다. 당국과 시민 모두 방역의 고삐를 바싹 죄어야 한다."
27,한겨례,"심상정, “코로나19 방역 2단계부터 ‘전국민 재난기본수당’ 지급하자”","심상정 정의당 대표가 15일 국회 본회의에서 비교섭단체 대표 연설을 하고 있다. 연합뉴스  심상정 정의당 대표가 ‘방역단계별 코로나 재난 매뉴얼 제도화’ 필요성을 강조하며 사회적 거리두기 2단계부터 ‘전국민 재난기본수당’을 지급하자고 주장했다. 심 대표는 15일 국회 비교섭단체 대표 연설에서 코로나19로 인한 재난의 시대에 “새로운 사회계약 4대 과제”를 제안한다며 이렇게 밝혔다. 심 대표가 제안한 4대 과제에는 △방역단계별 코로나 재난 매뉴얼 제도화 △전국민 고용·소득 보험 도입 △국민 노동기본권 강화 △강력한 재정 혁신(상위 1% 초부유세 및 ‘살찐 고양이법’ 도입) 등의 내용이 담겼다. 심 대표는 코로나 방역 2단계부터 ‘전국민 재난기본수당’을 지급하자고 주장하면서 재난 피해를 본 자영업자·소상공인 등에 대한 임대료와 공과금 감면 방안을 매뉴얼에 함께 담자고 강조했다. 이에 더해 임대인도 피해 단계별 임대료 감면에 동참하게 하고 연말정산 때 감면액만큼 소득공제를 해주자고 주장했다. 심 대표는 여당이 현재 임금 기반 고용보험제도 틀을 유지하며 단계적으로 대상을 확대(2022년까지 300만명 추가 포함)한다는 계획을 “반(半)국민고용보험제도에 불과하다”고 지적하면서 전국민 고용·소득 보험 도입을 위해 ‘실시간 소득 파악 시스템’ 마련 필요성을 강조하기도 했다.  심 대표는 ‘사회계약 4대 과제’와 별도로 △차별금지법 △중대재해기업 처벌법 △건축법 및 주거기본법(주거 취약계층 주거기본권 해결) △성폭력방지법 및 비동의강간죄 처리 등 4대 입법 과제도 제안했다. 한편, 심 대표는 지난주 이스타항공 노동자 605명이 정리해고 통보를 받은 것과 관련해서는 “기업과 정부와 여당 그 누구에게서도 대량해고를 막기 위해 노력한 흔적은 눈곱만큼도 찾아볼 수 없다”며 “책임 있는 해법”을 촉구했다. 여당이 이스타항공 창업주인 이상직 의원을 공천한 만큼 민주당에도 책임이 있다는 지적이다. 연설에 앞서 열린 정의당 의원총회에서 심 대표는 “이상직 의원이 계속해서 이스타항공 문제에 대한 책임을 회피한다면 국정감사 증인으로 요청해서 책임을 규명할 것”이라고 밝혔다. 노지원 기자 zone@hani.co.kr"
28,한겨례,"추미애 “검찰, 집회제한 위반 등 코로나 방역저해 엄정 대응하라”","추미애 법무부 장관이 지난 12일 오전 경기도 정부과천청사 법무부 1층 현관으로 출근하고 있다. 연합뉴스추미애 법무부 장관이 코로나19 재확산 조짐이 일자 불법 폭력집회 등 방역을 방해하는 행위에 엄정 대처하라고 검찰에 지시했다.법무부는 17일 “코로나19 확진자 수가 급증하고 대규모 집회 등으로 전국적 확산 조짐을 보이는 등 상황이 심각해지면서 추 장관이 방역 당국의 확산 방지 조처가 적시에 실효를 거둘 수 있도록 검찰에 ‘코로나19 대규모 재확산 방지를 위헌 엄정 대응’을 지시했다”고 밝혔다.주요 지시 내용을 보면 △집합제한 명령 위반 행위 △불법 폭력집회 등 집회시위 관련 법령 위반 행위 △역학조사 방해 행위 △자가격리 위반 행위 △감염병 환자 확인을 위한 조사 진찰 거부 행위 등 방역 저해 사범에 엄정 대응하라는 주문이 담겨 있다. 추 장관은 검찰이 경찰 등 유관기관과 긴밀히 협력해달라고 당부했다.또 법무부는 범정부 ‘역학조사 지원단’에 검사와 수사관을 다시 파견하기로 결정했다. 이와 관련해 추 장관은 전날인 16일 자신의 페이스북에 올린 글에서 “코로나 대유행 조짐입니다. 법무부는 ‘역학조사 지원단’을 재가동하기로 했습니다. 방역행정에 대한 신속한 법률 지원과 포렌식을 통한 감염 매개와 경로 확인, 추가 확산 방지 등을 지원했던 1차 지원 업무의 경험을 살려 검·경의 같은 분들이 신속히 다시 모였습니다”고 설명했다. 그는 “방역 당국의 행정명령에 위배되는 행위들에 대한 신속한 법적 조처를 하도록 하여 국민의 걱정을 덜어드릴 것입니다”고 밝혔다.김정필 기자 fermata@hani.co.kr"
